title,summary,source,time_published,topics,overall_sentiment_label,overall_sentiment_score,ticker
Oracle's Security Woes Rise: Should Investors Exit ORCL Stock?,"ORCL faces dual security breaches as capital spending surges. With slowing growth and damaged trust, investors may want to reconsider positions despite AI ambitions.",Zacks Commentary,20250409T190000,"[{'topic': 'Retail & Wholesale', 'relevance_score': '0.5'}, {'topic': 'Financial Markets', 'relevance_score': '0.266143'}, {'topic': 'Earnings', 'relevance_score': '0.983783'}, {'topic': 'Technology', 'relevance_score': '0.5'}]",Neutral,-0.127969,AMZN
Amazon Faces Tariff Turbulence But Analyst Sees Favorable Trends - Amazon.com  ( NASDAQ:AMZN ) ,"Amazon faces rising cost pressure from global tariffs, with BofA Securities cutting its 2025 revenue and EPS estimates. Analyst sees Amazon gaining retail share due to low prices and strong third-party network despite margin and ad spend concerns.",Benzinga,20250409T171550,"[{'topic': 'Economy - Monetary', 'relevance_score': '0.158519'}, {'topic': 'Retail & Wholesale', 'relevance_score': '1.0'}, {'topic': 'Financial Markets', 'relevance_score': '0.905476'}, {'topic': 'Earnings', 'relevance_score': '0.977154'}]",Neutral,0.024513,AMZN
Should You Buy Pitney Bowes Stock After a 15% Dip in a Month?,"PBI's strong customer base, partners and robust financial recovery make the stock worth buying at present.",Zacks Commentary,20250409T160500,"[{'topic': 'Retail & Wholesale', 'relevance_score': '0.333333'}, {'topic': 'Financial Markets', 'relevance_score': '0.108179'}, {'topic': 'Earnings', 'relevance_score': '0.495866'}, {'topic': 'Real Estate & Construction', 'relevance_score': '0.333333'}, {'topic': 'Technology', 'relevance_score': '0.333333'}]",Neutral,0.086796,AMZN
Inquiry Into Amazon.com's Competitor Dynamics In Broadline Retail Industry - Amazon.com  ( NASDAQ:AMZN ) ,"In the fast-paced and cutthroat world of business, conducting thorough company analysis is essential for investors and industry experts. In this article, we will undertake a comprehensive industry comparison, evaluating Amazon.com AMZN in comparison to its major competitors within the Broadline ...",Benzinga,20250409T150040,"[{'topic': 'Earnings', 'relevance_score': '0.928769'}, {'topic': 'Retail & Wholesale', 'relevance_score': '1.0'}, {'topic': 'Financial Markets', 'relevance_score': '0.5855'}]",Somewhat-Bullish,0.318612,AMZN
4 Ways You Can Navigate the Stock Market Crash,"With the S&P 500 ( SNPINDEX: ^GSPC ) ending last week down more than 10% in two days, the stock market experienced its first crash since March 2020, when the COVID-19 pandemic began to escalate. The culprit this time was the U.S. enacting punitive tariffs against much of the rest of the world and ...",Motley Fool,20250409T141938,"[{'topic': 'Retail & Wholesale', 'relevance_score': '0.333333'}, {'topic': 'Financial Markets', 'relevance_score': '1.0'}, {'topic': 'Technology', 'relevance_score': '0.333333'}, {'topic': 'Finance', 'relevance_score': '0.333333'}]",Neutral,0.097934,AMZN
1 Growth Stock Down 20% to Buy Right Now,"The market is suffering under the weight of President Donald Trump's tariffs on trading partners, as investors try to understand how they'll affect companies.One growth stock that's fallen hard this year is Amazon ( NASDAQ: AMZN ) , which is down 20% year to date, as of this writing.",Motley Fool,20250409T141100,"[{'topic': 'Economy - Monetary', 'relevance_score': '0.158519'}, {'topic': 'Retail & Wholesale', 'relevance_score': '0.333333'}, {'topic': 'Financial Markets', 'relevance_score': '0.365926'}, {'topic': 'Earnings', 'relevance_score': '0.538269'}, {'topic': 'Technology', 'relevance_score': '0.333333'}, {'topic': 'Finance', 'relevance_score': '0.333333'}]",Neutral,0.135238,AMZN
"Amazon.com To $255? Here Are 10 Top Analyst Forecasts For Wednesday - Americold Realty Trust  ( NYSE:COLD ) , Amazon.com  ( NASDAQ:AMZN ) ","Top Wall Street analysts changed their outlook on these top names. For a complete view of all analyst rating changes, including upgrades and downgrades, please see our analyst ratings page. Barclays cut Americold Realty Trust, Inc. COLD price target from $26 to $21.",Benzinga,20250409T124706,"[{'topic': 'Life Sciences', 'relevance_score': '0.2'}, {'topic': 'Retail & Wholesale', 'relevance_score': '0.2'}, {'topic': 'Financial Markets', 'relevance_score': '0.752319'}, {'topic': 'Real Estate & Construction', 'relevance_score': '0.2'}, {'topic': 'Technology', 'relevance_score': '0.2'}, {'topic': 'Finance', 'relevance_score': '0.2'}]",Somewhat-Bullish,0.202773,AMZN
Quantum Computing Is a Hot Topic in the Artificial Intelligence Sector. But Which Stocks Will Still be Around Decades From Now?,A small collective of unlikely candidates is emerging as the most popular opportunities in the quantum computing industry.,Motley Fool,20250409T104500,"[{'topic': 'Retail & Wholesale', 'relevance_score': '0.25'}, {'topic': 'Manufacturing', 'relevance_score': '0.25'}, {'topic': 'Earnings', 'relevance_score': '0.108179'}, {'topic': 'Real Estate & Construction', 'relevance_score': '0.25'}, {'topic': 'Technology', 'relevance_score': '0.25'}]",Somewhat-Bullish,0.334793,AMZN
Stock Market Crash: Here's 1 High-Dividend Stock That Could Be a Steal Right Now,"Real estate investment trusts, or REITs, aren't well known for their volatility, and as a group, they tend to be more resilient than the typical S&P 500 company during tough times.We're seeing this during the recent market downturn.",Motley Fool,20250409T103200,"[{'topic': 'Economy - Monetary', 'relevance_score': '0.158519'}, {'topic': 'Retail & Wholesale', 'relevance_score': '0.5'}, {'topic': 'Financial Markets', 'relevance_score': '0.962106'}, {'topic': 'Earnings', 'relevance_score': '0.310843'}, {'topic': 'Real Estate & Construction', 'relevance_score': '0.5'}]",Somewhat-Bullish,0.181229,AMZN
Stock Market Sell-Off: The 3 Best Stocks to Buy Right Now,Now is not the time to panic. Now is the time to make rational decisions for your stock portfolio.,Motley Fool,20250409T094000,"[{'topic': 'Economy - Monetary', 'relevance_score': '0.158519'}, {'topic': 'Retail & Wholesale', 'relevance_score': '0.5'}, {'topic': 'Financial Markets', 'relevance_score': '0.99977'}, {'topic': 'Earnings', 'relevance_score': '0.95493'}, {'topic': 'Finance', 'relevance_score': '0.5'}]",Neutral,0.017013,AMZN
"Want $1,000 in Annual Dividends? Invest $17,000 in These 3 Stocks","Dividend stocks can provide you with some valuable income on a recurring basis. And the more you invest, the more you can collect in dividends. Given the decline in the stock market of late, now may be a great time for investors to scoop up some quality income stocks at attractive ...",Motley Fool,20250409T091200,"[{'topic': 'Energy & Transportation', 'relevance_score': '0.25'}, {'topic': 'Finance', 'relevance_score': '0.25'}, {'topic': 'IPO', 'relevance_score': '0.158519'}, {'topic': 'Retail & Wholesale', 'relevance_score': '0.25'}, {'topic': 'Financial Markets', 'relevance_score': '0.999975'}, {'topic': 'Earnings', 'relevance_score': '0.576289'}, {'topic': 'Real Estate & Construction', 'relevance_score': '0.25'}]",Somewhat-Bullish,0.304362,AMZN
Where Will Nvidia Stock Be in 3 Years?,"April 2, 2025, will likely go down in history books as a major turning point in international trade. Under the leadership of President Donald Trump, the U.S. has imposed substantial tariffs on imports from many of its top trading partners, including East Asian nations like Taiwan and South Korea, ...",Motley Fool,20250409T085500,"[{'topic': 'Economy - Fiscal', 'relevance_score': '0.158519'}, {'topic': 'Retail & Wholesale', 'relevance_score': '0.333333'}, {'topic': 'Financial Markets', 'relevance_score': '0.161647'}, {'topic': 'Manufacturing', 'relevance_score': '0.333333'}, {'topic': 'Earnings', 'relevance_score': '0.495866'}, {'topic': 'Technology', 'relevance_score': '0.333333'}]",Neutral,0.024372,AMZN
Warren Buffett and 8 Other Billionaires Have $8.5 Billion Invested in This Incredible Stock,Retail investors have a great opportunity to join the smart money right now.,Motley Fool,20250409T083000,"[{'topic': 'Retail & Wholesale', 'relevance_score': '0.5'}, {'topic': 'Financial Markets', 'relevance_score': '0.999701'}, {'topic': 'Earnings', 'relevance_score': '0.918141'}, {'topic': 'Finance', 'relevance_score': '0.5'}]",Somewhat-Bullish,0.306763,AMZN
Could Buying Amazon Stock Today Set You Up For Life?,"The giant of a company clearly can't live up to the incredibly high standard of its impressive past, but...",Motley Fool,20250409T081500,"[{'topic': 'IPO', 'relevance_score': '0.158519'}, {'topic': 'Retail & Wholesale', 'relevance_score': '1.0'}, {'topic': 'Financial Markets', 'relevance_score': '0.214378'}, {'topic': 'Earnings', 'relevance_score': '0.77141'}]",Somewhat-Bullish,0.253401,AMZN
Stock Market Crash: 3 Tech Stocks You Can Buy and Hold for the Next Decade,"With the stock market falling more than 10% in two days, we have officially witnessed a stock market crash. Stocks, meanwhile, remain volatile given uncertainty over the impact of tariffs and the ongoing trade war.While I would not rush into stocks, this could be a good time to start dipping your ...",Motley Fool,20250409T080000,"[{'topic': 'Retail & Wholesale', 'relevance_score': '0.333333'}, {'topic': 'Financial Markets', 'relevance_score': '0.999612'}, {'topic': 'Manufacturing', 'relevance_score': '0.333333'}, {'topic': 'Earnings', 'relevance_score': '0.839681'}, {'topic': 'Technology', 'relevance_score': '0.333333'}]",Somewhat-Bullish,0.205127,AMZN
"Cathie Wood Loads Up On $18.2 Million Worth Of Nvidia Stock, Adds $5.8 Million Worth Of Amazon Shares To Her Shopping Cart Amid Trump Tariff Upheaval - Amazon.com  ( NASDAQ:AMZN ) ","On Tuesday, Cathie Wood-led Ark Invest made significant trades involving major companies such as Amazon.com Inc. AMZN, NVIDIA Corp. NVDA, Tempus AI Inc. TEM, and Coinbase Global Inc. COIN These trades reflect Ark's strategic positioning in the market amidst fluctuating stock prices.",Benzinga,20250409T020540,"[{'topic': 'Retail & Wholesale', 'relevance_score': '0.25'}, {'topic': 'Financial Markets', 'relevance_score': '0.992549'}, {'topic': 'Manufacturing', 'relevance_score': '0.25'}, {'topic': 'Technology', 'relevance_score': '0.25'}, {'topic': 'Finance', 'relevance_score': '0.25'}, {'topic': 'Blockchain', 'relevance_score': '0.158519'}]",Somewhat-Bullish,0.335936,AMZN
Prediction: This Artificial Intelligence  ( AI )  Stock Will Be Worth More Than Nvidia in 2030,"Nvidia has emerged as one of the most valuable companies in the world thanks to the AI movement, but the company's long-term growth looks questionable.",Motley Fool,20250409T010000,"[{'topic': 'Retail & Wholesale', 'relevance_score': '0.333333'}, {'topic': 'Financial Markets', 'relevance_score': '0.858979'}, {'topic': 'Manufacturing', 'relevance_score': '0.333333'}, {'topic': 'Earnings', 'relevance_score': '0.684621'}, {'topic': 'Technology', 'relevance_score': '0.333333'}]",Somewhat-Bullish,0.305123,AMZN
Alibaba vs. Amazon: Which E-Commerce Titan is Best Stock Pick?,"BABA outshines AMZN with stronger growth, lower valuation and massive AI investments. BABA's 45.2% stock surge signals superior upside in the e-commerce race.",Zacks Commentary,20250408T190000,"[{'topic': 'Earnings', 'relevance_score': '0.997874'}, {'topic': 'Retail & Wholesale', 'relevance_score': '1.0'}, {'topic': 'Financial Markets', 'relevance_score': '0.929393'}]",Bullish,0.396774,AMZN
How IBM Soared 13% While Markets Sank in Q1 2025,IBM's stock defied market trends with a 13% gain in Q1 2025. Here's how Big Blue pulled off this impressive feat while the S&P 500 struggled.,Motley Fool,20250408T173156,"[{'topic': 'Retail & Wholesale', 'relevance_score': '0.5'}, {'topic': 'Financial Markets', 'relevance_score': '0.996023'}, {'topic': 'Earnings', 'relevance_score': '0.495866'}, {'topic': 'Technology', 'relevance_score': '0.5'}]",Somewhat-Bullish,0.294276,AMZN
Oracle Chart Flatlines As Death Cross Adds To Tech Stock's Tough Month - Oracle  ( NYSE:ORCL ) ,"Oracle stock forms a Death Cross as bearish technicals outweigh recent optimism on cloud momentum. Despite strong margins and cloud push, Oracle stock chart tells a story of oversold pressure and fading support. With stocks plunging, steady income is key.",Benzinga,20250408T155051,"[{'topic': 'Retail & Wholesale', 'relevance_score': '0.5'}, {'topic': 'Financial Markets', 'relevance_score': '0.459462'}, {'topic': 'Earnings', 'relevance_score': '0.158519'}, {'topic': 'Technology', 'relevance_score': '0.5'}]",Neutral,0.012382,AMZN
RL Vs GIII: Which Textile Apparel is a Smarter Long-Term Investment?,"With shifting consumer trends, digital expansion, cost cuts and tariff challenges, find out whether Ralph Lauren or G-III Apparel is a better pick now.",Zacks Commentary,20250408T154900,"[{'topic': 'Economy - Monetary', 'relevance_score': '0.158519'}, {'topic': 'Retail & Wholesale', 'relevance_score': '0.5'}, {'topic': 'Financial Markets', 'relevance_score': '0.658903'}, {'topic': 'Manufacturing', 'relevance_score': '0.5'}, {'topic': 'Earnings', 'relevance_score': '0.999606'}]",Bullish,0.380735,AMZN
Comparative Study: Amazon.com And Industry Competitors In Broadline Retail Industry - Amazon.com  ( NASDAQ:AMZN ) ,"In the ever-changing and fiercely competitive business landscape, conducting thorough company analysis is crucial for investors and industry experts. In this article, we will undertake a comprehensive industry comparison, evaluating Amazon.com AMZN and its primary competitors in the Broadline ...",Benzinga,20250408T150128,"[{'topic': 'Earnings', 'relevance_score': '0.928769'}, {'topic': 'Retail & Wholesale', 'relevance_score': '1.0'}, {'topic': 'Financial Markets', 'relevance_score': '0.5855'}]",Somewhat-Bullish,0.323188,AMZN
3 Tech ETFs on Sale Now,"U.S. ech stocks slumped in Q1 2025 as lofty valuations, cheaper Chinese AI, a less-dovish Fed, and trade tensions brewed a perfect storm.",Zacks Commentary,20250408T123900,"[{'topic': 'Retail & Wholesale', 'relevance_score': '0.25'}, {'topic': 'Financial Markets', 'relevance_score': '0.999816'}, {'topic': 'Manufacturing', 'relevance_score': '0.25'}, {'topic': 'Earnings', 'relevance_score': '0.360215'}, {'topic': 'Technology', 'relevance_score': '0.25'}, {'topic': 'Finance', 'relevance_score': '0.25'}]",Neutral,-0.024248,AMZN
"The Best Warren Buffett Stocks to Buy With $1,000 Right Now","Due to his success -- both personally and through his company, Berkshire Hathaway -- Warren Buffett draws a lot of attention when he speaks and makes investing moves. With Buffett's net worth of over $150 billion and Berkshire Hathaway's market cap of over $1 trillion ( as of April 7 ) , it's ...",Motley Fool,20250408T113800,"[{'topic': 'Retail & Wholesale', 'relevance_score': '0.333333'}, {'topic': 'Financial Markets', 'relevance_score': '0.99999'}, {'topic': 'Manufacturing', 'relevance_score': '0.333333'}, {'topic': 'Earnings', 'relevance_score': '0.538269'}, {'topic': 'Finance', 'relevance_score': '0.333333'}]",Somewhat-Bullish,0.200264,AMZN
Is C3.ai a Top AI Stock to Buy on the Dip?,"C3.ai ( NYSE: AI ) was one of the most popular AI investments when the AI investment wave started in early 2023. While it saw a drawdown later that year, it reached another subsequent peak in December 2024, when the stock nearly hit $43 per share.",Motley Fool,20250408T110000,"[{'topic': 'Economy - Monetary', 'relevance_score': '0.158519'}, {'topic': 'Retail & Wholesale', 'relevance_score': '0.5'}, {'topic': 'Financial Markets', 'relevance_score': '0.996023'}, {'topic': 'Earnings', 'relevance_score': '0.214378'}, {'topic': 'Technology', 'relevance_score': '0.5'}]",Neutral,0.137304,AMZN
"Despite Tariff Turmoil, Bitcoin Outperforms 'Magnificent 7' Stocks In 2025 - Records Smaller Losses Than Nvidia, Tesla, Apple - Apple  ( NASDAQ:AAPL ) ","Stocks and cryptocurrencies have been punched hard amid fears of economic fallout from President Donald Trump's sweeping tariff measures. Even so, Bitcoin, the world's largest cryptocurrency by market capitalization, has fared better than some of Wall Street's tech behemoths.",Benzinga,20250408T103704,"[{'topic': 'Retail & Wholesale', 'relevance_score': '0.333333'}, {'topic': 'Financial Markets', 'relevance_score': '0.684621'}, {'topic': 'Manufacturing', 'relevance_score': '0.333333'}, {'topic': 'Technology', 'relevance_score': '0.333333'}, {'topic': 'Blockchain', 'relevance_score': '0.576289'}]",Neutral,0.146492,AMZN
"Elon Musk's Net Worth Dives Below $300 Billion For The First Time Since November Amid Tesla Attacks And Tariff Woes - Meta Platforms  ( NASDAQ:META ) , Amazon.com  ( NASDAQ:AMZN ) ","Elon Musk, the CEO of Tesla Inc. TSLA, has seen his net worth plunge below the $300 billion mark. This significant decrease is linked to the ongoing backlash against Tesla and the implementation of new tariffs. What Happened: Musk's net worth dipped below $300 billion on Monday, a level not seen ...",Benzinga,20250408T100558,"[{'topic': 'IPO', 'relevance_score': '0.158519'}, {'topic': 'Retail & Wholesale', 'relevance_score': '0.333333'}, {'topic': 'Financial Markets', 'relevance_score': '0.266143'}, {'topic': 'Manufacturing', 'relevance_score': '0.333333'}, {'topic': 'Technology', 'relevance_score': '0.333333'}]",Somewhat-Bullish,0.287683,AMZN
Stock Market Crash: Here Are 5 Stocks Down 27% or More I'd Buy Right Now,To say that the stock market has been volatile lately doesn't do the situation justice. The S&P 500 ( SNPINDEX: ^GSPC ) and several other major market indexes recently fell by more than 10% over a two-day period in response to President Trump's surprisingly high tariff rates.,Motley Fool,20250408T094100,"[{'topic': 'Retail & Wholesale', 'relevance_score': '0.25'}, {'topic': 'Financial Markets', 'relevance_score': '0.99793'}, {'topic': 'Manufacturing', 'relevance_score': '0.25'}, {'topic': 'Earnings', 'relevance_score': '0.875462'}, {'topic': 'Technology', 'relevance_score': '0.25'}, {'topic': 'Finance', 'relevance_score': '0.25'}]",Somewhat-Bullish,0.177429,AMZN
"Wall Street Eyes Recovery As S&P 500, Nasdaq Futures Rise After Trump's Tariff-Driven Selloff Wipes Out $9 Trillion In Six Weeks - Apple  ( NASDAQ:AAPL ) , Amazon.com  ( NASDAQ:AMZN ) ",U.S. stock futures rose on Tuesday following a volatile day of trading on Monday that led the indices to close on a mixed note. Futures of major benchmark indices were higher in premarket.,Benzinga,20250408T092532,"[{'topic': 'Life Sciences', 'relevance_score': '0.2'}, {'topic': 'Technology', 'relevance_score': '0.2'}, {'topic': 'Finance', 'relevance_score': '0.2'}, {'topic': 'Economy - Monetary', 'relevance_score': '0.310843'}, {'topic': 'Retail & Wholesale', 'relevance_score': '0.2'}, {'topic': 'Financial Markets', 'relevance_score': '0.999999'}, {'topic': 'Manufacturing', 'relevance_score': '0.2'}, {'topic': 'Earnings', 'relevance_score': '0.990786'}, {'topic': 'Economy - Macro', 'relevance_score': '0.158519'}]",Neutral,0.033896,AMZN
"Trump Tariffs Test Amazon, But Goldman Says E-Commerce Giant Can Roll With It - Amazon.com  ( NASDAQ:AMZN ) ","Amazon has several ways it could mitigate the impact of tariffs on its first-party cost of goods, according to Goldman Sachs. Amazon can negotiate with vendors, raisie prices on certain items and shift its vendor base and/or product mix. Feel unsure about the market's next move?",Benzinga,20250407T201926,"[{'topic': 'Retail & Wholesale', 'relevance_score': '0.5'}, {'topic': 'Finance', 'relevance_score': '0.5'}, {'topic': 'Financial Markets', 'relevance_score': '0.161647'}]",Somewhat-Bullish,0.229218,AMZN
Disney's Content Pipeline Impresses: Time to Hold the Stock for Value?,"DIS' pipeline signals strong potential but near-term headwinds call for patience, suggesting investors hold the stock or watch for a better entry point in 2025.",Zacks Commentary,20250407T190000,"[{'topic': 'Retail & Wholesale', 'relevance_score': '0.5'}, {'topic': 'Financial Markets', 'relevance_score': '0.858979'}, {'topic': 'Earnings', 'relevance_score': '0.928769'}, {'topic': 'Technology', 'relevance_score': '0.5'}]",Bullish,0.373839,AMZN
Does Sirius XM's Broadcasting Strategy Signal a Buy for the Stock?,"SIRI expands its content portfolio in broadcasting across different interest areas, presenting a compelling investment opportunity for the stock.",Zacks Commentary,20250407T161000,"[{'topic': 'Retail & Wholesale', 'relevance_score': '0.333333'}, {'topic': 'Financial Markets', 'relevance_score': '0.108179'}, {'topic': 'Manufacturing', 'relevance_score': '0.333333'}, {'topic': 'Earnings', 'relevance_score': '0.614606'}, {'topic': 'Technology', 'relevance_score': '0.333333'}]",Somewhat-Bullish,0.212498,AMZN
Trump's Tariffs Topple Tech Stocks. Here's What Amazon Investors Should Know,"President Donald Trump announced a new batch of tariffs on April 2, and let's just say investors haven't been jumping with joy since then.The S&P 500 dropped over 10% in the two days following the announcement, the Dow Jones is in a correction, and the Nasdaq Composite is officially in a bear ...",Motley Fool,20250407T160000,"[{'topic': 'Technology', 'relevance_score': '0.5'}, {'topic': 'Retail & Wholesale', 'relevance_score': '0.5'}, {'topic': 'Financial Markets', 'relevance_score': '0.918141'}]",Neutral,0.012001,AMZN
Should You Hold on to GTLB Stock Despite Its 27% Dip in YTD?,"GTLB shares decline due to macro pressures and competition, but AI-driven DevSecOps adoption and key partnerships are promising.",Zacks Commentary,20250407T155900,"[{'topic': 'Earnings', 'relevance_score': '0.360215'}, {'topic': 'Technology', 'relevance_score': '0.5'}, {'topic': 'Retail & Wholesale', 'relevance_score': '0.5'}]",Bullish,0.441872,AMZN
Top AI Stocks to Add to Your Portfolio for Healthy Returns,"Here, we pick three AI stocks, META, IBM and OKTA, which are well poised to benefit from AI's growing pervasiveness and huge spending by tech giants.",Zacks Commentary,20250407T154700,"[{'topic': 'Retail & Wholesale', 'relevance_score': '0.333333'}, {'topic': 'Financial Markets', 'relevance_score': '0.214378'}, {'topic': 'Manufacturing', 'relevance_score': '0.333333'}, {'topic': 'Technology', 'relevance_score': '0.333333'}]",Bullish,0.369254,AMZN
Exploring The Competitive Space: Amazon.com Versus Industry Peers In Broadline Retail - Amazon.com  ( NASDAQ:AMZN ) ,"In today's fast-paced and competitive business landscape, it is essential for investors and industry enthusiasts to thoroughly analyze companies before making investment decisions. In this article, we will conduct a comprehensive industry comparison, evaluating Amazon.com AMZN against its key ...",Benzinga,20250407T150048,"[{'topic': 'Earnings', 'relevance_score': '0.928769'}, {'topic': 'Retail & Wholesale', 'relevance_score': '1.0'}, {'topic': 'Financial Markets', 'relevance_score': '0.5855'}]",Somewhat-Bullish,0.254117,AMZN
"Amazon, JPMorgan, RH And More: CNBC's 'Final Trades' - JPMorgan Chase  ( NYSE:JPM ) , Amazon.com  ( NASDAQ:AMZN ) ","Jim Lebenthal names JPMorgan Chase as his final trade. Jason Snipe said Amazon.com is 30% off the 52-week high level. With stocks plunging, steady income is key. Tim Melvin & Ryan Faloona reveal dividend stocks and deep-value plays on April 8. Reserve your spot now.",Benzinga,20250407T123735,"[{'topic': 'Earnings', 'relevance_score': '0.947132'}, {'topic': 'Retail & Wholesale', 'relevance_score': '1.0'}, {'topic': 'Financial Markets', 'relevance_score': '0.108179'}]",Somewhat-Bullish,0.248791,AMZN
Cathie Wood Goes Bargain Hunting: 3 Stocks She Just Bought,The iconic growth investor made some interesting moves during Friday's market pullback.,Motley Fool,20250407T113000,"[{'topic': 'Retail & Wholesale', 'relevance_score': '0.5'}, {'topic': 'Financial Markets', 'relevance_score': '0.999956'}, {'topic': 'Earnings', 'relevance_score': '0.614606'}, {'topic': 'Finance', 'relevance_score': '0.5'}, {'topic': 'Blockchain', 'relevance_score': '0.158519'}]",Somewhat-Bullish,0.225983,AMZN
"Goldman Sachs Raises Risk Of Recession to 45%: Jefferies Calls Tariffs a 'Free Hall Pass' For Tech Giants To Reset Their Goals - Goldman Sachs Group  ( NYSE:GS ) , Amazon.com  ( NASDAQ:AMZN ) ","Goldman Sachs Group Inc. GS is the latest investment bank to predict a recession for the U.S. economy over the next 12 months, with the odds being raised to 45%, from its previous prediction of 35%. Amidst all this chaos and uncertainty, however, there is a silver lining for the tech giants and ...",Benzinga,20250407T103740,"[{'topic': 'Retail & Wholesale', 'relevance_score': '0.333333'}, {'topic': 'Financial Markets', 'relevance_score': '0.214378'}, {'topic': 'Technology', 'relevance_score': '0.333333'}, {'topic': 'Finance', 'relevance_score': '0.333333'}]",Neutral,0.063496,AMZN
"Down 25% From Its All-Time High, Is Amazon a Buy Right Now?","Amazon ( NASDAQ: AMZN ) hasn't been immune to the marketwide sell-off seen lately. And some of the tariffs that President Donald Trump recently announced could heavily affect the company due to where most of the goods it sells come from.To add another layer of complexity, Amazon management also ...",Motley Fool,20250407T103000,"[{'topic': 'Retail & Wholesale', 'relevance_score': '1.0'}, {'topic': 'Financial Markets', 'relevance_score': '0.214378'}]",Neutral,0.040459,AMZN
