title,summary,source,time_published,topics,overall_sentiment_label,overall_sentiment_score,ticker
"Mark Cuban Says Between 'Free Trade' Elon Musk And 'Full Tariff' Trump, It Is The President Who Will Win As Stocks Futures Tank - Apple  ( NASDAQ:AAPL ) , Amazon.com  ( NASDAQ:AMZN ) ","As Donald Trump's newly imposed tariffs cause turbulence in the stock market, Elon Musk has advocated for a zero-tariff policy - but the billionaire investor Mark Cuban predicts the President's plan will ultimately win in this debate.",Benzinga,20250407T023504,"[{'topic': 'Economy - Monetary', 'relevance_score': '0.158519'}, {'topic': 'Retail & Wholesale', 'relevance_score': '0.333333'}, {'topic': 'Financial Markets', 'relevance_score': '0.955357'}, {'topic': 'Manufacturing', 'relevance_score': '0.333333'}, {'topic': 'Technology', 'relevance_score': '0.333333'}]",Somewhat-Bullish,0.195585,AMZN
"Stock Futures Tank, Dow Sheds Over 1000 Points As White House Remains Firm On Tariffs: Trump Says, 'Sometimes You Have To Take Medicine' - Apple  ( NASDAQ:AAPL ) , Amazon.com  ( NASDAQ:AMZN ) ","U.S. stock futures tumbled Sunday evening, extending last week's historic selloff as the White House stood firm on its sweeping new tariff policy despite mounting market pressure. What Happened: Dow Jones Industrial Average futures fell 1,257 points, or 3.26%, to 37,273, while S&P 500 futures ...",Benzinga,20250407T011834,"[{'topic': 'Retail & Wholesale', 'relevance_score': '0.333333'}, {'topic': 'Financial Markets', 'relevance_score': '0.77141'}, {'topic': 'Manufacturing', 'relevance_score': '0.333333'}, {'topic': 'Technology', 'relevance_score': '0.333333'}, {'topic': 'Economy - Macro', 'relevance_score': '0.158519'}]",Somewhat-Bearish,-0.213197,AMZN
"Trump's ""Liberation Day"" Tariffs Pummel the ""Magnificent Seven."" Are These Stalwarts Still a Prudent Long-Term Investment?","These days, the ""Magnificent Seven"" aren't exactly living up to their name and delivering magnificent performances. In fact, this group of tech giants that led market gains over the past two years is now leading declines. I'm talking about Alphabet ( NASDAQ: GOOG ) ( NASDAQ: GOOGL ) , Apple ( ...",Motley Fool,20250406T222000,"[{'topic': 'Economy - Monetary', 'relevance_score': '0.158519'}, {'topic': 'Retail & Wholesale', 'relevance_score': '0.333333'}, {'topic': 'Financial Markets', 'relevance_score': '0.161647'}, {'topic': 'Manufacturing', 'relevance_score': '0.333333'}, {'topic': 'Earnings', 'relevance_score': '0.310843'}, {'topic': 'Technology', 'relevance_score': '0.333333'}]",Somewhat-Bullish,0.243346,AMZN
Will Walmart's $2.3 Billion Advertising Bet Work Out Better Than Jet.com?,"Walmart ( NYSE: WMT ) is one of the largest retailers in the world. It has achieved massive success with its large format box stores, Sam's Club stores, and its smaller grocery store locations. But that doesn't mean that everything it touches turns to gold.",Motley Fool,20250406T221400,"[{'topic': 'Earnings', 'relevance_score': '0.158519'}, {'topic': 'Retail & Wholesale', 'relevance_score': '1.0'}, {'topic': 'Financial Markets', 'relevance_score': '0.161647'}]",Somewhat-Bullish,0.167358,AMZN
What Does Trump's Tariff Hike Mean for Consumer Goods Investors?,"This past week, President Donald Trump announced his full plan for tariffs on imports -- a list of duties varying by country that could make a wide range of goods pricier for U.S. companies and consumers. Stocks sank in the session following the news, and the S&P 500 and Nasdaq even posted their ...",Motley Fool,20250406T211500,"[{'topic': 'Earnings', 'relevance_score': '0.614606'}, {'topic': 'Economy - Monetary', 'relevance_score': '0.158519'}, {'topic': 'Retail & Wholesale', 'relevance_score': '1.0'}]",Neutral,0.137962,AMZN
History Says the Best Time to Buy Stocks May Be Coming,"Equities haven't performed well so far in 2025. President Donald Trump's trade wars are creating significant uncertainty, while many fear that a recession might be coming -- something else that could send the stock market in the wrong direction.",Motley Fool,20250406T191500,"[{'topic': 'Earnings', 'relevance_score': '0.495866'}, {'topic': 'Retail & Wholesale', 'relevance_score': '1.0'}, {'topic': 'Financial Markets', 'relevance_score': '0.998682'}]",Neutral,0.049401,AMZN
3 Top Bargain Tech Stocks Ready for the Next Bull Run,"Following President Donald Trump's ""Liberation Day"" tariff announcement, stocks plummeted as fears escalated regarding a potential global trade war and how it could impact the global economy. While there certainly could be more pressure on stocks in the coming weeks depending on how this all ...",Motley Fool,20250406T141500,"[{'topic': 'Retail & Wholesale', 'relevance_score': '0.333333'}, {'topic': 'Financial Markets', 'relevance_score': '0.962106'}, {'topic': 'Manufacturing', 'relevance_score': '0.333333'}, {'topic': 'Earnings', 'relevance_score': '0.875462'}, {'topic': 'Technology', 'relevance_score': '0.333333'}]",Somewhat-Bullish,0.240745,AMZN
Is This Artificial Intelligence IPO a Buy?,"Although recent stock market volatility has pushed down prices for many stocks, the artificial intelligence ( AI ) sector remains a compelling investment, with the tremendous transformative potential it brings to many industries.As Lisa Su, CEO of semiconductor giant Advanced Micro Devices, ...",Motley Fool,20250406T131300,"[{'topic': 'Technology', 'relevance_score': '0.333333'}, {'topic': 'Blockchain', 'relevance_score': '0.158519'}, {'topic': 'IPO', 'relevance_score': '0.576289'}, {'topic': 'Retail & Wholesale', 'relevance_score': '0.333333'}, {'topic': 'Financial Markets', 'relevance_score': '0.87644'}, {'topic': 'Manufacturing', 'relevance_score': '0.333333'}, {'topic': 'Earnings', 'relevance_score': '0.94762'}]",Neutral,0.098106,AMZN
5 Brilliant AI Stocks That Billionaire Chase Coleman Is Betting Big On,"Looking at what successful hedge fund managers buy and hold is a great way for investors to drum up ideas about which stocks to pick. Fortunately, anyone with over $100 million in holdings must disclose what they own to the SEC, then they make that information public knowledge 45 days after the ...",Motley Fool,20250406T113000,"[{'topic': 'Earnings', 'relevance_score': '0.158519'}, {'topic': 'Retail & Wholesale', 'relevance_score': '0.5'}, {'topic': 'Manufacturing', 'relevance_score': '0.5'}]",Neutral,0.024206,AMZN
2 No-Brainer Artificial Intelligence  ( AI )  Stocks Owned by Warren Buffett Right Now,"Warren Buffett isn't known for his tech investing. But right now, two of his largest positions are benefiting big from rising demand for artificial intelligence ( AI ) services. Most people don't think of these companies as AI businesses, but when you dig deeper, few companies stand to benefit as ...",Motley Fool,20250406T102500,"[{'topic': 'Retail & Wholesale', 'relevance_score': '0.5'}, {'topic': 'Technology', 'relevance_score': '0.5'}, {'topic': 'Financial Markets', 'relevance_score': '0.158519'}]",Somewhat-Bullish,0.186238,AMZN
2 Soaring Stocks to Hold for the Next 20 Years,Amazon and Costco could still beat the market over the next two decades.,Motley Fool,20250406T092500,"[{'topic': 'Economy - Monetary', 'relevance_score': '0.158519'}, {'topic': 'Retail & Wholesale', 'relevance_score': '1.0'}, {'topic': 'Financial Markets', 'relevance_score': '0.214378'}, {'topic': 'Earnings', 'relevance_score': '0.995015'}]",Neutral,0.142779,AMZN
1 Growth Stock Down 25% to Buy Right Now,"The markets were already on edge with concerns regarding tariffs, and President Donald Trump's ""Liberation Day"" tariff announcement sent them over the edge. While there could be some continued market pain, the sell-off has also brought some top growth stocks down to attractive levels.One growth ...",Motley Fool,20250406T081900,"[{'topic': 'Retail & Wholesale', 'relevance_score': '0.5'}, {'topic': 'Financial Markets', 'relevance_score': '0.684621'}, {'topic': 'Earnings', 'relevance_score': '0.684621'}, {'topic': 'Technology', 'relevance_score': '0.5'}]",Somewhat-Bullish,0.26179,AMZN
4 Growth Stocks Down 20% or More to Buy Right Now,"The recent market sell-off has opened the door for some good buying opportunities in growth stocks. Let's look at four that investors can buy for the long term.Down just over 20% from its highs, Amazon ( NASDAQ: AMZN ) is trading at one of its lowest valuations in its history with a trailing ...",Motley Fool,20250405T221400,"[{'topic': 'Retail & Wholesale', 'relevance_score': '0.5'}, {'topic': 'Financial Markets', 'relevance_score': '0.980922'}, {'topic': 'Earnings', 'relevance_score': '0.891286'}, {'topic': 'Technology', 'relevance_score': '0.5'}]",Somewhat-Bullish,0.269948,AMZN
3 Top Buffett Stocks to Buy and Hold for the Next 20 Years,Warren Buffett has built a fortune for Berkshire Hathaway shareholders. Buffett's success at buying stocks of great businesses and holding them for the long term has inspired many investors to follow his style.Berkshire held a stock portfolio worth $271 billion at the end of 2024.,Motley Fool,20250405T220300,"[{'topic': 'Retail & Wholesale', 'relevance_score': '0.25'}, {'topic': 'Financial Markets', 'relevance_score': '0.999864'}, {'topic': 'Manufacturing', 'relevance_score': '0.25'}, {'topic': 'Earnings', 'relevance_score': '0.891286'}, {'topic': 'Technology', 'relevance_score': '0.25'}, {'topic': 'Finance', 'relevance_score': '0.25'}]",Bullish,0.394156,AMZN
Elon Musk Loses $11 Billion As Tesla Stock Plummets In Wake Of New Trump Tariffs,"Elon Musk's fortune takes a $12 billion hit as Tesla shares tumble amid market turmoil. Trump's tariff announcement sends shockwaves through the stock market, with tech giants bearing the brunt.",Benzinga,20250405T193148,"[{'topic': 'Retail & Wholesale', 'relevance_score': '0.333333'}, {'topic': 'Financial Markets', 'relevance_score': '0.989041'}, {'topic': 'Manufacturing', 'relevance_score': '0.333333'}, {'topic': 'Technology', 'relevance_score': '0.333333'}]",Neutral,0.115648,AMZN
"$74 Billion Wiped Out Since Tariff Declaration - See How Much The Billionaires Lost - Alphabet  ( NASDAQ:GOOGL ) , Amazon.com  ( NASDAQ:AMZN ) ","Trump's tariff turmoil tanks titan's fortunes, slashing $74 billion from top billionaires' bankrolls. Market mayhem hits Musk and Bezos hard, with Tesla chief's net worth tumbling by $11 billion.",Benzinga,20250405T183017,"[{'topic': 'Retail & Wholesale', 'relevance_score': '0.25'}, {'topic': 'Financial Markets', 'relevance_score': '0.108179'}, {'topic': 'Manufacturing', 'relevance_score': '0.25'}, {'topic': 'Technology', 'relevance_score': '0.25'}, {'topic': 'Finance', 'relevance_score': '0.25'}]",Neutral,0.116481,AMZN
Should You Forget Amazon? Why These Unstoppable Stocks Are Better Buys,It's time to expect a little less from enormous Amazon. Here's a closer look at three new leading growth prospects for your portfolio.,Motley Fool,20250405T140000,"[{'topic': 'IPO', 'relevance_score': '0.158519'}, {'topic': 'Retail & Wholesale', 'relevance_score': '0.333333'}, {'topic': 'Financial Markets', 'relevance_score': '0.684621'}, {'topic': 'Earnings', 'relevance_score': '0.108179'}, {'topic': 'Real Estate & Construction', 'relevance_score': '0.333333'}, {'topic': 'Technology', 'relevance_score': '0.333333'}]",Somewhat-Bullish,0.24095,AMZN
Is Cameco Stock a Buy Now?,"With artificial intelligence ( AI ) increasing demand for electricity, nuclear energy is becoming a more viable option. In fact, all three big cloud computing companies have announced major investments in nuclear power.Microsoft started the ball rolling when last fall it signed a 20-year power ...",Motley Fool,20250405T130700,"[{'topic': 'Retail & Wholesale', 'relevance_score': '0.333333'}, {'topic': 'Financial Markets', 'relevance_score': '0.214378'}, {'topic': 'Energy & Transportation', 'relevance_score': '0.333333'}, {'topic': 'Technology', 'relevance_score': '0.333333'}, {'topic': 'Economy - Macro', 'relevance_score': '0.158519'}]",Neutral,0.113339,AMZN
Billionaire Paul Tudor Jones Trimmed His Position in Nvidia and Is Piling Into 2 Turnaround Tech Stocks,Paul Tudor Jones is betting on these two turnaround stocks over Nvidia.,Motley Fool,20250405T125300,"[{'topic': 'Retail & Wholesale', 'relevance_score': '0.333333'}, {'topic': 'Financial Markets', 'relevance_score': '0.986714'}, {'topic': 'Manufacturing', 'relevance_score': '0.333333'}, {'topic': 'Earnings', 'relevance_score': '0.818451'}, {'topic': 'Technology', 'relevance_score': '0.333333'}]",Somewhat-Bullish,0.151253,AMZN
"Boeing Space Joint Venture to Launch 12 Times in 2025, and Double That in 2026","To make more money, United Launch Alliance must launch more rockets. And now it can.",Motley Fool,20250405T110700,"[{'topic': 'Earnings', 'relevance_score': '0.108179'}, {'topic': 'Retail & Wholesale', 'relevance_score': '0.5'}, {'topic': 'Manufacturing', 'relevance_score': '0.5'}]",Neutral,0.111095,AMZN
This E-Commerce Stock Could Be the Best Investment of the Decade,Don't try to fix something that isn't broken. This stock has plenty more to offer long-term investors.,Motley Fool,20250405T092300,"[{'topic': 'Earnings', 'relevance_score': '0.161647'}, {'topic': 'Retail & Wholesale', 'relevance_score': '1.0'}, {'topic': 'Financial Markets', 'relevance_score': '0.999365'}]",Somewhat-Bullish,0.337092,AMZN
3 No-Brainer Warren Buffett Stocks to Buy Right Now,"When in doubt about your next best bet, consider poaching an idea (or three) from the world's most proven stock picker.",Motley Fool,20250405T090700,"[{'topic': 'Retail & Wholesale', 'relevance_score': '0.333333'}, {'topic': 'Financial Markets', 'relevance_score': '0.459462'}, {'topic': 'Energy & Transportation', 'relevance_score': '0.333333'}, {'topic': 'Finance', 'relevance_score': '0.333333'}]",Somewhat-Bullish,0.239997,AMZN
"The Best Stocks to Invest $1,000 in Right Now","Recent volatility hasn't altered the compelling long-term growth opportunities ahead of these ""Magnificent"" stocks.",Motley Fool,20250405T083500,"[{'topic': 'Retail & Wholesale', 'relevance_score': '0.25'}, {'topic': 'Financial Markets', 'relevance_score': '0.796627'}, {'topic': 'Manufacturing', 'relevance_score': '0.25'}, {'topic': 'Earnings', 'relevance_score': '0.795202'}, {'topic': 'Technology', 'relevance_score': '0.25'}, {'topic': 'Finance', 'relevance_score': '0.25'}]",Somewhat-Bullish,0.293949,AMZN
President Trump's Tariffs Have Arrived. 3 Things to Do to Protect Your Portfolio.,"The idea of an import tax started weighing on investor sentiment in March, when President Trump laid out his initial plan to target Canada, Mexico, and China. Stocks tumbled, with the S&P 500 ( SNPINDEX: ^GSPC ) and Nasdaq Composite ( NASDAQINDEX: ^IXIC ) both temporarily slipping into correction ...",Motley Fool,20250405T074000,"[{'topic': 'Life Sciences', 'relevance_score': '0.333333'}, {'topic': 'Retail & Wholesale', 'relevance_score': '0.333333'}, {'topic': 'Manufacturing', 'relevance_score': '0.333333'}, {'topic': 'Earnings', 'relevance_score': '0.158519'}]",Neutral,0.147721,AMZN
3 Ways the New U.S. Tariffs Might Affect Amazon Stock,"President Donald Trump's ""Liberation Day"" tariff program set off a string of worries and sent the markets tumbling on Thursday and Friday. New fears about how the tariffs could trigger a recession sent investors running toward safer instruments like U.S. Treasury bills. Analysts at J.P.",Motley Fool,20250404T204648,"[{'topic': 'Retail & Wholesale', 'relevance_score': '1.0'}, {'topic': 'Financial Markets', 'relevance_score': '0.962106'}]",Neutral,-0.111506,AMZN
Navitas GaNSense Power ICs Gaining Traction: Buy the Stock Now?,"NVTS and GreatWall team up for next-gen 400V-DC AI data center power, leveraging GaN and SiC tech to boost efficiency and meet rising AI demands.",Zacks Commentary,20250404T155700,"[{'topic': 'Retail & Wholesale', 'relevance_score': '0.333333'}, {'topic': 'Financial Markets', 'relevance_score': '0.158519'}, {'topic': 'Manufacturing', 'relevance_score': '0.333333'}, {'topic': 'Earnings', 'relevance_score': '0.684621'}, {'topic': 'Technology', 'relevance_score': '0.333333'}]",Bullish,0.355425,AMZN
Market Analysis: Amazon.com And Competitors In Broadline Retail Industry - Amazon.com  ( NASDAQ:AMZN ) ,"In the fast-paced and highly competitive business world of today, conducting thorough company analysis is essential for investors and industry observers. In this article, we will conduct an extensive industry comparison, evaluating Amazon.com AMZN in relation to its major competitors in the ...",Benzinga,20250404T150046,"[{'topic': 'Earnings', 'relevance_score': '0.928769'}, {'topic': 'Retail & Wholesale', 'relevance_score': '1.0'}, {'topic': 'Financial Markets', 'relevance_score': '0.54554'}]",Somewhat-Bullish,0.308209,AMZN
Tariffs Are Crushing These 2 Stocks. But Long-Term Investors Are Getting an Incredible Bargain.,"The stock market has taken a steep downturn after President Donald Trump's tariff announcements. As of this writing, the S&P 500 is firmly in correction territory, and the Nasdaq Composite is just a couple percentage points away from officially being in a bear market.To be sure, stocks are down ...",Motley Fool,20250404T145437,"[{'topic': 'Economy - Monetary', 'relevance_score': '0.310843'}, {'topic': 'Retail & Wholesale', 'relevance_score': '0.5'}, {'topic': 'Financial Markets', 'relevance_score': '0.796627'}, {'topic': 'Earnings', 'relevance_score': '0.538269'}, {'topic': 'Finance', 'relevance_score': '0.5'}]",Somewhat-Bullish,0.168984,AMZN
Temu Parent PDD Stock Tumbles As Trump's New Tariffs Threaten Chinese E-Commerce - PDD Holdings  ( NASDAQ:PDD ) ,"US-listed Chinese stocks fall after Trump announces 34% tariff on China, with PDD hit hardest due to its rivalry with Amazon. Temu parent PDD faces tariff risks as Goldman forecasts Chinese retaliation, while Tepper boosts stakes in Chinese e-commerce.",Benzinga,20250404T135902,"[{'topic': 'Retail & Wholesale', 'relevance_score': '0.5'}, {'topic': 'Financial Markets', 'relevance_score': '0.999701'}, {'topic': 'Earnings', 'relevance_score': '0.744043'}, {'topic': 'Technology', 'relevance_score': '0.5'}]",Neutral,0.084495,AMZN
Best Stock to Buy Right Now: Amazon vs. Home Depot,"There's a lot of uncertainty in the stock market right now, and it's causing many investors to reconsider some of their stocks and look at which ones might offer good opportunities to buy. With U.S. President Donald Trump's ongoing tariff actions against trade partners and some economists ...",Motley Fool,20250404T124500,"[{'topic': 'Economy - Monetary', 'relevance_score': '0.310843'}, {'topic': 'Retail & Wholesale', 'relevance_score': '0.333333'}, {'topic': 'Financial Markets', 'relevance_score': '0.977154'}, {'topic': 'Earnings', 'relevance_score': '0.795202'}, {'topic': 'Technology', 'relevance_score': '0.333333'}, {'topic': 'Finance', 'relevance_score': '0.333333'}]",Neutral,0.066227,AMZN
AppLovin Wants TikTok But Can It Beat Amazon And OnlyFans To The Punch? - AppLovin  ( NASDAQ:APP ) ,"AppLovin submitted a preliminary bid to acquire TikTok's international operations, with no guarantee of a deal. Amazon and a group led by OnlyFans founder are also competing to buy TikTok's assets outside China. With stocks plunging, steady income is key.",Benzinga,20250404T122416,"[{'topic': 'Retail & Wholesale', 'relevance_score': '0.5'}, {'topic': 'Technology', 'relevance_score': '0.5'}, {'topic': 'Financial Markets', 'relevance_score': '0.977154'}]",Neutral,0.101365,AMZN
3 Brilliant Stocks That I'm Buying if the Stock Market Crashes,"Although the market has been in a significant drawdown recently, it's still nowhere near the levels of what anyone should consider a ""crash."" Still, investors need to have their buying list ready to go in case of a crash, as it's easy to get wrapped up emotionally when you see your portfolio ...",Motley Fool,20250404T101700,"[{'topic': 'Retail & Wholesale', 'relevance_score': '0.333333'}, {'topic': 'Financial Markets', 'relevance_score': '0.87644'}, {'topic': 'Manufacturing', 'relevance_score': '0.333333'}, {'topic': 'Technology', 'relevance_score': '0.333333'}]",Neutral,-0.053456,AMZN
"2 ""Magnificent Seven"" Stocks Down 19% and 25% You'll Wish You'd Bought on the Dip","The stock market is off to a shaky start to 2025, with the S&P 500 ( SNPINDEX: ^GSPC ) index down nearly 12% from its recent all-time high. With that said, it's coming off back-to-back annual gains of more than 25% in both 2023 and 2024, which is something it has only achieved on one other ...",Motley Fool,20250404T094700,"[{'topic': 'Retail & Wholesale', 'relevance_score': '0.333333'}, {'topic': 'Financial Markets', 'relevance_score': '0.918141'}, {'topic': 'Manufacturing', 'relevance_score': '0.333333'}, {'topic': 'Earnings', 'relevance_score': '0.990893'}, {'topic': 'Technology', 'relevance_score': '0.333333'}]",Somewhat-Bullish,0.267246,AMZN
3 Important Numbers to Know for Bitcoin Investors,"As a Bitcoin ( CRYPTO: BTC ) investor, it can be confusing to make sense of all the information out there. And that's especially the case when it comes to the weekly influx of new macroeconomic data. It's becoming increasingly difficult to separate the signal from the noise.So, to help make sense ...",Motley Fool,20250404T093000,"[{'topic': 'Retail & Wholesale', 'relevance_score': '0.333333'}, {'topic': 'Financial Markets', 'relevance_score': '0.917436'}, {'topic': 'Manufacturing', 'relevance_score': '0.333333'}, {'topic': 'Technology', 'relevance_score': '0.333333'}, {'topic': 'Blockchain', 'relevance_score': '0.158519'}]",Somewhat-Bullish,0.179654,AMZN
Billionaire David Tepper Is Selling Amazon and Meta Stocks but Betting on Artificial Intelligence  ( AI )  in a Different Way,"David Tepper didn't amass a net worth of $21.3 billion by thinking conventionally. He's viewed by some as the greatest hedge fund manager of this generation as a result of his out-of-the-box moves. If you look at the top holdings in Tepper's Appaloosa Management portfolio, you'll probably quickly ...",Motley Fool,20250404T084700,"[{'topic': 'Retail & Wholesale', 'relevance_score': '0.333333'}, {'topic': 'Financial Markets', 'relevance_score': '0.158519'}, {'topic': 'Earnings', 'relevance_score': '0.310843'}, {'topic': 'Energy & Transportation', 'relevance_score': '0.333333'}, {'topic': 'Technology', 'relevance_score': '0.333333'}]",Somewhat-Bullish,0.259521,AMZN
Shopify Stock Takes Its Cue From Palantir Technologies. History Says This Will Happen Next.,"On March 31, Shopify ( NASDAQ: SHOP ) removed its U.S. shares from the New York Stock Exchange and relisted them on the Nasdaq Stock Exchange. The company did not give an explicit reason for the change, but the goal was probably to make itself eligible for inclusion in the Nasdaq-100.Palantir ...",Motley Fool,20250404T071600,"[{'topic': 'IPO', 'relevance_score': '0.158519'}, {'topic': 'Retail & Wholesale', 'relevance_score': '0.333333'}, {'topic': 'Financial Markets', 'relevance_score': '0.999355'}, {'topic': 'Earnings', 'relevance_score': '0.961735'}, {'topic': 'Technology', 'relevance_score': '0.333333'}, {'topic': 'Finance', 'relevance_score': '0.333333'}]",Somewhat-Bullish,0.29318,AMZN
"Stocks are Going on Sale, Time to be Greedy While Others are Fearful?","History shows that buying stocks when they ""go on sale"" during a down period can be extremely rewarding for investors.",Zacks Commentary,20250403T222600,"[{'topic': 'Life Sciences', 'relevance_score': '0.25'}, {'topic': 'Energy & Transportation', 'relevance_score': '0.25'}, {'topic': 'Technology', 'relevance_score': '0.25'}, {'topic': 'Economy - Monetary', 'relevance_score': '0.158519'}, {'topic': 'Retail & Wholesale', 'relevance_score': '0.25'}, {'topic': 'Financial Markets', 'relevance_score': '0.998333'}, {'topic': 'Earnings', 'relevance_score': '0.158519'}]",Neutral,0.090874,AMZN
Amazon's Stock Takes the Tariff Tumble. Here's Why I'm Still Holding.,Tariffs crushed Amazon's stock price on Thursday. Here's why you should see this discount as a wide-open buying window for this resilient tech stock.,Motley Fool,20250403T200418,"[{'topic': 'Earnings', 'relevance_score': '0.682689'}, {'topic': 'Retail & Wholesale', 'relevance_score': '1.0'}, {'topic': 'Financial Markets', 'relevance_score': '0.998962'}]",Neutral,0.092703,AMZN
Exploring The Competitive Space: Amazon.com Versus Industry Peers In Broadline Retail - Amazon.com  ( NASDAQ:AMZN ) ,"In the ever-changing and fiercely competitive business landscape, conducting thorough company analysis is crucial for investors and industry experts. In this article, we will undertake a comprehensive industry comparison, evaluating Amazon.com AMZN and its primary competitors in the Broadline ...",Benzinga,20250403T150100,"[{'topic': 'Earnings', 'relevance_score': '0.928769'}, {'topic': 'Retail & Wholesale', 'relevance_score': '1.0'}, {'topic': 'Financial Markets', 'relevance_score': '0.5855'}]",Somewhat-Bullish,0.300162,AMZN
"Amazon, Alphabet, KLA And A Health Care Stock On CNBC's 'Final Trades' - Gilead Sciences  ( NASDAQ:GILD ) , Amazon.com  ( NASDAQ:AMZN ) ","Stephen Weiss names Alphabet as his final trade. Bill Baruch says Amazon.com is ready to rally. In a market dominated by tariff tensions, geopolitical surprises, and Fed uncertainty, Matt Maley's technical approach delivers clear entry & exit points for consistent income potential.",Benzinga,20250403T122804,"[{'topic': 'Life Sciences', 'relevance_score': '0.2'}, {'topic': 'Retail & Wholesale', 'relevance_score': '0.2'}, {'topic': 'Financial Markets', 'relevance_score': '0.161647'}, {'topic': 'Manufacturing', 'relevance_score': '0.2'}, {'topic': 'Technology', 'relevance_score': '0.2'}, {'topic': 'Finance', 'relevance_score': '0.2'}]",Somewhat-Bullish,0.330905,AMZN
