title,summary,source,time_published,topics,overall_sentiment_label,overall_sentiment_score,ticker
Want to Invest in Quantum Computing? 3 Stocks That Are Great Buys Right Now.,"Quantum computing could be the next frontier for computers and cloud-based services. While traditional computers still store data in binary bits of zeros and ones, quantum computers store zeros and ones simultaneously in qubits.",Motley Fool,20250415T172100,"[{'topic': 'Financial Markets', 'relevance_score': '0.161647'}, {'topic': 'Manufacturing', 'relevance_score': '0.5'}, {'topic': 'Earnings', 'relevance_score': '0.995973'}, {'topic': 'Real Estate & Construction', 'relevance_score': '0.5'}]",Somewhat-Bullish,0.175099,MA
Can Visa Keep Delivering Under Tariff Pressure? Time to Buy or Bail?,"V is well-positioned for growth, supported by the global shift away from cash toward digital payments.",Zacks Commentary,20250415T112900,"[{'topic': 'Economy - Monetary', 'relevance_score': '0.310843'}, {'topic': 'Financial Markets', 'relevance_score': '0.929393'}, {'topic': 'Earnings', 'relevance_score': '0.947132'}, {'topic': 'Finance', 'relevance_score': '1.0'}, {'topic': 'Blockchain', 'relevance_score': '0.310843'}]",Somewhat-Bullish,0.209898,MA
Is AmEx Stock a Buy Ahead of Q1 Earnings? Key Factors to Watch,AXP is likely to have witnessed a rise in network volumes and lower profits from Global Merchant and Network Services during the first quarter.,Zacks Commentary,20250415T110800,"[{'topic': 'Earnings', 'relevance_score': '0.997874'}, {'topic': 'Finance', 'relevance_score': '1.0'}, {'topic': 'Financial Markets', 'relevance_score': '0.214378'}]",Somewhat-Bullish,0.268599,MA
Should You Invest in the Vanguard Financials ETF  ( VFH ) ?,Sector ETF report for ...,Zacks Commentary,20250415T102006,"[{'topic': 'Finance', 'relevance_score': '1.0'}, {'topic': 'Financial Markets', 'relevance_score': '1.0'}]",Neutral,0.133906,MA
Zymra Under Review: Natural Fat Burning System - Safe OTC Alternative to GLP-1 Drugs,"New York City, April 14, 2025 ( GLOBE NEWSWIRE ) -- Losing weight is more complicated than simply eating less and moving more. For many adults, especially those over the age of 30, persistent weight gain is the result of biological resistance-not a lack of willpower.",Benzinga,20250415T000730,"[{'topic': 'Economy - Fiscal', 'relevance_score': '0.451494'}, {'topic': 'Retail & Wholesale', 'relevance_score': '0.5'}, {'topic': 'Financial Markets', 'relevance_score': '0.538269'}, {'topic': 'Finance', 'relevance_score': '0.5'}]",Somewhat-Bullish,0.18693,MA
MasterCard  ( MA )  Ascends But Remains Behind Market: Some Facts to Note,"The latest trading day saw MasterCard (MA) settling at $512.46, representing a +0.53% change from its previous close.",Zacks Commentary,20250414T215016,"[{'topic': 'Earnings', 'relevance_score': '0.938793'}, {'topic': 'Financial Markets', 'relevance_score': '0.316726'}]",Neutral,0.142832,MA
Best Sweepstakes Casino 2025: Crown Coins Casino Voted Best for Sweeps Coins,"New York City, April 14, 2025 ( GLOBE NEWSWIRE ) -- Are you trying to find the top casinos in the US for sweepstakes? You're in the right place. We have compiled a reliable list of online Sweepstakes Casinos you can enjoy online.",Benzinga,20250414T190612,"[{'topic': 'Finance', 'relevance_score': '1.0'}, {'topic': 'Blockchain', 'relevance_score': '0.158519'}, {'topic': 'Financial Markets', 'relevance_score': '0.108179'}]",Bullish,0.509282,MA
Best Online Casinos for U.S. Players 2025: Lucky Creek Rated Top Real Money Casino,"New York City, April 14, 2025 ( GLOBE NEWSWIRE ) -- With the uptrend in the number of American players seeking online gaming platforms in U.S. online casinos, there has been a corresponding increase in the number of casinos offering real-money gambling.",Benzinga,20250414T183125,"[{'topic': 'Blockchain', 'relevance_score': '0.451494'}]",Bullish,0.470658,MA
"Apple Stock Plunged on Tariff News, But It's Proving to Be Unstoppable in Another Lucrative Area","Shares of Apple ( NASDAQ: AAPL ) are currently 26% below their peak from December last year ( as of April 10 ) , a drop that has been spurred by ongoing tariff announcements. As of this writing, there is a huge 145% tariff that's implemented on goods leaving China for the U.S.",Motley Fool,20250413T095100,"[{'topic': 'Earnings', 'relevance_score': '0.796627'}, {'topic': 'Technology', 'relevance_score': '0.5'}, {'topic': 'Finance', 'relevance_score': '0.5'}]",Somewhat-Bullish,0.260277,MA
Interac Casinos Canada 2025: Posido Casino Ranked Best Interac Casino,"New York City, April 12, 2025 ( GLOBE NEWSWIRE ) -- One of the most popular ways to pay and play at online casinos in Canada is through Interac, which is quick, convenient, and secure.",Benzinga,20250412T201507,"[{'topic': 'Blockchain', 'relevance_score': '0.158519'}]",Bullish,0.428314,MA
Whispeara Under Review: Best Natural Hearing Support Formula on the Market,"New York City, April 12, 2025 ( GLOBE NEWSWIRE ) -- Hearing loss isn't just an age-related condition-it's a growing global concern affecting people of all backgrounds and lifestyles.",Benzinga,20250412T181105,"[{'topic': 'Economy - Monetary', 'relevance_score': '0.158519'}, {'topic': 'Life Sciences', 'relevance_score': '0.5'}, {'topic': 'Financial Markets', 'relevance_score': '0.214378'}, {'topic': 'Earnings', 'relevance_score': '0.310843'}, {'topic': 'Finance', 'relevance_score': '0.5'}]",Somewhat-Bullish,0.256741,MA
1 Stock to Buy Hand Over Fist in the Tariff-Induced Market Downturn,Buying through market drawdowns is the right thing to do.,Motley Fool,20250412T082300,"[{'topic': 'Earnings', 'relevance_score': '0.998333'}, {'topic': 'Finance', 'relevance_score': '1.0'}, {'topic': 'Financial Markets', 'relevance_score': '0.990999'}]",Somewhat-Bullish,0.203396,MA
Infini Revives Infini Earn with New Security Architecture and Global Access,"HONG KONG, April 12, 2025 ( GLOBE NEWSWIRE ) -- Infini, the innovative crypto payment and earning platform, is excited to announce the return of its highly anticipated feature, Infini Earn.",Benzinga,20250412T071739,"[{'topic': 'Earnings', 'relevance_score': '0.451494'}, {'topic': 'Blockchain', 'relevance_score': '0.682689'}, {'topic': 'Financial Markets', 'relevance_score': '0.108179'}]",Bullish,0.531973,MA
Prodentim Ingredients Under Review - What the Science Says About Customer Benefits,"New York City, April 11, 2025 ( GLOBE NEWSWIRE ) -- Oral health plays a vital role in overall wellness, yet it remains one of the most frequently neglected aspects of self-care.",Benzinga,20250412T014656,"[{'topic': 'Economy - Fiscal', 'relevance_score': '0.158519'}, {'topic': 'Finance', 'relevance_score': '1.0'}]",Somewhat-Bullish,0.228174,MA
Gauging ACIW-NationsBenefits Deal: Investment Opportunity or Hype?,"ACIW teams up with NationsBenefits to expand health and retail benefit access, unlocking growth in the booming healthcare payments space.",Zacks Commentary,20250411T153400,"[{'topic': 'Earnings', 'relevance_score': '0.988915'}, {'topic': 'Technology', 'relevance_score': '1.0'}]",Bullish,0.481333,MA
Mastercard Premium Valuation: Opportunity or Risk in a Shaky Economy?,"Beyond macroeconomic and financial concerns, MA also faces rising regulatory scrutiny and legal challenges.",Zacks Commentary,20250411T151800,"[{'topic': 'Economy - Monetary', 'relevance_score': '0.310843'}, {'topic': 'Economy - Fiscal', 'relevance_score': '0.158519'}, {'topic': 'Financial Markets', 'relevance_score': '0.161647'}, {'topic': 'Earnings', 'relevance_score': '0.928769'}, {'topic': 'Finance', 'relevance_score': '1.0'}]",Neutral,0.116962,MA
Is Most-Watched Stock Mastercard Incorporated  ( MA )  Worth Betting on Now?,"MasterCard (MA) has received quite a bit of attention from Zacks.com users lately. Therefore, it is wise to be aware of the facts that can impact the stock's prospects.",Zacks Commentary,20250411T130014,"[{'topic': 'Earnings', 'relevance_score': '1.0'}, {'topic': 'Financial Markets', 'relevance_score': '0.503496'}]",Somewhat-Bullish,0.219713,MA
Best Betting Sites in the US 2025: BetOnline Takes Top Spot,"New York City, April 10, 2025 ( GLOBE NEWSWIRE ) -- There are more online sports betting sites in the United States than ever, giving sports bettors the unenviable task of selecting the best one. However, we have done the groundwork for you and made our pick of the best betting site: BetOnline.",Benzinga,20250410T190649,"[{'topic': 'Finance', 'relevance_score': '1.0'}, {'topic': 'Blockchain', 'relevance_score': '0.158519'}]",Bullish,0.468653,MA
Best Online Casinos in Canada 2025: Why RoboCat is the Top Choice,"New York City, April 10, 2025 ( GLOBE NEWSWIRE ) -- Do you want to play at one of the best online casinos in Canada? Then look no further. Here, we have brought you our number one pick of the best online casino sites in Canada: RoboCat Casino.",Benzinga,20250410T183702,"[{'topic': 'Blockchain', 'relevance_score': '0.310843'}, {'topic': 'Financial Markets', 'relevance_score': '0.108179'}]",Bullish,0.411635,MA
"1 Beaten-Down Bank Stock I'd Buy Right Now, Even With a Recession Likely to Happen","Capital One Financial ( NYSE: COF ) is down by 30% from its 2025 high, as of this writing, which it reached in mid-February. And the stock is down for some good reasons.While it might not seem like a victim of tariffs -- and it isn't, at least not directly -- the tariff plans could cause ...",Motley Fool,20250410T104200,"[{'topic': 'Economy - Monetary', 'relevance_score': '0.310843'}, {'topic': 'IPO', 'relevance_score': '0.310843'}, {'topic': 'Financial Markets', 'relevance_score': '0.365926'}, {'topic': 'Earnings', 'relevance_score': '0.360215'}, {'topic': 'Mergers & Acquisitions', 'relevance_score': '0.158519'}, {'topic': 'Finance', 'relevance_score': '1.0'}]",Somewhat-Bullish,0.343116,MA
Looking for Stocks with Positive Earnings Momentum? Check Out These 2 Business Services Names,Investors looking for ways to find stocks that are set to beat quarterly earnings estimates should check out the Zacks Earnings ESP.,Zacks Commentary,20250409T125008,"[{'topic': 'Earnings', 'relevance_score': '0.999973'}, {'topic': 'Financial Markets', 'relevance_score': '0.214378'}]",Bullish,0.393958,MA
"This Couchbase Analyst Begins Coverage On A Bullish Note; Here Are Top 5 Initiations For Wednesday - Mastercard  ( NYSE:MA ) , Couchbase  ( NASDAQ:BASE ) ","Top Wall Street analysts changed their outlook on these top names. For a complete view of all analyst rating changes, including upgrades, downgrades and initiations, please see our analyst ratings page. Chardan Capital analyst Geulah Livshits initiated coverage on Palvella Therapeutics, Inc.",Benzinga,20250409T121852,"[{'topic': 'Life Sciences', 'relevance_score': '0.333333'}, {'topic': 'Financial Markets', 'relevance_score': '0.413559'}, {'topic': 'Real Estate & Construction', 'relevance_score': '0.333333'}, {'topic': 'Technology', 'relevance_score': '0.333333'}]",Somewhat-Bullish,0.253814,MA
"Kraken taps Mastercard to launch crypto debit cards in Europe, UK","Cryptocurrency exchange Kraken has partnered with Mastercard to issue crypto debit cards across the United Kingdom and Europe, the company announced on April 8.The partnership will enable the crypto exchange to expand its payment offerings by launching physical crypto debit cards.The partnership ...",Cointelegraph,20250409T111005,"[{'topic': 'Blockchain', 'relevance_score': '0.838487'}]",Neutral,0.126065,MA
Prediction: This Relentless Vanguard ETF Will Beat the S&P 500 Again in 2025,"The Vanguard S&P 500 Growth ETF ( NYSEMKT: VOOG ) is an exchange-traded fund ( ETF ) that tracks the performance of the S&P 500 Growth index. The Growth index holds 208 of the best-performing growth stocks from the regular S&P 500 index, assigning much higher weightings to tech powerhouses like ...",Motley Fool,20250409T081900,"[{'topic': 'Economy - Monetary', 'relevance_score': '0.158519'}, {'topic': 'Financial Markets', 'relevance_score': '0.999981'}, {'topic': 'Manufacturing', 'relevance_score': '0.5'}, {'topic': 'Earnings', 'relevance_score': '0.360215'}, {'topic': 'Technology', 'relevance_score': '0.5'}, {'topic': 'Economy - Macro', 'relevance_score': '0.158519'}]",Neutral,0.131999,MA
Mastercard & PayTabs Launch Payment Platform to Aid Egyptian SMEs,"MA partners with PayTabs to unveil a white-labeled digital payments platform to improve payment experiences for SMEs in Egypt, thereby bolstering MA's nationwide presence.",Zacks Commentary,20250408T174800,"[{'topic': 'Earnings', 'relevance_score': '0.904684'}, {'topic': 'Real Estate & Construction', 'relevance_score': '0.333333'}, {'topic': 'Energy & Transportation', 'relevance_score': '0.333333'}, {'topic': 'Technology', 'relevance_score': '0.333333'}]",Bullish,0.382871,MA
Will PayPal's Deepening Cryptocurrency Footprint Benefit the Stock?,PYPL is doubling down on digital assets with the addition of Chainlink and Solana to its crypto suite.,Zacks Commentary,20250408T144900,"[{'topic': 'Financial Markets', 'relevance_score': '0.108179'}, {'topic': 'Earnings', 'relevance_score': '0.986564'}, {'topic': 'Technology', 'relevance_score': '1.0'}, {'topic': 'Blockchain', 'relevance_score': '0.158519'}]",Somewhat-Bullish,0.32228,MA
Why Affirm's 38% YTD Drop Could Be a Golden Opportunity for Investors,AFRM is developing debit products and exploring banking integrations to make its services part of customers' everyday spending.,Zacks Commentary,20250408T141600,"[{'topic': 'Economy - Monetary', 'relevance_score': '0.158519'}, {'topic': 'IPO', 'relevance_score': '0.158519'}, {'topic': 'Retail & Wholesale', 'relevance_score': '1.0'}, {'topic': 'Financial Markets', 'relevance_score': '0.108179'}, {'topic': 'Earnings', 'relevance_score': '0.875462'}]",Somewhat-Bullish,0.169791,MA
Where Will American Express Stock Be in 1 Year?,"American Express ( NYSE: AXP ) shareholders are finding their wallets a bit lighter at the start of the year, as the stock has declined approximately 29% from its 52-week high. Despite the credit services giant posting record financial results for 2024, concerns about the strength of the U.S. ...",Motley Fool,20250408T135300,"[{'topic': 'Economy - Monetary', 'relevance_score': '0.158519'}, {'topic': 'Economy - Fiscal', 'relevance_score': '0.158519'}, {'topic': 'Financial Markets', 'relevance_score': '0.995077'}, {'topic': 'Earnings', 'relevance_score': '0.99737'}, {'topic': 'Finance', 'relevance_score': '1.0'}]",Somewhat-Bullish,0.249476,MA
Netcoins Canada Hires Prentis Beck-Sayers to Bolster Sales and Trading Team; Approval of BIGG Omnibus Equity Plan,Netcoins Canada Hires Prentis Beck-Sayers to Bolster Sales and Trading Team. Approval of BIGG Omnibus Equity Plan ...,GlobeNewswire,20250408T123000,"[{'topic': 'Real Estate & Construction', 'relevance_score': '1.0'}, {'topic': 'Blockchain', 'relevance_score': '0.990678'}, {'topic': 'Financial Markets', 'relevance_score': '1.0'}]",Somewhat-Bullish,0.272547,MA
Netcoins Canada Hires Prentis Beck-Sayers to Bolster Sales and Trading Team; Approval of BIGG Omnibus Equity Plan - BIGG Digital Assets  ( OTC:BBKCF ) ,"VANCOUVER, British Columbia, April 08, 2025 ( GLOBE NEWSWIRE ) -- BIGG Digital Assets Inc. ( ""BIGG"" or the ""Company"" ) BIGGBBKCF WKN: A2PS9W ) ) , a leading innovator in the digital assets space and owner of Netcoins, Blockchain Intelligence Group, and TerraZero is pleased to announce the hiring ...",Benzinga,20250408T123000,"[{'topic': 'Real Estate & Construction', 'relevance_score': '1.0'}, {'topic': 'Blockchain', 'relevance_score': '0.99489'}, {'topic': 'Financial Markets', 'relevance_score': '1.0'}]",Somewhat-Bullish,0.267846,MA
2 Warren Buffett Stocks to Buy in the Stock Market Sell-Off,"Equity markets are struggling due to President Donald Trump's decision to impose tariffs on imported goods from every country. Many investors are panicking. that's why stocks are falling.However, one investor likely remaining calm is Warren Buffett, the greatest of them all.",Motley Fool,20250408T115400,"[{'topic': 'Economy - Monetary', 'relevance_score': '0.310843'}, {'topic': 'Financial Markets', 'relevance_score': '0.989041'}, {'topic': 'Earnings', 'relevance_score': '0.538269'}, {'topic': 'Technology', 'relevance_score': '0.5'}, {'topic': 'Finance', 'relevance_score': '0.5'}]",Neutral,0.120389,MA
MasterCard  ( MA )  Dips More Than Broader Market: What You Should Know,"In the most recent trading session, MasterCard (MA) closed at $485.52, indicating a -0.87% shift from the previous trading day.",Zacks Commentary,20250407T215016,"[{'topic': 'Earnings', 'relevance_score': '0.95493'}, {'topic': 'Financial Markets', 'relevance_score': '0.266143'}]",Somewhat-Bullish,0.16206,MA
Will MasterCard  ( MA )  Beat Estimates Again in Its Next Earnings Report?,MasterCard (MA) has an impressive earnings surprise history and currently possesses the right combination of the two key ingredients for a likely beat in its next quarterly report.,Zacks Commentary,20250407T161010,"[{'topic': 'Earnings', 'relevance_score': '0.99998'}]",Somewhat-Bullish,0.299229,MA
"AmEx Stock Trails S&P 500, Declines 21% YTD: Time to Buy or Cash Out?","AXP's clients typically have higher incomes and strong credit scores, which helps minimize credit risks.",Zacks Commentary,20250407T155300,"[{'topic': 'Economy - Monetary', 'relevance_score': '0.576289'}, {'topic': 'Financial Markets', 'relevance_score': '0.161647'}, {'topic': 'Earnings', 'relevance_score': '0.988915'}, {'topic': 'Finance', 'relevance_score': '1.0'}]",Somewhat-Bullish,0.302215,MA
Mastercard Transforms Payments With 2030 Vision for Australia,"MA unveils a bold 2030 vision featuring biometrics, contactless cards, and real-time payments to enhance security, convenience, and growth.",Zacks Commentary,20250407T151200,"[{'topic': 'Earnings', 'relevance_score': '0.769861'}, {'topic': 'Real Estate & Construction', 'relevance_score': '0.5'}, {'topic': 'Technology', 'relevance_score': '0.5'}]",Somewhat-Bullish,0.225218,MA
Should You Invest in the iShares U.S. Industrials ETF  ( IYJ ) ?,Sector ETF report for ...,Zacks Commentary,20250407T102005,"[{'topic': 'Financial Markets', 'relevance_score': '1.0'}]",Somewhat-Bullish,0.166238,MA
Mastercard Is Taking On the World and Winning,"The Mastercard ( NYSE: MA ) logo is pretty ubiquitous in the United States. It adorns credit cards, debit cards, store windows, websites, and credit card processing machines. That speaks to the size and success of the company's business.",Motley Fool,20250406T130500,"[{'topic': 'Earnings', 'relevance_score': '0.360215'}, {'topic': 'Economy - Monetary', 'relevance_score': '0.158519'}]",Somewhat-Bullish,0.341838,MA
3 No-Brainer Warren Buffett Stocks to Buy Right Now,"When in doubt about your next best bet, consider poaching an idea (or three) from the world's most proven stock picker.",Motley Fool,20250405T090700,"[{'topic': 'Retail & Wholesale', 'relevance_score': '0.333333'}, {'topic': 'Financial Markets', 'relevance_score': '0.459462'}, {'topic': 'Energy & Transportation', 'relevance_score': '0.333333'}, {'topic': 'Finance', 'relevance_score': '0.333333'}]",Somewhat-Bullish,0.239997,MA
5 Reasons to Buy American Express Stock Like There's No Tomorrow,The credit card and banking giant is still an evergreen investment.,Motley Fool,20250405T084000,"[{'topic': 'Economy - Monetary', 'relevance_score': '0.451494'}, {'topic': 'Financial Markets', 'relevance_score': '0.980922'}, {'topic': 'Earnings', 'relevance_score': '0.98396'}, {'topic': 'Finance', 'relevance_score': '1.0'}]",Neutral,0.144255,MA
2 Warren Buffett Stocks to Hold Forever,"Warren Buffett is known for saying his favorite holding period is ""forever."" But if you follow Berkshire Hathaway's trading activity, you'll notice that it sells stocks quite often, whether partial or full positions.",Motley Fool,20250405T071400,"[{'topic': 'Economy - Monetary', 'relevance_score': '0.158519'}, {'topic': 'Financial Markets', 'relevance_score': '0.918141'}, {'topic': 'Manufacturing', 'relevance_score': '0.5'}, {'topic': 'Earnings', 'relevance_score': '0.998682'}, {'topic': 'Finance', 'relevance_score': '0.5'}]",Somewhat-Bullish,0.258133,MA
Gorilla Technology Reports 2024 Earnings: Pipeline Getting Bigger?,"New contracts, global expansion and disciplined execution benefit GRRR's results.",Zacks Commentary,20250404T164500,"[{'topic': 'Earnings', 'relevance_score': '0.999346'}]",Somewhat-Bullish,0.200168,MA
FIS Powers Instant Rewards Redemption for Eligible Bilt Members,"Fidelity National teams up with Bilt to deliver real-time rewards redemption via Premium Payback solution, which in turn, may benefit Banking Solutions' segment revenues.",Zacks Commentary,20250404T161100,"[{'topic': 'Earnings', 'relevance_score': '0.838487'}, {'topic': 'Technology', 'relevance_score': '1.0'}, {'topic': 'Financial Markets', 'relevance_score': '0.77141'}]",Bullish,0.411368,MA
Mastercard vs. AmEx: Which Payments Giant Has More Room to Run?,"Compared to MA's more globally diversified business, AXP remains more exposed to domestic economic shifts.",Zacks Commentary,20250404T160700,"[{'topic': 'Economy - Monetary', 'relevance_score': '0.310843'}, {'topic': 'Financial Markets', 'relevance_score': '0.360215'}, {'topic': 'Earnings', 'relevance_score': '0.918141'}, {'topic': 'Finance', 'relevance_score': '1.0'}]",Somewhat-Bullish,0.343826,MA
Best Fat Burners For Men and Women: Top Natural Fat Burners That Actually work  ( PhenQ Review ) ,"NEW YORK, April 04, 2025 ( GLOBE NEWSWIRE ) -- PhenQ is a weight loss supplement that uses six natural ingredients. It has been studied for safe and healthy weight loss. Unlike many supplements that focus on just one part of weight loss, PhenQ works in five different ways.",Benzinga,20250404T123831,"[{'topic': 'Finance', 'relevance_score': '0.5'}, {'topic': 'Manufacturing', 'relevance_score': '0.5'}]",Somewhat-Bullish,0.213971,MA
"Can XRP Turn a $10,000 Investment Into $1 Million?","XRP ( CRYPTO: XRP ) investors received some great news recently -- the Securities and Exchange Commission dropped its case against Ripple, the company behind the token. The case hung over the cryptocurrency for years, as regulators alleged Ripple should have registered XRP as a security.",Motley Fool,20250404T090000,"[{'topic': 'Finance', 'relevance_score': '1.0'}, {'topic': 'Blockchain', 'relevance_score': '0.576289'}, {'topic': 'Financial Markets', 'relevance_score': '0.744043'}]",Somewhat-Bullish,0.276493,MA
Trump's tariff tactics: How US trade policies could affect global economy - ETCFO,"With U.S. President Donald Trump enforcing new tariffs, future aggressive methods could be used to modify global trade. Tactics could include weakening the dollar, leveraging the Federal Reserve's foreign bank swap lines, and exploiting credit card firms Visa and Mastercard.",Economic Times,20250404T071638,"[{'topic': 'Economy - Monetary', 'relevance_score': '0.682689'}, {'topic': 'Financial Markets', 'relevance_score': '0.214378'}, {'topic': 'Technology', 'relevance_score': '1.0'}, {'topic': 'Blockchain', 'relevance_score': '0.158519'}]",Neutral,-0.082164,MA
Mastercard and MoneyGram Join to Revolutionize Cross-Border Payments,"MA partners with MoneyGram to enhance digital payments, driving revenue growth, financial inclusion, and seamless cross-border transactions.",Zacks Commentary,20250403T171100,"[{'topic': 'Earnings', 'relevance_score': '0.967321'}, {'topic': 'Real Estate & Construction', 'relevance_score': '0.5'}, {'topic': 'Technology', 'relevance_score': '0.5'}]",Bullish,0.371232,MA
Reply doubles its AI-based international competitions: introducing the Reply AI Music Contest and welcoming back the Reply AI Film Festival. - Reply  ( OTC:RPYTF ) ,"The top music contestants will take the stage for a live performance at the Kappa FuturFestival in Turin, while the film contest finalists will be invited to a premiere event hosted by Reply and Mastercard, taking place in Venice in September.",Benzinga,20250403T140000,"[{'topic': 'Financial Markets', 'relevance_score': '0.108179'}]",Bullish,0.504062,MA
3 Warren Buffett Dividend Stocks That Are Built to Last,Warren Buffett-led Berkshire Hathaway is reaching new all-time highs despite a year-to-date sell-off in major indexes like the S&P 500 and Nasdaq Composite.The simplest way to invest in Buffett's top ideas is to buy Berkshire stock directly.,Motley Fool,20250403T113000,"[{'topic': 'Economy - Monetary', 'relevance_score': '0.158519'}, {'topic': 'Financial Markets', 'relevance_score': '0.723405'}, {'topic': 'Manufacturing', 'relevance_score': '0.333333'}, {'topic': 'Earnings', 'relevance_score': '0.576289'}, {'topic': 'Energy & Transportation', 'relevance_score': '0.333333'}, {'topic': 'Finance', 'relevance_score': '0.333333'}]",Somewhat-Bullish,0.307702,MA
"US Payments Forum Spring Market Snapshot: AI and Biometrics at Odds, Overcoming Online Fraud and the End of Magstripe","REDWOOD CITY, Calif., April 02, 2025 ( GLOBE NEWSWIRE ) -- The U.S. Payments Forum is tapping into industry trends in its spring market snapshot. It's an amalgamation of insights from top payment organizations gathered during the Forum's Spring Member Meeting in San Diego, California.",Benzinga,20250402T160907,[],Somewhat-Bullish,0.275263,MA
