title,summary,source,time_published,topics,overall_sentiment_label,overall_sentiment_score,ticker
Bitcoin Awaits Trump Tariff Move As Optimism Grows; Tesla Slips In March While Rivals Gain; Novo Nordisk Investor Earns $9B From Soaring Weight Loss Drug Sales - Top Headlines While The U.S. Slept,"Peter Schiff Calls Bitcoin 'Digital Risk' Amid Tariff Fears: 'If It Were Truly Digital Gold…' Circle's Revenue Grows, But IPO Filing Shows Falling Profitability Why Are Dogecoin, Shiba Inu Down Over 15% In The Past Week? Bitcoin Braces For Trump Tariff Announcement: 'Short-Term Optimism' Has ...",Benzinga,20250402T150711,"[{'topic': 'Life Sciences', 'relevance_score': '0.333333'}, {'topic': 'Technology', 'relevance_score': '0.333333'}, {'topic': 'Blockchain', 'relevance_score': '0.158519'}, {'topic': 'IPO', 'relevance_score': '0.451494'}, {'topic': 'Financial Markets', 'relevance_score': '0.999967'}, {'topic': 'Manufacturing', 'relevance_score': '0.333333'}, {'topic': 'Earnings', 'relevance_score': '0.538269'}]",Neutral,0.07355,MA
Trust Stamp Denmark Joins Mastercard Lighthouse MASSIV Program,"COPENHAGEN, April 02, 2025 ( GLOBE NEWSWIRE ) -- Trust Stamp ( Nasdaq: IDAI ) , the Privacy-First Identity Company™ has been selected as one of the five companies to join the competitive Mastercard Lighthouse MASSIV 2025 program.",GlobeNewswire,20250402T140000,"[{'topic': 'Financial Markets', 'relevance_score': '0.451494'}]",Bullish,0.399938,MA
Trust Stamp Denmark Joins Mastercard Lighthouse MASSIV Program - T Stamp  ( NASDAQ:IDAI ) ,"COPENHAGEN, April 02, 2025 ( GLOBE NEWSWIRE ) -- Trust Stamp IDAI, the Privacy-First Identity Company™ has been selected as one of the five companies to join the competitive Mastercard Lighthouse MASSIV 2025 program.",Benzinga,20250402T140000,"[{'topic': 'Financial Markets', 'relevance_score': '0.744043'}]",Bullish,0.397979,MA
Netcoins Launches Innovative New Web Trading App,"VANCOUVER, British Columbia, April 02, 2025 ( GLOBE NEWSWIRE ) -- BIGG Digital Assets Inc. ( ""BIGG"" or the ""Company"" ) ( TSXV: BIGG. OTCQX: BBKCF.",GlobeNewswire,20250402T123000,"[{'topic': 'Real Estate & Construction', 'relevance_score': '1.0'}, {'topic': 'Blockchain', 'relevance_score': '0.9973'}, {'topic': 'Financial Markets', 'relevance_score': '0.99793'}]",Somewhat-Bullish,0.253908,MA
These 2 Vanguard ETFs Have Over 10% of Assets in Nvidia Stock. Here's Why Both Growth Funds Are Great Buys Now.,Nvidia ( NASDAQ: NVDA ) took the market by storm in 2023 and 2024 -- increasing by several-fold in just two years to become the third most valuable company in the world behind only Apple ( NASDAQ: AAPL ) and Microsoft ( NASDAQ: MSFT ) .,Motley Fool,20250402T110700,"[{'topic': 'Retail & Wholesale', 'relevance_score': '0.333333'}, {'topic': 'Financial Markets', 'relevance_score': '1.0'}, {'topic': 'Manufacturing', 'relevance_score': '0.333333'}, {'topic': 'Technology', 'relevance_score': '0.333333'}]",Somewhat-Bullish,0.220258,MA
"Visa Offers $100 Million To Secure Apple Card Network In A Bid To Outdo Mastercard: Report - Apple  ( NASDAQ:AAPL ) , American Express  ( NYSE:AXP ) ",Visa Inc. V has reportedly proposed a $100 million payment to Apple Inc. AAPL to secure the Apple Card network. This move comes amid fierce competition among the country's leading payment networks. What Happened: Apple Card is up for grabs as Goldman Sachs Group Inc.,Benzinga,20250402T090828,"[{'topic': 'Technology', 'relevance_score': '0.5'}, {'topic': 'Finance', 'relevance_score': '0.5'}, {'topic': 'Financial Markets', 'relevance_score': '0.214378'}]",Somewhat-Bullish,0.176896,MA
MasterCard  ( MA )  Ascends But Remains Behind Market: Some Facts to Note,"MasterCard (MA) closed the most recent trading day at $548.51, moving +0.07% from the previous trading session.",Zacks Commentary,20250401T215016,"[{'topic': 'Earnings', 'relevance_score': '0.961735'}, {'topic': 'Financial Markets', 'relevance_score': '0.161647'}]",Somewhat-Bullish,0.150152,MA
"Business First Bancshares, Inc. Announces First Quarter 2025 Earnings Release Date and Conference Call","BATON ROUGE, La., April 01, 2025 ( GLOBE NEWSWIRE ) -- Business First Bancshares, Inc. ( Nasdaq: BFST ) , the parent company of b1BANK, is scheduled to release first quarter 2025 earnings after market close on Thursday, April 24, 2025.",GlobeNewswire,20250401T213000,"[{'topic': 'Earnings', 'relevance_score': '0.158519'}, {'topic': 'Finance', 'relevance_score': '1.0'}]",Somewhat-Bullish,0.343463,MA
"Business First Bancshares, Inc. Announces First Quarter 2025 Earnings Release Date and Conference Call - Business First Bancshares  ( NASDAQ:BFST ) ","BATON ROUGE, La., April 01, 2025 ( GLOBE NEWSWIRE ) -- Business First Bancshares, Inc. BFST, the parent company of b1BANK, is scheduled to release first quarter 2025 earnings after market close on Thursday, April 24, 2025.",Benzinga,20250401T213000,"[{'topic': 'Earnings', 'relevance_score': '0.158519'}, {'topic': 'Finance', 'relevance_score': '1.0'}, {'topic': 'Financial Markets', 'relevance_score': '0.161647'}]",Somewhat-Bullish,0.346922,MA
"FiatGate Introduces 'Exchange as a Service'  ( EaaS ) , Lowering Barriers for Crypto Entrepreneurs","STOCKHOLM, April 01, 2025 ( GLOBE NEWSWIRE ) -- FiatGate ( product of Blockchain Reaction ) , a leading provider of white-label crypto wallet and exchange solutions, announced their 'Exchange as a Service' ( EaaS ) solution.",Benzinga,20250401T171557,"[{'topic': 'Technology', 'relevance_score': '1.0'}, {'topic': 'Blockchain', 'relevance_score': '0.769861'}]",Somewhat-Bullish,0.270699,MA
Mastercard Revolutionizes Commercial Payments With Modern Technology,"MA reshapes B2B transactions with embedded VCN technology, enhancing smooth, scalable, and user-friendly payment experiences for businesses.",Zacks Commentary,20250401T165600,"[{'topic': 'Earnings', 'relevance_score': '0.769861'}, {'topic': 'Real Estate & Construction', 'relevance_score': '0.5'}, {'topic': 'Technology', 'relevance_score': '0.5'}]",Somewhat-Bullish,0.339141,MA
"The Zacks Analyst Blog Highlights Mastercard, Medtronic, HCA Healthcare and United Homes","Mastercard, Medtronic, HCA Healthcare and United Homes are part of the Zacks top Analyst blog.",Zacks Commentary,20250401T143600,"[{'topic': 'Life Sciences', 'relevance_score': '1.0'}, {'topic': 'Financial Markets', 'relevance_score': '0.365926'}, {'topic': 'Earnings', 'relevance_score': '0.650727'}, {'topic': 'Mergers & Acquisitions', 'relevance_score': '0.158519'}]",Somewhat-Bullish,0.212079,MA
Is It Worth Investing in MasterCard  ( MA )  Based on Wall Street's Bullish Views?,"The average brokerage recommendation (ABR) for MasterCard (MA) is equivalent to a Buy. The overly optimistic recommendations of Wall Street analysts make the effectiveness of this highly sought-after metric questionable. So, is it worth buying the stock?",Zacks Commentary,20250401T133010,"[{'topic': 'Earnings', 'relevance_score': '0.938238'}, {'topic': 'Financial Markets', 'relevance_score': '0.503496'}]",Somewhat-Bullish,0.276927,MA
Are You Missing Out on These 2 Recent Double-Digit Dividend Increases?,"Dividend increases aren't exactly coming thick and fast these days. That's what happens in the periods between earnings seasons, when most companies concentrate on performance rather than payouts.But in an equities market as wide and deep as the U.S.'s, there is always bound to be an outlier or ...",Motley Fool,20250401T093000,"[{'topic': 'Earnings', 'relevance_score': '0.999763'}, {'topic': 'Finance', 'relevance_score': '1.0'}, {'topic': 'Financial Markets', 'relevance_score': '0.918141'}]",Somewhat-Bullish,0.269931,MA
37% of Warren Buffett's $290 Billion Berkshire Hathaway Portfolio Is Invested in These 2 S&P 500 Dividend Stocks,"Even though Berkshire Hathaway ( NYSE: BRK.A ) ( NYSE: BRK.B ) doesn't pay a dividend, it's clear that CEO Warren Buffett is a big fan of companies that cut investors in on their profits through regularly delivered cash checks.",Motley Fool,20250401T091200,"[{'topic': 'Economy - Monetary', 'relevance_score': '0.158519'}, {'topic': 'Financial Markets', 'relevance_score': '0.692272'}, {'topic': 'Earnings', 'relevance_score': '0.77141'}, {'topic': 'Technology', 'relevance_score': '0.5'}, {'topic': 'Finance', 'relevance_score': '0.5'}]",Somewhat-Bullish,0.266697,MA
