title,summary,source,time_published,topics,overall_sentiment_label,overall_sentiment_score,ticker
ATN - Asian Television Network celebrates 25 Years on the TSX Venture Exchange  ( TSXV ) ,"TORONTO, April 7, 2025 /CNW/ - Asian Television Network International Limited ( ATN ) SAT, Canada's leading broadcaster of South Asian content and pioneer broadcaster of cricket, proudly celebrates its 25th anniversary on the TSX Venture Exchange ( TSXV ) .",Benzinga,20250407T191700,"[{'topic': 'Financial Markets', 'relevance_score': '0.684621'}]",Somewhat-Bullish,0.269965,NFLX
Disney's Content Pipeline Impresses: Time to Hold the Stock for Value?,"DIS' pipeline signals strong potential but near-term headwinds call for patience, suggesting investors hold the stock or watch for a better entry point in 2025.",Zacks Commentary,20250407T190000,"[{'topic': 'Retail & Wholesale', 'relevance_score': '0.5'}, {'topic': 'Financial Markets', 'relevance_score': '0.858979'}, {'topic': 'Earnings', 'relevance_score': '0.928769'}, {'topic': 'Technology', 'relevance_score': '0.5'}]",Bullish,0.373839,NFLX
SafeCard RFID Blocking Card: Best Option on the Market to Review,"New York City, April 07, 2025 ( GLOBE NEWSWIRE ) -- In an increasingly digital world, the threat of data theft looms larger than ever. As we rely on technology for everything from shopping to banking, our personal information becomes a prime target for digital thieves.",Benzinga,20250407T172548,"[{'topic': 'Technology', 'relevance_score': '1.0'}, {'topic': 'Financial Markets', 'relevance_score': '0.77141'}]",Somewhat-Bullish,0.33672,NFLX
3 Domestic Auto Stocks to Watch Amid Growing Economic Uncertainty,"Domestic auto players like TSLA, GM and BLBD are expected to withstand the industry headwinds better.",Zacks Commentary,20250407T150100,"[{'topic': 'Economy - Monetary', 'relevance_score': '0.158519'}, {'topic': 'Economy - Fiscal', 'relevance_score': '0.158519'}, {'topic': 'Financial Markets', 'relevance_score': '0.962106'}, {'topic': 'Manufacturing', 'relevance_score': '1.0'}, {'topic': 'Earnings', 'relevance_score': '0.99986'}]",Somewhat-Bullish,0.190654,NFLX
"Is Trending Stock Netflix, Inc.  ( NFLX )  a Buy Now?","Netflix (NFLX) has been one of the stocks most watched by Zacks.com users lately. So, it is worth exploring what lies ahead for the stock.",Zacks Commentary,20250407T130013,"[{'topic': 'Earnings', 'relevance_score': '1.0'}, {'topic': 'Financial Markets', 'relevance_score': '0.54554'}]",Somewhat-Bullish,0.2106,NFLX
Toyota's All-New 2025 4Runner Campaign Ventures 'Into the Wild' - Toyota Motor  ( NYSE:TM ) ,"A Magical Journey Inspired by an Awe-Filled Adventure PLANO, Texas, April 7, 2025 /PRNewswire/ -- Toyota is inviting drivers to rediscover adventure with its latest marketing campaign, ""Your Window to the Wild,"" celebrating the all-new 2025 Toyota 4Runner.",Benzinga,20250407T130000,"[{'topic': 'Technology', 'relevance_score': '1.0'}, {'topic': 'Financial Markets', 'relevance_score': '0.108179'}]",Bullish,0.413767,NFLX
When Will the Ultra-Low-Cost Vanguard Growth ETF Return to Its Previous Highs?,"Over the past decade-plus, growth stocks have been largely responsible for leading the major U.S. stock market indexes to new heights. Growth-driven exchange-traded funds ( ETFs ) -- like the Vanguard Growth ETF ( NYSEMKT: VUG ) -- have significantly outperformed the S&P 500.",Motley Fool,20250407T123000,"[{'topic': 'Financial Markets', 'relevance_score': '0.999989'}, {'topic': 'Manufacturing', 'relevance_score': '0.5'}, {'topic': 'Earnings', 'relevance_score': '0.614606'}, {'topic': 'Technology', 'relevance_score': '0.5'}]",Somewhat-Bullish,0.233395,NFLX
Comedian and SNL Superstar Mikey Day Drops Travel Knowledge as 'The Common Sensei' in New Dollar Car Rental Ad Campaign - Hertz Global Holdings  ( NASDAQ:HTZ ) ,"Day Offers Witty, No-Nonsense Tips to Simplify Travel & Car Rental",Benzinga,20250407T120000,"[{'topic': 'Financial Markets', 'relevance_score': '0.108179'}]",Bullish,0.36079,NFLX
Could Netflix Stock Help You Become a Millionaire?,"Netflix ( NASDAQ: NFLX ) has been one of the best performing stocks this century. Shares have skyrocketed 59,900% in the past two decades ( as of April 3 ) . Early investors who held on through the ups and downs have been richly rewarded, with some likely accumulating massive amounts of ...",Motley Fool,20250407T111500,"[{'topic': 'Earnings', 'relevance_score': '0.905476'}, {'topic': 'Financial Markets', 'relevance_score': '0.538269'}]",Somewhat-Bullish,0.273947,NFLX
Zacks Investment Ideas feature highlights: Netflix and NVIDIA,Netflix and NVIDIA have been highlighted in this Investment Ideas article.,Zacks Commentary,20250407T094700,"[{'topic': 'Earnings', 'relevance_score': '0.891286'}, {'topic': 'Financial Markets', 'relevance_score': '0.999822'}, {'topic': 'Manufacturing', 'relevance_score': '1.0'}]",Somewhat-Bullish,0.162424,NFLX
"Netflix Seen As Safe Bet Amid Market Volatility, Says Analyst: Strong Value, Digital Model Make It Recession-Ready - Netflix  ( NASDAQ:NFLX ) ","Netflix Inc. NFLX has been identified as a promising investment option by an analyst, demonstrating resilience amid market volatility. What Happened: The streaming giant's digital, consumer-facing business model and robust value proposition make it a strong contender even during a recession, ...",Benzinga,20250407T093251,"[{'topic': 'Earnings', 'relevance_score': '0.650727'}, {'topic': 'Financial Markets', 'relevance_score': '0.929393'}, {'topic': 'Economy - Macro', 'relevance_score': '0.158519'}]",Somewhat-Bullish,0.239252,NFLX
"Tariff Turmoil: 2 Spectacular Stocks to Confidently Buy With $1,500 During the Nasdaq Correction","On April 2, President Trump announced sweeping tariffs on America's trading partners, which will increase the cost of physical goods coming into the country. The president's goal is to encourage more companies to manufacture products domestically to drive job creation, but there is likely to be ...",Motley Fool,20250407T090300,"[{'topic': 'Earnings', 'relevance_score': '0.999975'}, {'topic': 'Technology', 'relevance_score': '1.0'}, {'topic': 'Financial Markets', 'relevance_score': '0.996023'}]",Somewhat-Bullish,0.213675,NFLX
Market Turmoil: 3 Stocks to Steady Any Portfolio,"The recent correction in the stock market is making many investors uneasy. Amid several days of considerable sell-offs, shareholders are likely questioning past investments, and others may ask themselves whether they want to stay in the stock market at all. dfdf , Nonetheless, many top tech ...",Motley Fool,20250406T114500,"[{'topic': 'Financial Markets', 'relevance_score': '1.0'}, {'topic': 'Manufacturing', 'relevance_score': '0.5'}, {'topic': 'Earnings', 'relevance_score': '0.891286'}, {'topic': 'Technology', 'relevance_score': '0.5'}]",Somewhat-Bullish,0.280937,NFLX
This Stock Has More Than Doubled Already in 2025. Is It a Buy?,"Fortunes can quickly change in equity markets. FuboTV ( NYSE: FUBO ) , a streaming specialist, knows something about that.After a terrible performance in 2024, the stock has already more than doubled in 2025. Recent developments arguably justify the massive jump FuboTV has experienced ( more on ...",Motley Fool,20250405T103200,"[{'topic': 'Financial Markets', 'relevance_score': '0.977154'}]",Somewhat-Bullish,0.192049,NFLX
3 Brilliant Growth Stocks to Buy Now and Hold for the Long Term,These proven market-beating stocks have declined between 12% and 64% from their highs. Consider buying the dip.,Motley Fool,20250405T094000,"[{'topic': 'Earnings', 'relevance_score': '0.96136'}, {'topic': 'Technology', 'relevance_score': '1.0'}, {'topic': 'Financial Markets', 'relevance_score': '0.996023'}]",Somewhat-Bullish,0.286205,NFLX
What We Can Learn From Companies That Brought Great Ideas to Life,Investors weren't exactly wrong to be excited about the companies trying to make meal kits and plant-based meat cool. But they sure haven't made any money from those bets. So...what went wrong?,Motley Fool,20250405T012600,"[{'topic': 'IPO', 'relevance_score': '0.451494'}, {'topic': 'Retail & Wholesale', 'relevance_score': '0.333333'}, {'topic': 'Financial Markets', 'relevance_score': '0.999993'}, {'topic': 'Manufacturing', 'relevance_score': '0.333333'}, {'topic': 'Earnings', 'relevance_score': '1.0'}, {'topic': 'Technology', 'relevance_score': '0.333333'}]",Somewhat-Bullish,0.168007,NFLX
Ramki Sankaranarayanan Receives EGA's Hermes Lifetime Achievement Award for Pioneering Innovation in Global Content Operations,"LOS ANGELES, April 4, 2025 /PRNewswire/ -- The Entertainment Globalization Association ( EGA ) has honored Ramki Sankaranarayanan, Founder and Global CEO of Prime Focus Technologies ( PFT ) , with the 2025 Hermes Lifetime Achievement Award.",Benzinga,20250404T223900,"[{'topic': 'Earnings', 'relevance_score': '0.108179'}]",Bullish,0.553336,NFLX
Marriott Bonvoy Unveils Cinematic Global Campaign Celebrating How Travel Shapes Us,"World's leading hospitality brand reaffirms that travel is not just about the stay, but the experiences that stay with you. BETHESDA, Md., April 4, 2025 /PRNewswire/ -- What makes a trip unforgettable?",Benzinga,20250404T140000,"[{'topic': 'Energy & Transportation', 'relevance_score': '0.333333'}, {'topic': 'Real Estate & Construction', 'relevance_score': '0.333333'}, {'topic': 'Technology', 'relevance_score': '0.333333'}]",Bullish,0.36006,NFLX
Will VZ Stock Benefit From a Three-Year Price Lock Guarantee?,"Despite a customer-centric business model, VZ appears to be treading in the middle of the road and investors could be better off if they trade with caution.",Zacks Commentary,20250404T123600,"[{'topic': 'Financial Markets', 'relevance_score': '0.929393'}, {'topic': 'Earnings', 'relevance_score': '0.108179'}, {'topic': 'Technology', 'relevance_score': '0.5'}, {'topic': 'Finance', 'relevance_score': '0.5'}]",Somewhat-Bullish,0.249193,NFLX
"Verizon's New 3-Year Price Lock, Free Phone Offer: Strategic Move To Boost Customer Retention - Verizon Communications  ( NYSE:VZ ) ","Verizon offers three-year price lock and free phone for new and existing myPlan customers, boosting value amid competitive market. Verizon's new plan includes free satellite text messaging, but price hikes on fees and taxes remain possible, experts warn. Feel unsure about the market's next move?",Benzinga,20250404T120125,"[{'topic': 'Technology', 'relevance_score': '1.0'}, {'topic': 'Financial Markets', 'relevance_score': '0.161647'}]",Somewhat-Bullish,0.296673,NFLX
"Buy this Tech Stock for Safety as AI, Mag 7 Plunge on Tariff Fears",NFLX's 50% climb over the last year is even more impressive since it wasn't fueled by artificial intelligence hype.,Zacks Commentary,20250404T120000,"[{'topic': 'Earnings', 'relevance_score': '0.891286'}, {'topic': 'Financial Markets', 'relevance_score': '0.998682'}, {'topic': 'Manufacturing', 'relevance_score': '1.0'}]",Neutral,0.148056,NFLX
FOXA or NFLX: Which Is the Better Value Stock Right Now?,FOXA vs. NFLX: Which Stock Is the Better Value Option?,Zacks Commentary,20250403T154005,"[{'topic': 'Earnings', 'relevance_score': '0.838487'}]",Bullish,0.454714,NFLX
Gold Tops Bitcoin As Inflation Hedge; Metals Exempt From Trump Tariffs As White House Eyes Industry Boost; Chinese Tech Giants Order $16B In Nvidia Chips Amid AI Boom - Top Headlines While The US Slept,"Trump's 'Reign Of Tariffs' Unleashes 'D-Day On Wall Street,' Analyst Warns Of Stagflation Risk US Stocks Likely To Open Lower Following Trump's Tariffs: 'Worse Than The Worst Case Scenario,' Says Analyst Dow Jumps Over 200 Points As Tesla Surges Over 5%: Investor Sentiment Improves, But Greed ...",Benzinga,20250403T143643,"[{'topic': 'Life Sciences', 'relevance_score': '0.2'}, {'topic': 'Technology', 'relevance_score': '0.2'}, {'topic': 'Finance', 'relevance_score': '0.2'}, {'topic': 'Blockchain', 'relevance_score': '0.158519'}, {'topic': 'Economy - Monetary', 'relevance_score': '0.310843'}, {'topic': 'Retail & Wholesale', 'relevance_score': '0.2'}, {'topic': 'Financial Markets', 'relevance_score': '0.266143'}, {'topic': 'Manufacturing', 'relevance_score': '0.2'}, {'topic': 'Earnings', 'relevance_score': '0.684621'}]",Neutral,-0.02759,NFLX
"76th ANNUAL CHRISTOPHER AWARD WINNERS CELEBRATE CAREGIVERS, EMPATHY, AND MORAL COURAGE","NEW YORK, April 3, 2025 /PRNewswire/ -- Moral courage, reaching your potential, and finding purpose in loving God and neighbor are some of the themes reflected in the 21 films, TV programs, and books for adults and young people being honored with Christopher Awards in the program's 76th year.",Benzinga,20250403T142900,[],Somewhat-Bullish,0.215496,NFLX
"Deepdub Launches Deepdub Live, Bringing Real-Time Emotive Dubbing to Global Live Events","The industry-first solution brings expressive, multilingual voice localization to live sports, esports, and news events - powered by Deepdub's proprietary eTTS™ technology",Benzinga,20250403T132200,"[{'topic': 'Real Estate & Construction', 'relevance_score': '1.0'}]",Somewhat-Bullish,0.302514,NFLX
Here's Why Investors Should Retain AMC Entertainment Stock Now,"AMC's focus on customer retention through innovative loyalty and subscription programs bodes well. However, declining attendance is a concern.",Zacks Commentary,20250403T122400,"[{'topic': 'Life Sciences', 'relevance_score': '0.25'}, {'topic': 'Retail & Wholesale', 'relevance_score': '0.25'}, {'topic': 'Financial Markets', 'relevance_score': '0.214378'}, {'topic': 'Manufacturing', 'relevance_score': '0.25'}, {'topic': 'Earnings', 'relevance_score': '0.988915'}, {'topic': 'Energy & Transportation', 'relevance_score': '0.25'}]",Somewhat-Bullish,0.338949,NFLX
"Questrade introduces $0 commission, real-time fractional stock and ETF trading, reminding Canadians there's no better time to Get Yours","TORONTO, April 03, 2025 ( GLOBE NEWSWIRE ) -- Questrade ( www.questrade.com ) -- Canada's #1 rated* online brokerage -- is pleased to announce the introduction of real-time fractional stock and ETF trading on all of its platforms beginning today.",Benzinga,20250403T120036,"[{'topic': 'Financial Markets', 'relevance_score': '0.999982'}, {'topic': 'Manufacturing', 'relevance_score': '0.333333'}, {'topic': 'Technology', 'relevance_score': '0.333333'}, {'topic': 'Finance', 'relevance_score': '0.333333'}]",Somewhat-Bullish,0.226956,NFLX
The Smurfs Have Landed in Solitaire Grand Harvest Ready For A Smurf-tacular Adventure - Playtika Holding  ( NASDAQ:PLTK ) ,"Enter a world of Smurfy surprises and help build their dream village! HERZLIYA, Israel, April 3, 2025 /PRNewswire/ -- It's time for fans to dive into the blue world of the Smurfs and experience their in-game takeover of Solitaire Grand Harvest.",Benzinga,20250403T120000,"[{'topic': 'Technology', 'relevance_score': '1.0'}, {'topic': 'Financial Markets', 'relevance_score': '0.108179'}]",Bullish,0.493134,NFLX
Netflix Rolls Out Enhanced Subtitle & Dubbing Options On TV - Netflix  ( NASDAQ:NFLX ) ,"Netflix now allows full language selection for TV streaming. The update improves accessibility and supports language learning. In a market dominated by tariff tensions, geopolitical surprises, and Fed uncertainty, Matt Maley's technical approach delivers clear entry & exit points for consistent ...",Benzinga,20250403T105954,"[{'topic': 'Financial Markets', 'relevance_score': '0.161647'}]",Bullish,0.377648,NFLX
Netflix  ( NFLX )  Laps the Stock Market: Here's Why,"In the latest trading session, Netflix (NFLX) closed at $935.52, marking a +0.77% move from the previous day.",Zacks Commentary,20250402T214515,"[{'topic': 'Earnings', 'relevance_score': '0.961735'}, {'topic': 'Financial Markets', 'relevance_score': '0.214378'}]",Somewhat-Bullish,0.166245,NFLX
"NFL Gets 3 Christmas Day Games In 2025: How Netflix & Amazon Will Both Benefit - Amazon.com  ( NASDAQ:AMZN ) , Walt Disney  ( NYSE:DIS ) ",The NFL is adding a third Christmas Day game in 2025. The three games will see two streaming platforms benefit and could hurt the NBA. The 'Trade of the Day' is now live. Get a high-probability setup with clear entry and exit points right here.,Benzinga,20250402T202555,"[{'topic': 'Retail & Wholesale', 'relevance_score': '0.5'}, {'topic': 'Technology', 'relevance_score': '0.5'}, {'topic': 'Financial Markets', 'relevance_score': '0.413559'}]",Somewhat-Bullish,0.170225,NFLX
Burrell Communications Group welcomes God-is Rivera to its leadership team,"CEO Tara DeVeaux taps highly regarded industry leader as Chief Strategy Officer CHICAGO, April 2, 2025 /PRNewswire/ -- Burrell Communications Group, one of the world's most highly regarded Black-owned advertising agencies, is pleased to welcome acclaimed strategy expert and marketer God-is Rivera ...",Benzinga,20250402T201500,"[{'topic': 'Life Sciences', 'relevance_score': '0.333333'}, {'topic': 'Technology', 'relevance_score': '0.333333'}, {'topic': 'Manufacturing', 'relevance_score': '0.333333'}]",Bullish,0.432951,NFLX
Is the Market Bullish or Bearish on Netflix? - Netflix  ( NASDAQ:NFLX ) ,"Netflix's NFLX short percent of float has risen 10.34% since its last report. The company recently reported that it has 8.14 million shares sold short, which is 1.92% of all regular shares that are available for trading. Based on its trading volume, it would take traders 1.39 days to cover their ...",Benzinga,20250402T174530,"[{'topic': 'Financial Markets', 'relevance_score': '0.413559'}]",Somewhat-Bullish,0.292068,NFLX
Cinema is Coming Home: Sony Electronics Expands its BRAVIA® TV Line-Up for the Most Authentic Cinematic Home Experience,"The expanded lineup hosts cutting-edge processing and contrast in large and small screen sizes to perfectly complement any room SAN DIEGO, April 2, 2025 /PRNewswire/ -- Sony Electronics Inc. announced its new 2025 BRAVIA® TVs, bringing even more options to enjoy cinema at home and experience it ...",Benzinga,20250402T160000,"[{'topic': 'Life Sciences', 'relevance_score': '0.5'}, {'topic': 'Technology', 'relevance_score': '0.5'}]",Bullish,0.358703,NFLX
MediaRadar set to lead competitive ad intel market with enhanced capabilities across Streaming TV and cross-media measurement,"MediaRadar integrates Vivvix data, providing actionable marketing intelligence across $275B in cross-media spend and over 35 million creative assets.",Benzinga,20250402T125000,"[{'topic': 'Technology', 'relevance_score': '1.0'}, {'topic': 'Financial Markets', 'relevance_score': '0.108179'}]",Bullish,0.481468,NFLX
DebitMyData Launches Digital Identity LLM-Driven by Agentic Avatar System - Your Data Earns While You Sleep,"FORT LAUDERDALE, Fla., April 02, 2025 ( GLOBE NEWSWIRE ) -- DebitMyData disrupts the digital economy with its proprietary LLM platform, enabling users to earn passive income from their data while combating AI-driven job displacement and DeepFakes.",Benzinga,20250402T114247,"[{'topic': 'Earnings', 'relevance_score': '0.108179'}, {'topic': 'Technology', 'relevance_score': '1.0'}, {'topic': 'Blockchain', 'relevance_score': '0.451494'}]",Bullish,0.354719,NFLX
Fast Track to AV1 with Beamr: High-Quality at a Fraction of the Cost,"Beamr will showcase its high-performance AV1 solutions, accelerated by NVIDIA GPUs, and with simple, competitive pricing, at the 2025 NAB Show in Las Vegas ...",GlobeNewswire,20250402T113500,"[{'topic': 'Real Estate & Construction', 'relevance_score': '0.5'}, {'topic': 'Financial Markets', 'relevance_score': '0.158519'}, {'topic': 'Manufacturing', 'relevance_score': '0.5'}]",Somewhat-Bullish,0.301849,NFLX
Fast Track to AV1 with Beamr: High-Quality at a Fraction of the Cost - Beamr Imaging  ( NASDAQ:BMR ) ,"Beamr will showcase its high-performance AV1 solutions, accelerated by NVIDIA GPUs, and with simple, competitive pricing, at the 2025 NAB Show in Las Vegas HERZLIYA, Israel, April 02, 2025 ( GLOBE NEWSWIRE ) -- Beamr Imaging Ltd.",Benzinga,20250402T113500,"[{'topic': 'Real Estate & Construction', 'relevance_score': '0.5'}, {'topic': 'Financial Markets', 'relevance_score': '0.538269'}, {'topic': 'Manufacturing', 'relevance_score': '0.5'}]",Somewhat-Bullish,0.29461,NFLX
2 Unstoppable Stocks That Could Grow More Than 200% in 10 Years,"Netflix ( NASDAQ: NFLX ) and Intuitive Surgical ( NASDAQ: ISRG ) are leaders in their respective industries, and have produced market-beating returns over long periods. Some might argue that the best is in the rearview mirror for these corporations, considering how well they've performed in the ...",Motley Fool,20250402T094500,"[{'topic': 'Earnings', 'relevance_score': '0.161647'}, {'topic': 'Life Sciences', 'relevance_score': '1.0'}]",Somewhat-Bullish,0.254959,NFLX
A Closer Look at Netflix's Options Market Dynamics - Netflix  ( NASDAQ:NFLX ) ,"Financial giants have made a conspicuous bullish move on Netflix. Our analysis of options history for Netflix NFLX revealed 32 unusual trades. Delving into the details, we found 43% of traders were bullish, while 43% showed bearish tendencies.",Benzinga,20250401T140243,"[{'topic': 'Earnings', 'relevance_score': '0.360215'}, {'topic': 'Financial Markets', 'relevance_score': '0.413559'}]",Somewhat-Bullish,0.208076,NFLX
Wall Street Bulls Look Optimistic About Netflix  ( NFLX ) : Should You Buy?,"Based on the average brokerage recommendation (ABR), Netflix (NFLX) should be added to one's portfolio. Wall Street analysts' overly optimistic recommendations cast doubt on the effectiveness of this highly sought-after metric. So, is the stock worth buying?",Zacks Commentary,20250401T133010,"[{'topic': 'Earnings', 'relevance_score': '0.890401'}, {'topic': 'Financial Markets', 'relevance_score': '0.459462'}]",Somewhat-Bullish,0.286917,NFLX
5 Top Stocks to Buy in April,"The stock market sell-off is intensifying, with the S&P 500 ( SNPINDEX: ^GSPC ) down 4.8% in the first three months of the year compared to an over 10% tumble in the Nasdaq Composite ( NASDAQINDEX: ^IXIC ) . Even quality growth stocks like Amazon ( NASDAQ: AMZN ) and Netflix ( NASDAQ: NFLX ) are ...",Motley Fool,20250401T103000,"[{'topic': 'Economy - Monetary', 'relevance_score': '0.158519'}, {'topic': 'Retail & Wholesale', 'relevance_score': '0.333333'}, {'topic': 'Financial Markets', 'relevance_score': '1.0'}, {'topic': 'Manufacturing', 'relevance_score': '0.333333'}, {'topic': 'Earnings', 'relevance_score': '0.972476'}, {'topic': 'Energy & Transportation', 'relevance_score': '0.333333'}]",Somewhat-Bullish,0.232404,NFLX
Should You Buy the Invesco QQQ ETF During the Nasdaq Correction? History Offers a Clear Answer.,"The Nasdaq-100 index features 100 of the largest nonfinancial companies listed on the Nasdaq stock exchange. It's home to many of the trillion-dollar tech giants that lead the artificial intelligence ( AI ) industry, so it has delivered spectacular returns over the last couple of years.However, ...",Motley Fool,20250401T082700,"[{'topic': 'Life Sciences', 'relevance_score': '0.25'}, {'topic': 'Financial Markets', 'relevance_score': '0.999483'}, {'topic': 'Manufacturing', 'relevance_score': '0.25'}, {'topic': 'Technology', 'relevance_score': '0.25'}, {'topic': 'Finance', 'relevance_score': '0.25'}]",Somewhat-Bullish,0.163514,NFLX
