title,summary,source,time_published,topics,overall_sentiment_label,overall_sentiment_score,ticker
Nvidia Stock Is Tumbling After Hours: Here's Why - NVIDIA  ( NASDAQ:NVDA ) ,Nvidia says the company was recently informed by the U.S. government that it will need a license to export certain chips to China. Nvidia says it expects its first-quarter financial results to include up to $5.5 billion of charges associated with chips held in inventory.,Benzinga,20250415T220510,"[{'topic': 'Financial Markets', 'relevance_score': '0.266143'}, {'topic': 'Manufacturing', 'relevance_score': '1.0'}]",Neutral,0.111092,NVDA
Nvidia Brings Powerful RTX 5060 Graphics Cards To Gamers And Creators At Budget Prices - NVIDIA  ( NASDAQ:NVDA ) ,"Nvidia Corp. NVDA has introduced its latest line of graphics cards, the GeForce RTX 5060 series, which starts at $299 and brings AI-powered rendering and the company's newest Blackwell architecture to a broader gaming audience.",Benzinga,20250415T193748,"[{'topic': 'Financial Markets', 'relevance_score': '0.108179'}, {'topic': 'Manufacturing', 'relevance_score': '1.0'}]",Somewhat-Bullish,0.215714,NVDA
Netflix Earnings Preview: A Diamond in the Magnificent 7 Rough,"While most ""Magnificent 7"" stocks have experienced significant declines amidst Wall Street's volatile start to 2025, Netflix stands out as a resilient performer ahead of its upcoming Q1 earnings report on Thursday, April 17th.",Zacks Commentary,20250415T193200,"[{'topic': 'Retail & Wholesale', 'relevance_score': '0.333333'}, {'topic': 'Financial Markets', 'relevance_score': '0.684621'}, {'topic': 'Manufacturing', 'relevance_score': '0.333333'}, {'topic': 'Earnings', 'relevance_score': '0.980509'}, {'topic': 'Technology', 'relevance_score': '0.333333'}]",Somewhat-Bullish,0.18115,NVDA
Snowflake vs. MongoDB: Which Data Platform Stock is a Better Pick?,SNOW and MDB are well-known players in the database management system space. Which one is a better investment option?,Zacks Commentary,20250415T190100,"[{'topic': 'Financial Markets', 'relevance_score': '0.266143'}, {'topic': 'Manufacturing', 'relevance_score': '0.333333'}, {'topic': 'Earnings', 'relevance_score': '0.928769'}, {'topic': 'Energy & Transportation', 'relevance_score': '0.333333'}, {'topic': 'Technology', 'relevance_score': '0.333333'}]",Bullish,0.389959,NVDA
2 Wide Moat Semiconductor Stocks a Bargain Buy Now: ASML and NVDA,"Now is a great opportunity to invest in ASML and NVIDIA, both set to thrive after a recent drop in share prices.",Zacks Commentary,20250415T190000,"[{'topic': 'Financial Markets', 'relevance_score': '0.962106'}, {'topic': 'Manufacturing', 'relevance_score': '0.5'}, {'topic': 'Earnings', 'relevance_score': '0.682689'}, {'topic': 'Technology', 'relevance_score': '0.5'}]",Somewhat-Bullish,0.238911,NVDA
"Nvidia Opens US AI Factories While Advanced Micro Digs Deeper Into 2nm - Who's Really Powering The Future? - NVIDIA  ( NASDAQ:NVDA ) , Advanced Micro Devices  ( NASDAQ:AMD ) ","Nvidia Corp NVDA and Advanced Micro Devices Inc AMD are racing to define the future of AI and data center dominance. While one is breaking ground in the U.S., the other is shrinking down to the cutting edge of 2nm tech. Investors hoping to ride the AI wave must decide: factory floors or ...",Benzinga,20250415T185827,"[{'topic': 'Financial Markets', 'relevance_score': '0.214378'}, {'topic': 'Manufacturing', 'relevance_score': '1.0'}]",Somewhat-Bullish,0.200919,NVDA
Bitcoin death cross still present despite rally to $86K - Should BTC traders be afraid?,"On April 6, Bitcoin price formed a death cross on a daily chart - a technical pattern where the 50-day moving average ( MA ) falls below the 200-day MA. Historically associated with trend reversals and long bearish trading periods, this ominous signal has sometimes preceded major market ...",Cointelegraph,20250415T184200,"[{'topic': 'Technology', 'relevance_score': '0.5'}, {'topic': 'Financial Markets', 'relevance_score': '0.108179'}, {'topic': 'Manufacturing', 'relevance_score': '0.5'}]",Somewhat-Bearish,-0.309689,NVDA
Nvidia Stock Could Get Boost From Another Jensen Huang Keynote Speech: Here's The Date And Details - NVIDIA  ( NASDAQ:NVDA ) ,Nvidia CEO Jensen Huang will give a keynote about AI at an upcoming conference in Taiwan. Nvidia stock has often been volatile around Huang's keynote speeches. China's new tariffs just reignited the same market patterns that led to triple- and quadruple-digit wins for Matt Maley.,Benzinga,20250415T174619,"[{'topic': 'Financial Markets', 'relevance_score': '0.459462'}, {'topic': 'Manufacturing', 'relevance_score': '1.0'}]",Somewhat-Bullish,0.17285,NVDA
4 Reasons Alphabet Could Be the Best Artificial Intelligence  ( AI )  Stock to Buy Right Now,"Alphabet ( NASDAQ: GOOGL ) ( NASDAQ: GOOG ) stock reached an all-time high price of $207.05 on Feb. 4, riding a wave of strong growth and earnings momentum from 2024. For shareholders, the last few months have been challenging with concerns over the strength of the global economy rattling the ...",Motley Fool,20250415T171700,"[{'topic': 'Retail & Wholesale', 'relevance_score': '0.333333'}, {'topic': 'Financial Markets', 'relevance_score': '0.929393'}, {'topic': 'Manufacturing', 'relevance_score': '0.333333'}, {'topic': 'Earnings', 'relevance_score': '0.999939'}, {'topic': 'Technology', 'relevance_score': '0.333333'}]",Bullish,0.389249,NVDA
2 Tech Stocks That Are Screaming Buys in April,"There's no shortage of discounts on the stock market these days.Stocks were already slumping in March on weakening consumer sentiment and fears of an economic slowdown, but major indexes plummeted in April on President Donald Trump's tariff plan, which has sent a near-unprecedented wave of ...",Motley Fool,20250415T171500,"[{'topic': 'Financial Markets', 'relevance_score': '0.99793'}, {'topic': 'Manufacturing', 'relevance_score': '0.5'}, {'topic': 'Earnings', 'relevance_score': '0.994953'}, {'topic': 'Technology', 'relevance_score': '0.5'}]",Neutral,0.112011,NVDA
Should You Brace for Mag-7 ETFs Before It's Too Late?,"Mag-7 stocks are in the deep correction zone now, and valuation is down to the pre-ChatGPT level. Although the group has fallen from grace, core strengths remain intact.",Zacks Commentary,20250415T170000,"[{'topic': 'Retail & Wholesale', 'relevance_score': '0.25'}, {'topic': 'Financial Markets', 'relevance_score': '0.999162'}, {'topic': 'Manufacturing', 'relevance_score': '0.25'}, {'topic': 'Earnings', 'relevance_score': '0.576289'}, {'topic': 'Technology', 'relevance_score': '0.25'}, {'topic': 'Finance', 'relevance_score': '0.25'}]",Neutral,0.048463,NVDA
"Investors, Don't Be A Hero","To gain an edge, this is what you need to know today. Please click here for an enlarged chart of Invesco QQQ Trust Series 1 ( QQQ ) . If QQQ breaks below the micro support zone, short sellers will push the pedal again. If QQQ breaks above the micro resistance zone, the momo crowd will ...",Benzinga,20250415T155403,"[{'topic': 'Economy - Monetary', 'relevance_score': '0.158519'}, {'topic': 'Financial Markets', 'relevance_score': '0.996718'}, {'topic': 'Manufacturing', 'relevance_score': '0.333333'}, {'topic': 'Technology', 'relevance_score': '0.333333'}, {'topic': 'Finance', 'relevance_score': '0.333333'}]",Somewhat-Bullish,0.246936,NVDA
Jamie Dimon urges US to engage with China,JPMorgan Chase chief executive warns US dominance cannot be taken for granted ...,Financial Times,20250415T155120,"[{'topic': 'Economy - Monetary', 'relevance_score': '0.158519'}, {'topic': 'Economy - Fiscal', 'relevance_score': '0.158519'}, {'topic': 'Financial Markets', 'relevance_score': '0.999701'}, {'topic': 'Manufacturing', 'relevance_score': '1.0'}, {'topic': 'Earnings', 'relevance_score': '0.158519'}, {'topic': 'Mergers & Acquisitions', 'relevance_score': '0.310843'}]",Neutral,0.14032,NVDA
What Nvidia and Tech Investors Should Know About Recent Tariff Updates,Tariff updates keep changing the market sentiment toward tech and semiconductor investors.,Motley Fool,20250415T151500,"[{'topic': 'Technology', 'relevance_score': '0.5'}, {'topic': 'Manufacturing', 'relevance_score': '0.5'}]",Neutral,0.099038,NVDA
Arista Networks vs. Cisco: Which Networking Stock is a Better Bet?,CSCO appears to be a better investment option compared to ANET at the moment.,Zacks Commentary,20250415T150500,"[{'topic': 'Earnings', 'relevance_score': '0.955357'}, {'topic': 'Technology', 'relevance_score': '0.5'}, {'topic': 'Manufacturing', 'relevance_score': '0.5'}]",Somewhat-Bullish,0.236932,NVDA
Comparing NVIDIA With Industry Competitors In Semiconductors & Semiconductor Equipment Industry - NVIDIA  ( NASDAQ:NVDA ) ,"In today's rapidly changing and fiercely competitive business landscape, it is vital for investors and industry enthusiasts to carefully evaluate companies. In this article, we will perform a comprehensive industry comparison, evaluating NVIDIA NVDA against its key competitors in the ...",Benzinga,20250415T150016,"[{'topic': 'Earnings', 'relevance_score': '0.938793'}, {'topic': 'Financial Markets', 'relevance_score': '0.623304'}, {'topic': 'Manufacturing', 'relevance_score': '1.0'}]",Somewhat-Bullish,0.237692,NVDA
Will PRGS' AI-Powered Upgrades to Sitefinity Drive the Stock Upward?,Progress Software strengthens Sitefinity content management platform with new AI capabilities to power digital experiences.,Zacks Commentary,20250415T145600,"[{'topic': 'Earnings', 'relevance_score': '0.983783'}, {'topic': 'Technology', 'relevance_score': '0.5'}, {'topic': 'Manufacturing', 'relevance_score': '0.5'}]",Somewhat-Bullish,0.30851,NVDA
Wall Street Analyst Recently Downgraded Nvidia Stock Due to Artificial Intelligence  ( AI )  Concerns,What Nvidia stock investors should know about the recent downgrade.,Motley Fool,20250415T140000,"[{'topic': 'Financial Markets', 'relevance_score': '0.108179'}, {'topic': 'Manufacturing', 'relevance_score': '1.0'}]",Neutral,-0.011801,NVDA
Technical Analysis For SPY And Top Tech Stocks Amid Bearish Sentiment - Alphabet  ( NASDAQ:GOOGL ) ,"Good Morning Traders! In today's Market Clubhouse Morning Memo, we will discuss SPY, QQQ, AAPL, MSFT, NVDA, GOOGL, META, and TSLA. Our proprietary formula, exclusive to Market Clubhouse, dictates these price levels. This dynamic equation takes into account price, volume, and options flow.",Benzinga,20250415T135025,"[{'topic': 'Economy - Monetary', 'relevance_score': '0.451494'}, {'topic': 'Financial Markets', 'relevance_score': '0.623304'}, {'topic': 'Manufacturing', 'relevance_score': '0.5'}, {'topic': 'Technology', 'relevance_score': '0.5'}]",Somewhat-Bullish,0.217117,NVDA
Huawei launches new AI architecture to challenge Nvidia's dominance,Huawei's alleged advancement points to the US-sanctioned company's progress in achieving self-sufficiency in computing power.,South China Morning Post,20250415T133008,"[{'topic': 'Financial Markets', 'relevance_score': '0.108179'}, {'topic': 'Manufacturing', 'relevance_score': '1.0'}]",Somewhat-Bullish,0.157805,NVDA
Nvidia and Tech Stock Investors Got Some Hopeful News Over the Weekend,What Nvidia stock investors should know about the recent tariff updates.,Motley Fool,20250415T133000,"[{'topic': 'Financial Markets', 'relevance_score': '0.108179'}, {'topic': 'Manufacturing', 'relevance_score': '1.0'}]",Neutral,0.096739,NVDA
3 Crypto Stocks to Buy the Dip Before Bitcoin Regains Lost Ground,"Crypto-centric stocks like IBKR, NVDA and HOOD are poised to benefit once the Bitcoin rally resumes.",Zacks Commentary,20250415T131800,"[{'topic': 'Economy - Monetary', 'relevance_score': '0.576289'}, {'topic': 'Financial Markets', 'relevance_score': '0.77141'}, {'topic': 'Manufacturing', 'relevance_score': '0.5'}, {'topic': 'Earnings', 'relevance_score': '0.990678'}, {'topic': 'Finance', 'relevance_score': '0.5'}, {'topic': 'Blockchain', 'relevance_score': '0.928139'}]",Somewhat-Bullish,0.192445,NVDA
Acer Debuts Nitro Gaming PCs Featuring Latest NVIDIA GeForce RTX 50 Series GPUs,"New Acer Nitro AI laptops with slim options and the Nitro 20 desktop offer solid performance and essential AI capabilities, supported by new NVIDIA GeForce RTX 5060 GPUs Acer expands its Nitro gaming line with the Nitro AI gaming laptops, now with new slim models available, and the Nitro 20 desktop.",Benzinga,20250415T130000,"[{'topic': 'Manufacturing', 'relevance_score': '1.0'}]",Somewhat-Bullish,0.210129,NVDA
RADCOM Down 21% in Three Months: Where Will the Stock Head From Here?,"Increasing demand bodes well for RADCOM, but higher costs, execution risks, geopolitical tension and forex exposure remain overhangs.",Zacks Commentary,20250415T123300,"[{'topic': 'Financial Markets', 'relevance_score': '0.929393'}, {'topic': 'Manufacturing', 'relevance_score': '0.5'}, {'topic': 'Earnings', 'relevance_score': '0.993856'}, {'topic': 'Technology', 'relevance_score': '0.5'}]",Somewhat-Bullish,0.267792,NVDA
"Nvidia Remains a Top Pick Despite Tariff Headwinds, Says Analyst: '...Important Data Center Modernization…Among the Last Areas to Be Cut' - NVIDIA  ( NASDAQ:NVDA ) ","In the face of a potential semiconductor industry slowdown due to tariff uncertainties, Nvidia Corporation NVDA is expected to hold its ground, according to a recent analysis by Redburn Atlantic. What Happened: Redburn Atlantic on Tuesday, highlighted Nvidia's potential to endure the industry's ...",Benzinga,20250415T122818,"[{'topic': 'Financial Markets', 'relevance_score': '0.214378'}, {'topic': 'Manufacturing', 'relevance_score': '1.0'}]",Somewhat-Bullish,0.297491,NVDA
Zacks Industry Outlook Dell and HP,Dell and HP have been highlighted in this Industry Outlook article.,Zacks Commentary,20250415T115600,"[{'topic': 'Financial Markets', 'relevance_score': '0.796627'}, {'topic': 'Manufacturing', 'relevance_score': '0.5'}, {'topic': 'Earnings', 'relevance_score': '0.310843'}, {'topic': 'Technology', 'relevance_score': '0.5'}]",Somewhat-Bullish,0.281759,NVDA
"The Zacks Analyst Blog ServiceNow, Alphabet, NVIDIA and DXC","ServiceNow, Alphabet, NVIDIA and DXC are included in this Analyst Blog.",Zacks Commentary,20250415T114400,"[{'topic': 'Financial Markets', 'relevance_score': '0.503496'}, {'topic': 'Manufacturing', 'relevance_score': '0.5'}, {'topic': 'Earnings', 'relevance_score': '0.967645'}, {'topic': 'Technology', 'relevance_score': '0.5'}]",Somewhat-Bullish,0.182303,NVDA
"The Zacks Analyst Blog Apple, NVIDIA, Advanced Micro Devices, Amazon.com and Alphabet","Apple, NVIDIA, Advanced Micro Devices, Amazon.com and Alphabet are included in this Analyst Blog.",Zacks Commentary,20250415T110800,"[{'topic': 'Financial Markets', 'relevance_score': '0.990999'}, {'topic': 'Manufacturing', 'relevance_score': '0.5'}, {'topic': 'Earnings', 'relevance_score': '0.576289'}, {'topic': 'Technology', 'relevance_score': '0.5'}]",Neutral,0.09888,NVDA
"This Artificial Intelligence  ( AI )  Company Is a Leader in Generative AI Patents. Investors, Take Note.","Which of the ""Magnificent Seven"" stocks has the most generative artificial intelligence ( AI ) patents? You might think it's a company like Microsoft, which has developed extensive generative AI capabilities for its popular products, or Nvidia, which develops the chips that make AI technology ...",Motley Fool,20250415T103700,"[{'topic': 'Earnings', 'relevance_score': '0.980716'}, {'topic': 'Technology', 'relevance_score': '0.5'}, {'topic': 'Manufacturing', 'relevance_score': '0.5'}]",Somewhat-Bullish,0.343799,NVDA
"Got $1,000? Here Are 2 Fantastic Stocks to Buy Right Now.","If you've got some undeployed cash that you're looking to invest in the stock market, I've got two fantastic stocks that look like excellent buys. However, there is a disclaimer on these stocks: you'll need to hold them for at least three to five years to get the full benefit.The tailwinds in the ...",Motley Fool,20250415T103000,"[{'topic': 'Financial Markets', 'relevance_score': '0.796627'}, {'topic': 'Manufacturing', 'relevance_score': '1.0'}, {'topic': 'Earnings', 'relevance_score': '0.365926'}, {'topic': 'Economy - Macro', 'relevance_score': '0.158519'}]",Somewhat-Bullish,0.262434,NVDA
"The Zacks Analyst Blog Apple, NVIDIA, Advanced Micro Devices, Amazon.com and Alphabet","Apple, NVIDIA, Advanced Micro Devices, Amazon.com and Alphabet are included in this Analyst Blog.",Zacks Commentary,20250415T103000,"[{'topic': 'Financial Markets', 'relevance_score': '0.990999'}, {'topic': 'Manufacturing', 'relevance_score': '0.5'}, {'topic': 'Earnings', 'relevance_score': '0.576289'}, {'topic': 'Technology', 'relevance_score': '0.5'}]",Neutral,0.09888,NVDA
Should Vanguard Russell 1000 Growth ETF  ( VONG )  Be on Your Investing Radar?,Style Box ETF report for VONG ...,Zacks Commentary,20250415T102006,"[{'topic': 'Financial Markets', 'relevance_score': '0.999999'}, {'topic': 'Manufacturing', 'relevance_score': '0.333333'}, {'topic': 'Earnings', 'relevance_score': '0.310843'}, {'topic': 'Technology', 'relevance_score': '0.333333'}, {'topic': 'Finance', 'relevance_score': '0.333333'}]",Somewhat-Bullish,0.234057,NVDA
Should Schwab U.S. Large-Cap Growth ETF  ( SCHG )  Be on Your Investing Radar?,Style Box ETF report for ...,Zacks Commentary,20250415T102005,"[{'topic': 'Financial Markets', 'relevance_score': '1.0'}, {'topic': 'Manufacturing', 'relevance_score': '0.333333'}, {'topic': 'Earnings', 'relevance_score': '0.310843'}, {'topic': 'Technology', 'relevance_score': '0.333333'}, {'topic': 'Finance', 'relevance_score': '0.333333'}]",Somewhat-Bullish,0.242945,NVDA
1 Spectacular Vanguard ETF to Buy With $550 During the Tech Bear Market,"The S&P 500 ( SNPINDEX: ^GSPC ) is made up of 500 companies from 11 different economic sectors. The information technology sector is the largest by a wide margin, representing 29.9% of the entire value of the index. The S&P 500 recently suffered a peak-to-trough decline of 19%, falling just shy ...",Motley Fool,20250415T093400,"[{'topic': 'Financial Markets', 'relevance_score': '0.972476'}, {'topic': 'Manufacturing', 'relevance_score': '0.5'}, {'topic': 'Earnings', 'relevance_score': '0.310843'}, {'topic': 'Technology', 'relevance_score': '0.5'}]",Neutral,0.074555,NVDA
"Nasdaq Bear Market: 2 ""Magnificent Seven"" Stocks Down More Than 20% You'll Wish You'd Bought on the Dip","The Nasdaq-100 index is home to 100 of the largest non-financial companies listed on the Nasdaq stock exchange, including each of the ""Magnificent Seven"" stocks, which have a combined value of $14.7 trillion:Their size is just one of the reasons Wall Street named these stocks the Magnificent ...",Motley Fool,20250415T091500,"[{'topic': 'Financial Markets', 'relevance_score': '0.929393'}, {'topic': 'Manufacturing', 'relevance_score': '0.5'}, {'topic': 'Earnings', 'relevance_score': '0.928769'}, {'topic': 'Technology', 'relevance_score': '0.5'}]",Somewhat-Bullish,0.19441,NVDA
Think Nvidia Is Still Expensive? This Chart Might Change Your Mind.,"The recent market turmoil can make any investor nervous. Volatility can be scary as you see the value of your portfolio slump along with the market. For those who remain calm and stay focused on the underlying businesses, it can mean opportunity.Some stocks have risen to nosebleed levels over the ...",Motley Fool,20250415T083200,"[{'topic': 'Earnings', 'relevance_score': '0.310843'}, {'topic': 'Financial Markets', 'relevance_score': '0.266143'}, {'topic': 'Manufacturing', 'relevance_score': '1.0'}]",Neutral,0.024808,NVDA
"Marjorie Taylor Greene Made Large Stock Purchases Ahead Of Trump's 90-Day Tariff Pause: Hakeem Jeffries Calls It 'Problematic' - Apple  ( NASDAQ:AAPL ) , Adobe  ( NASDAQ:ADBE ) ",Rep. Marjorie Taylor Greene ( R-Ga. ) disclosed her significant stock purchases made just before and on the day of former President Donald Trump's announcement to pause global tariffs. This announcement had a substantial impact on the stock market.,Benzinga,20250415T080107,"[{'topic': 'Financial Markets', 'relevance_score': '0.999864'}, {'topic': 'Manufacturing', 'relevance_score': '0.333333'}, {'topic': 'Energy & Transportation', 'relevance_score': '0.333333'}, {'topic': 'Technology', 'relevance_score': '0.333333'}]",Somewhat-Bullish,0.216811,NVDA
Nvidia Has 3 Considerably Bigger Concerns Than Tariffs,"Tariffs may be the talk of Wall Street, but there are far more pressing issues for the stock market's artificial intelligence (AI) darling.",Motley Fool,20250415T075100,"[{'topic': 'Earnings', 'relevance_score': '0.161647'}, {'topic': 'Financial Markets', 'relevance_score': '0.858979'}, {'topic': 'Manufacturing', 'relevance_score': '1.0'}]",Neutral,0.116113,NVDA
"U.S. announces probe into chip, electronics imports, paving the way for new tariffs","The U.S. Commerce Department is conducting an investigation into imports of various semiconductor technologies and electronics, a federal notice shows.",CNBC,20250415T051854,"[{'topic': 'Manufacturing', 'relevance_score': '1.0'}]",Neutral,0.127845,NVDA
"Jensen Huang Praised By Trump: Nvidia 'Wouldn't Be Doing' $500 Billion AI Infrastructure Commitment Without Tariffs - NVIDIA  ( NASDAQ:NVDA ) , Advanced Micro Devices  ( NASDAQ:AMD ) ",President Donald Trump credited his tariff policies for driving Nvidia Corp.'s NVDA massive $500 billion commitment to build artificial intelligence infrastructure in the United States during a White House press conference on Monday.,Benzinga,20250415T051236,"[{'topic': 'Financial Markets', 'relevance_score': '0.365926'}, {'topic': 'Manufacturing', 'relevance_score': '1.0'}]",Bullish,0.367243,NVDA
"AMD CEO Lisa Su Confirms AI Server Production in US, Taps TSMC Arizona For Chips As 'Venice' Hits 2nm Milestone Amid Tariff Uncertainty - Intel  ( NASDAQ:INTC ) , Advanced Micro Devices  ( NASDAQ:AMD ) ",Advanced Micro Devices Inc. AMD CEO Lisa Su confirmed on Tuesday that the company is ready to start chip production at Taiwan Semiconductor Manufacturing Co.'s TSM Arizona facility and will manufacture more artificial intelligence servers in the United States.,Benzinga,20250415T041052,"[{'topic': 'Financial Markets', 'relevance_score': '0.161647'}, {'topic': 'Manufacturing', 'relevance_score': '1.0'}]",Somewhat-Bullish,0.332705,NVDA
Chinese factories in Vietnam see 'crazy' surge in orders amid US tariff pause,US businesses are putting factories in Vietnam under pressure to front-load as many shipments as possible within the 90-day window.,South China Morning Post,20250415T030008,"[{'topic': 'Manufacturing', 'relevance_score': '1.0'}]",Neutral,-0.045641,NVDA
"Bitcoin, Ethereum Steady, Dogecoin Falls Even As Trump's Tariff Reprieve Boosts Stocks: Analyst Says $82,024 BTC Level 'Worth Watching Closely' - Grayscale Bitcoin Mini Trust  ( BTC )  Common units of fractional undivided beneficial interest  ( ARCA:BTC ) ","Leading cryptocurrencies remained flat on Monday, while stocks rose in response to President Donald Trump's tariff respite for technology products. What Happened: Bitcoin chopped between $84,000 and $85,000 throughout the day, with the intraday peak of $85,785.00 set in the early trading hours.",Benzinga,20250415T020425,"[{'topic': 'Financial Markets', 'relevance_score': '0.214378'}, {'topic': 'Manufacturing', 'relevance_score': '0.5'}, {'topic': 'Technology', 'relevance_score': '0.5'}, {'topic': 'Blockchain', 'relevance_score': '0.576289'}]",Somewhat-Bullish,0.171601,NVDA
Nvidia  ( NVDA )  Stock Slides as Market Rises: Facts to Know Before You Trade,"Nvidia (NVDA) concluded the recent trading session at $110.71, signifying a -0.2% move from its prior day's close.",Zacks Commentary,20250414T214515,"[{'topic': 'Earnings', 'relevance_score': '0.976913'}, {'topic': 'Financial Markets', 'relevance_score': '0.365926'}, {'topic': 'Manufacturing', 'relevance_score': '1.0'}]",Somewhat-Bullish,0.15157,NVDA
Nvidia To Build $500 Billion AI Infrastructure In US In the Next Four Years - NVIDIA  ( NASDAQ:NVDA ) ,NVIDIA to produce AI supercomputers entirely in the U.S. Blackwell chips already in production at Arizona plant. China's new tariffs just reignited the same market patterns that led to triple- and quadruple-digit wins for Matt Maley. Get Matt's next trade alert free. Nvidia Corp.,Benzinga,20250414T191821,"[{'topic': 'Financial Markets', 'relevance_score': '0.108179'}, {'topic': 'Manufacturing', 'relevance_score': '1.0'}]",Bullish,0.35651,NVDA
Nvidia to Invest $500 Billion to Build AI Supercomputers in US Amid Trade Tensions,Nvidia's announcement was praised by the White House amid its broader AI infrastructure push.,Decrypt.co,20250414T191213,"[{'topic': 'Financial Markets', 'relevance_score': '0.161647'}, {'topic': 'Manufacturing', 'relevance_score': '1.0'}]",Somewhat-Bullish,0.231214,NVDA
"Chip Shock: 3 Hot Semiconductor ETFs To Watch As Trump's Tariff Bomb Ticks - Broadcom  ( NASDAQ:AVGO ) , ASML Holding  ( NASDAQ:ASML ) ","On Sunday, Trump said that new tariff levels on foreign semiconductors will be announced within this week. Simultaneously, Taiwan has been positively negotiating with Washington to steer clear of getting engulfed in the tariff wave.",Benzinga,20250414T190230,"[{'topic': 'Technology', 'relevance_score': '0.5'}, {'topic': 'Financial Markets', 'relevance_score': '0.650727'}, {'topic': 'Manufacturing', 'relevance_score': '0.5'}]",Neutral,0.117005,NVDA
"Which Mag-7 Stock, Apple or NVIDIA, Should You Buy for Tariff Relief?","Apple and NVIDIA received temporary tariff relief to avoid increased import costs and price hikes, prompting speculation on which stock to invest in.",Zacks Commentary,20250414T190000,"[{'topic': 'Financial Markets', 'relevance_score': '0.962106'}, {'topic': 'Manufacturing', 'relevance_score': '0.5'}, {'topic': 'Earnings', 'relevance_score': '0.576289'}, {'topic': 'Technology', 'relevance_score': '0.5'}]",Neutral,0.08488,NVDA
