title,summary,source,time_published,topics,overall_sentiment_label,overall_sentiment_score,ticker
"AI could affect 40% of jobs and widen inequality between nations, UN warns","Artificial intelligence is projected to reach $4.8 trillion in market value by 2033, but the technology's benefits remain highly concentrated, UNCTAD says.",CNBC,20250404T061254,"[{'topic': 'Economy - Monetary', 'relevance_score': '0.158519'}, {'topic': 'Financial Markets', 'relevance_score': '0.108179'}, {'topic': 'Manufacturing', 'relevance_score': '0.5'}, {'topic': 'Technology', 'relevance_score': '0.5'}]",Somewhat-Bullish,0.237535,NVDA
"CLASS ACTION DEADLINE APPROACHING: Berger Montague Advises Monolithic Power Systems  ( NASDAQ: MPWR )  Investors to Inquire About a Securities Fraud Class Action by April 7, 2025 - Monolithic Power Systems  ( NASDAQ:MPWR ) ","PHILADELPHIA, April 04, 2025 ( GLOBE NEWSWIRE ) -- Berger Montague PC advises investors that a securities class action lawsuit has been filed against Monolithic Power Systems, Inc. ( ""Monolithic Power"" or the ""Company"" ) MPWR on behalf of purchasers of Monolithic Power securities between ...",Benzinga,20250404T060600,"[{'topic': 'Earnings', 'relevance_score': '0.360215'}, {'topic': 'Financial Markets', 'relevance_score': '0.108179'}, {'topic': 'Manufacturing', 'relevance_score': '1.0'}]",Somewhat-Bullish,0.220273,NVDA
Wall Street ends with heavy losses as Trump tariffs ignite global recession fears - ETCFO,"U.S. benchmarks suffered their largest single-day percentage losses in years following President Trump's announcement of sweeping tariffs. A combined $2.4 trillion in stock market value was wiped out, with high-flying technology stocks and retail giants among the hardest hit, as fears of a global ...",Economic Times,20250404T032809,"[{'topic': 'Economy - Monetary', 'relevance_score': '0.158519'}, {'topic': 'Financial Markets', 'relevance_score': '0.796627'}, {'topic': 'Manufacturing', 'relevance_score': '0.5'}, {'topic': 'Finance', 'relevance_score': '0.5'}]",Somewhat-Bearish,-0.155156,NVDA
"Bill Ackman: 'Just Pick Up The Phone'-Says Trump Will Reward Early Dealmakers, Punish Foreign Tariff Retaliation - Apple  ( NASDAQ:AAPL ) , Amazon.com  ( NASDAQ:AMZN ) ","As global markets shed $2 trillion in value following President Donald Trump's sweeping reciprocal tariffs, billionaire investor Bill Ackman offered pointed advice to foreign leaders.",Benzinga,20250404T031326,"[{'topic': 'Technology', 'relevance_score': '0.5'}, {'topic': 'Financial Markets', 'relevance_score': '0.161647'}, {'topic': 'Manufacturing', 'relevance_score': '0.5'}]",Neutral,0.026675,NVDA
India's fightback against Trump's tariffs - ETCFO,"While you can praise Trump for intervening in the wars in Ukraine and the Middle East, his tariffs will disrupt many countries, and many will become poorer. The only question before every economy, including India, is how to deal with Trump's reciprocal tariffs.",Economic Times,20250404T030644,"[{'topic': 'Financial Markets', 'relevance_score': '0.310843'}, {'topic': 'Manufacturing', 'relevance_score': '0.5'}, {'topic': 'Earnings', 'relevance_score': '0.158519'}, {'topic': 'Finance', 'relevance_score': '0.5'}, {'topic': 'Economy - Macro', 'relevance_score': '0.158519'}]",Neutral,0.131732,NVDA
"TSMC Steps Up To Take 20% Stake In Joint Venture With Intel As Struggling Chipmaker Grapples With Nearly $19 Billion Losses In 2024: Report - Broadcom  ( NASDAQ:AVGO ) , Advanced Micro Devices  ( NASDAQ:AMD ) ","Taiwan Semiconductor Manufacturing Co. TSM is reportedly set to acquire a 20% stake in a new joint venture with Intel Corp INTC, aimed at addressing the U.S. chipmaker's ongoing struggles, including its $18.8 billion net loss in 2024.",Benzinga,20250404T023541,"[{'topic': 'Financial Markets', 'relevance_score': '0.214378'}, {'topic': 'Manufacturing', 'relevance_score': '0.5'}, {'topic': 'Earnings', 'relevance_score': '0.310843'}, {'topic': 'Technology', 'relevance_score': '0.5'}]",Neutral,0.091083,NVDA
CNBC's Inside India newsletter: How far is India from creating its own DeepSeek?,India's growing economy and tech-savvy population position it well to create a DeepSeek competitor. But the country faces obstacles in reaching that outcome.,CNBC,20250404T010339,"[{'topic': 'Economy - Monetary', 'relevance_score': '0.890401'}, {'topic': 'Economy - Fiscal', 'relevance_score': '0.158519'}, {'topic': 'Financial Markets', 'relevance_score': '0.918141'}, {'topic': 'Manufacturing', 'relevance_score': '0.333333'}, {'topic': 'Technology', 'relevance_score': '0.333333'}, {'topic': 'Finance', 'relevance_score': '0.333333'}]",Neutral,0.140127,NVDA
Why Applied Digital Stock Is Plummeting Today,"Applied Digital ( NASDAQ: APLD ) stock is falling Thursday amid bearish sentiment shaping the broader market. The company's share price was down 8.8% as of 3:40 p.m. ET. At the same point in the day's trading, the S&P 500 and the Nasdaq Composite index had fallen 4.8% and 5.8%, respectively.The ...",Motley Fool,20250403T195828,"[{'topic': 'Financial Markets', 'relevance_score': '0.108179'}, {'topic': 'Manufacturing', 'relevance_score': '1.0'}]",Neutral,0.092419,NVDA
"Monolithic Power Systems, Inc. Investors: Please contact the Portnoy Law Firm to recover your losses. April 7, 2025 Deadline to file Lead Plaintiff Motion - Monolithic Power Systems  ( NASDAQ:MPWR ) ",Investors can contact the law firm at no cost to learn more about recovering their losses,Benzinga,20250403T193923,"[{'topic': 'Financial Markets', 'relevance_score': '0.214378'}, {'topic': 'Manufacturing', 'relevance_score': '1.0'}]",Neutral,-0.00729,NVDA
Can AMD Outperform NVIDIA? Let's See if the Stock is Worth Buying Now,AMD competes with NVIDIA in the GPU market and has gained some of the latter's key clients. Can AMD stock surpass NVIDIA?,Zacks Commentary,20250403T190500,"[{'topic': 'Economy - Monetary', 'relevance_score': '0.158519'}, {'topic': 'Financial Markets', 'relevance_score': '0.413559'}, {'topic': 'Manufacturing', 'relevance_score': '0.5'}, {'topic': 'Earnings', 'relevance_score': '0.451494'}, {'topic': 'Technology', 'relevance_score': '0.5'}]",Somewhat-Bullish,0.214405,NVDA
D-Wave Quantum Surges 38% in March: Is QBTS a Smart Buy Now?,"QBTS emerges as a strong investment opportunity in 2025, driven by its recent groundbreaking achievements.",Zacks Commentary,20250403T190000,"[{'topic': 'Financial Markets', 'relevance_score': '0.266143'}, {'topic': 'Manufacturing', 'relevance_score': '0.333333'}, {'topic': 'Real Estate & Construction', 'relevance_score': '0.333333'}, {'topic': 'Technology', 'relevance_score': '0.333333'}, {'topic': 'Blockchain', 'relevance_score': '0.451494'}]",Bullish,0.365452,NVDA
Why Nvidia Stock Is Sinking Today,"Nvidia ( NASDAQ: NVDA ) stock is falling Thursday amid big sell-offs for the broader market. The company's share price was down 6.1% as of 2 p.m. ET. Meanwhile, the S&P 500 index was down 4.1%, and the Nasdaq Composite index was down 5.2%.Stocks are sinking today following the Trump ...",Motley Fool,20250403T184037,"[{'topic': 'Earnings', 'relevance_score': '0.158519'}, {'topic': 'Manufacturing', 'relevance_score': '1.0'}]",Neutral,0.021689,NVDA
Why Nvidia Stock Is Plummeting Today -- It's More Than Trump's Tariffs,Shares of Nvidia ( NASDAQ: NVDA ) are falling on Thursday. The company's stock was down 6.2% as of 1 p.m. ET and as much as 7.6% earlier in the day. The drop comes as the S&P 500 ( SNPINDEX: ^GSPC ) and Nasdaq Composite ( NASDAQINDEX: ^IXIC ) are seeing one of their worst days in years.President ...,Motley Fool,20250403T182236,"[{'topic': 'Earnings', 'relevance_score': '0.360215'}, {'topic': 'Financial Markets', 'relevance_score': '0.108179'}, {'topic': 'Manufacturing', 'relevance_score': '1.0'}]",Neutral,-0.067299,NVDA
Mag 7 relinquishes more than $800 billion as tech drives stock market nosedive,Last year's high-flyers helped lead the broad market lower.,CNBC,20250403T174948,"[{'topic': 'Technology', 'relevance_score': '0.5'}, {'topic': 'Financial Markets', 'relevance_score': '0.94762'}, {'topic': 'Manufacturing', 'relevance_score': '0.5'}]",Neutral,0.131094,NVDA
Tariffs Will Provide Great Buying Opportunity In Long Term - Investors Must First Cross Stagflation Chasm,"To gain an edge, this is what you need to know today. Please click here for an enlarged chart of SPDR S&P 500 ETF Trust ( SPY ) which represents the benchmark stock market index S&P 500 ( SPX ) . If the tariffs Trump reveals are less onerous than market expectations, the stock market ...",Benzinga,20250403T163917,"[{'topic': 'Economy - Monetary', 'relevance_score': '0.158519'}, {'topic': 'Financial Markets', 'relevance_score': '0.999999'}, {'topic': 'Manufacturing', 'relevance_score': '0.333333'}, {'topic': 'Earnings', 'relevance_score': '0.158519'}, {'topic': 'Technology', 'relevance_score': '0.333333'}, {'topic': 'Finance', 'relevance_score': '0.333333'}]",Neutral,0.132733,NVDA
Nasdaq Correction: 3 Artificial Intelligence  ( AI )  Stocks That Are Now Too Cheap to Ignore,These leading AI companies are some of the best stocks in tech to buy right now.,Motley Fool,20250403T153700,"[{'topic': 'Economy - Fiscal', 'relevance_score': '0.158519'}, {'topic': 'Financial Markets', 'relevance_score': '0.986714'}, {'topic': 'Manufacturing', 'relevance_score': '0.5'}, {'topic': 'Earnings', 'relevance_score': '0.996718'}, {'topic': 'Technology', 'relevance_score': '0.5'}]",Somewhat-Bullish,0.310902,NVDA
Samsung's China Chip Pivot Gains Steam With 54% Export Surge Amid US Market Struggles - Samsung Electronics Co  ( OTC:SSNLF ) ,Samsung leans on Chinese tech firms as U.S. chip client push falls short despite $40B Texas investment Samsung's chip exports to China soar 54% as it gains traction with Baidu and Huawei amid U.S. sanctions The 'Trade of the Day' is now live. Get a high-probability setup with clear entry and ...,Benzinga,20250403T152516,"[{'topic': 'Technology', 'relevance_score': '0.5'}, {'topic': 'Financial Markets', 'relevance_score': '0.796627'}, {'topic': 'Manufacturing', 'relevance_score': '0.5'}]",Neutral,0.046175,NVDA
2 Tech Stocks With More Potential Than Any Cryptocurrency,"The cryptocurrency market temporarily got a boost following President Donald Trump's electoral win, as some investors hoped his lighter approach to crypto regulation and outright promotion of certain coins would lift many digital tokens higher.But the threat of tariffs, fears of a potential ...",Motley Fool,20250403T150309,"[{'topic': 'Financial Markets', 'relevance_score': '0.684621'}, {'topic': 'Manufacturing', 'relevance_score': '1.0'}, {'topic': 'Earnings', 'relevance_score': '0.947132'}, {'topic': 'Blockchain', 'relevance_score': '0.576289'}]",Neutral,0.126584,NVDA
Competitor Analysis: Evaluating NVIDIA And Competitors In Semiconductors & Semiconductor Equipment Industry - NVIDIA  ( NASDAQ:NVDA ) ,"In today's fast-paced and competitive business landscape, it is essential for investors and industry enthusiasts to thoroughly analyze companies before making investment decisions.",Benzinga,20250403T150032,"[{'topic': 'Earnings', 'relevance_score': '0.891286'}, {'topic': 'Financial Markets', 'relevance_score': '0.623304'}, {'topic': 'Manufacturing', 'relevance_score': '1.0'}]",Somewhat-Bullish,0.245348,NVDA
Here's How Tariffs Could Affect This Industry Giant. Should Investors Be Worried?,"After a few months of speculation, President Donald Trump finally announced his full tariff plan on April 2, which included updated tariffs on more than 180 countries. Some tariffs were on the low end at 10%, while others skyrocketed to over 90%.Considering how much U.S. companies rely on ...",Motley Fool,20250403T142300,"[{'topic': 'Earnings', 'relevance_score': '0.614606'}, {'topic': 'Financial Markets', 'relevance_score': '0.796627'}, {'topic': 'Manufacturing', 'relevance_score': '1.0'}]",Neutral,0.088142,NVDA
"Zacks Earnings Trends Highlights: Meta Platforms, Tesla, Nvidia, Alphabet and Microsoft","Meta Platforms, Tesla, Nvidia, Alphabet and Microsoft are part of the Zacks Earnings Trends article.",Zacks Commentary,20250403T140900,"[{'topic': 'Financial Markets', 'relevance_score': '0.316726'}, {'topic': 'Manufacturing', 'relevance_score': '0.5'}, {'topic': 'Earnings', 'relevance_score': '1.0'}, {'topic': 'Technology', 'relevance_score': '0.5'}]",Somewhat-Bullish,0.225569,NVDA
"The Render Network Announces RenderCon 2025: The future of Hollywood and AI - with Ariel Emanuel, Beeple and other industry luminaries","LOS ANGELES, April 3, 2025 /PRNewswire/ -- The Render Network Foundation is thrilled to announce RenderCon, a one-day event April 15th, 2025 at Nya Studio in Hollywood, California to explore how art, media, and exa-scale computing are shaping the decade ahead.",Benzinga,20250403T140000,"[{'topic': 'Manufacturing', 'relevance_score': '1.0'}]",Somewhat-Bullish,0.243021,NVDA
3 Growth Stocks That Have Dwarfed Nvidia's Returns Over the Past 12 Months,"Is the excitement surrounding chipmaker Nvidia fading? As of Monday, shares of the tech giant were down 19% since the start of 2025. Whether that's due to its high valuation, concerns about the economy, tariffs, or the possibility of a slowdown in tech spending on the horizon, investors don't ...",Motley Fool,20250403T134500,"[{'topic': 'Life Sciences', 'relevance_score': '0.25'}, {'topic': 'Financial Markets', 'relevance_score': '0.5855'}, {'topic': 'Manufacturing', 'relevance_score': '0.25'}, {'topic': 'Earnings', 'relevance_score': '0.967645'}, {'topic': 'Real Estate & Construction', 'relevance_score': '0.25'}, {'topic': 'Technology', 'relevance_score': '0.25'}]",Neutral,0.110736,NVDA
"Today's Trade Strategy For SPY, AAPL, MSFT, NVDA, GOOGL, META, TSLA","Good Morning Traders! In today's Market Clubhouse Morning Memo, we will discuss SPY, QQQ, AAPL, MSFT, NVDA, GOOGL, META, and TSLA. Our proprietary formula, exclusive to Market Clubhouse, dictates these price levels. This dynamic equation takes into account price, volume, and options flow.",Benzinga,20250403T134411,"[{'topic': 'Economy - Monetary', 'relevance_score': '0.310843'}, {'topic': 'Financial Markets', 'relevance_score': '0.413559'}, {'topic': 'Manufacturing', 'relevance_score': '0.5'}, {'topic': 'Technology', 'relevance_score': '0.5'}]",Neutral,0.129237,NVDA
"The Silver Lining In The Liberation Day Tariff Announcement - NVIDIA  ( NASDAQ:NVDA ) , RH  ( NYSE:RH ) ","The big Liberation Day Surprise was the size of the reciprocal tariffs announced by President Trump. While most assumed America's reciprocal tariffs would be based on the actual tariffs other countries levy on American products, the Trump Administration included ""currency manipulation and trade ...",Benzinga,20250403T133642,"[{'topic': 'Retail & Wholesale', 'relevance_score': '0.5'}, {'topic': 'Financial Markets', 'relevance_score': '0.929393'}, {'topic': 'Manufacturing', 'relevance_score': '0.5'}, {'topic': 'Earnings', 'relevance_score': '0.158519'}]",Neutral,0.101792,NVDA
4 Top No-Load Mutual Funds for 2025 and Beyond,"Invest in no-load mutual funds like MLPOX, FIKGX, FSPCX and KTCSX that have performed well so far and will continue to give high returns in the future.",Zacks Commentary,20250403T123600,"[{'topic': 'Energy & Transportation', 'relevance_score': '0.25'}, {'topic': 'Technology', 'relevance_score': '0.25'}, {'topic': 'Finance', 'relevance_score': '0.25'}, {'topic': 'Economy - Monetary', 'relevance_score': '0.682689'}, {'topic': 'Economy - Fiscal', 'relevance_score': '0.158519'}, {'topic': 'Financial Markets', 'relevance_score': '0.87644'}, {'topic': 'Manufacturing', 'relevance_score': '0.25'}]",Neutral,0.090484,NVDA
"RH Posts Downbeat Earnings, Joins Apple, Tesla, Nvidia And Other Big Stocks Moving Lower In Thursday's Pre-Market Session - Apple  ( NASDAQ:AAPL ) , AdvanSix  ( NYSE:ASIX ) ","U.S. stock futures were lower this morning, with the Dow futures falling more than 1,000 points on Thursday. Shares of RH RH fell sharply in today's pre-market trading after the company reported weaker-than-expected fourth-quarter financial results.",Benzinga,20250403T122440,"[{'topic': 'Life Sciences', 'relevance_score': '0.2'}, {'topic': 'Technology', 'relevance_score': '0.2'}, {'topic': 'Finance', 'relevance_score': '0.2'}, {'topic': 'IPO', 'relevance_score': '0.158519'}, {'topic': 'Retail & Wholesale', 'relevance_score': '0.2'}, {'topic': 'Financial Markets', 'relevance_score': '0.82617'}, {'topic': 'Manufacturing', 'relevance_score': '0.2'}, {'topic': 'Earnings', 'relevance_score': '0.744043'}]",Neutral,-0.08803,NVDA
"JPMorgan Says Broadcom, Marvell Could Dominate AI's Next Frontier - Here's Why - Broadcom  ( NASDAQ:AVGO ) , Marvell Tech  ( NASDAQ:MRVL ) ","JPMorgan's Harlan Sur sees Broadcom and Marvell as key AI networking winners amid surging 800G and 1.6T demand. Broadcom dominates switching, while Marvell leads in optical, positioning both for strong multi-year AI-driven growth. The 'Trade of the Day' is now live.",Benzinga,20250403T121624,"[{'topic': 'Earnings', 'relevance_score': '0.108179'}, {'topic': 'Financial Markets', 'relevance_score': '0.650727'}, {'topic': 'Manufacturing', 'relevance_score': '1.0'}]",Somewhat-Bullish,0.273583,NVDA
LG ANNOUNCES PRICING AND AVAILABILITY OF ITS FIRST SMART GAMING MONITOR SERIES,"ENGLEWOOD CLIFFS, N.J., April 3, 2025 /PRNewswire/ -- LG Electronics USA ( LG ) today announced pricing and availability for its first-ever lineup of LG UltraGear OLED smart gaming monitors - the GX9s series: 45GX90SA, 39GX90SA and 34GX90SA. Designed to deliver exceptional gaming and streaming ...",Benzinga,20250403T120000,"[{'topic': 'Manufacturing', 'relevance_score': '1.0'}]",Bullish,0.368481,NVDA
Nasdaq-100 Sees Worst Quarter in 3 Years: What Lies Ahead for ETFs?,The Nasdaq 100 has suffered its worst quarter in nearly three years.,Zacks Commentary,20250403T120000,"[{'topic': 'Retail & Wholesale', 'relevance_score': '0.25'}, {'topic': 'Financial Markets', 'relevance_score': '0.961735'}, {'topic': 'Manufacturing', 'relevance_score': '0.25'}, {'topic': 'Earnings', 'relevance_score': '0.310843'}, {'topic': 'Technology', 'relevance_score': '0.25'}, {'topic': 'Finance', 'relevance_score': '0.25'}]",Neutral,-0.024528,NVDA
Why Shares in Nvidia Partner Vertiv Dipped in March,"Shares in data center equipment company Vertiv Holdings ( NYSE: VRT ) declined by 24.1% in March, according to data provided by S&P Global Market Intelligence. Given the large slump in the share price on March 26, there's little doubt that Vertiv's stock is being negatively impacted by tariff ...",Motley Fool,20250403T115024,"[{'topic': 'Finance', 'relevance_score': '0.5'}, {'topic': 'Financial Markets', 'relevance_score': '0.161647'}, {'topic': 'Manufacturing', 'relevance_score': '0.5'}]",Neutral,0.014707,NVDA
Should You Stay Invested in INTC Stock on Positive Growth Trends?,INTC appears to be treading in the middle of the road and investors could be better off if they exercise caution and stay invested for long-term gains.,Zacks Commentary,20250403T114400,"[{'topic': 'Earnings', 'relevance_score': '0.360215'}, {'topic': 'Financial Markets', 'relevance_score': '0.316726'}, {'topic': 'Manufacturing', 'relevance_score': '1.0'}]",Somewhat-Bullish,0.164316,NVDA
"Down 65%, Should You Buy the Dip on SoundHound AI Stock?","SoundHound AI ( NASDAQ: SOUN ) was a darling stock in 2024. At one point in late December, shares were up over 1,000% for the year, but then it sold off as investors took gains.That sell-off continued into 2025 and then reaccelerated as AI stocks in general sold off over economic fears caused by ...",Motley Fool,20250403T113000,"[{'topic': 'Life Sciences', 'relevance_score': '0.5'}, {'topic': 'Financial Markets', 'relevance_score': '0.503496'}, {'topic': 'Manufacturing', 'relevance_score': '0.5'}, {'topic': 'Earnings', 'relevance_score': '0.998356'}]",Somewhat-Bullish,0.231033,NVDA
Better Artificial Intelligence  ( AI )  Stock: Nvidia vs. Broadcom,"Both Nvidia ( NASDAQ: NVDA ) and Broadcom ( NASDAQ: AVGO ) have been big beneficiaries of the huge investments in artificial intelligence ( AI ) hardware, which explains why the share prices of both companies shot up impressively over the past couple of years.While Nvidia stock jumped more than ...",Motley Fool,20250403T102336,"[{'topic': 'Earnings', 'relevance_score': '0.999986'}, {'topic': 'Financial Markets', 'relevance_score': '0.990999'}, {'topic': 'Manufacturing', 'relevance_score': '1.0'}]",Somewhat-Bullish,0.29996,NVDA
"If You'd Invested $10,000 in Tesla Stock 10 Years Ago, Here's How Much You'd Have Today","Let's end the suspense. If you'd invested $10,000 in Tesla 10 years ago, you would have an incredible $215,600 at recent prices, an annualized growth rate of nearly 36%.Tesla ( NASDAQ: TSLA ) is the second-best-performing ""Magnificent Seven"" stock over the last decade, behind only Nvidia, and its ...",Motley Fool,20250403T102200,"[{'topic': 'Earnings', 'relevance_score': '0.158519'}, {'topic': 'Financial Markets', 'relevance_score': '0.684621'}, {'topic': 'Manufacturing', 'relevance_score': '1.0'}]",Neutral,0.102298,NVDA
Should Schwab U.S. Large-Cap ETF  ( SCHX )  Be on Your Investing Radar?,Style Box ETF report for ...,Zacks Commentary,20250403T102005,"[{'topic': 'Financial Markets', 'relevance_score': '1.0'}, {'topic': 'Manufacturing', 'relevance_score': '0.333333'}, {'topic': 'Technology', 'relevance_score': '0.333333'}, {'topic': 'Finance', 'relevance_score': '0.333333'}]",Somewhat-Bullish,0.196485,NVDA
Is Fidelity High Dividend ETF  ( FDVV )  a Strong ETF Right Now?,Smart Beta ETF report for ...,Zacks Commentary,20250403T102004,"[{'topic': 'Technology', 'relevance_score': '0.5'}, {'topic': 'Financial Markets', 'relevance_score': '0.999981'}, {'topic': 'Manufacturing', 'relevance_score': '0.5'}]",Somewhat-Bullish,0.250185,NVDA
Prediction: 4 Artificial Intelligence  ( AI )  Stocks That Could Be Worth More Than Apple by 2030,Apple ( NASDAQ: AAPL ) is the world's largest company -- by about half a trillion dollars as I write this. So surpassing it in value is not a thing just any company can do. But I'm willing to make the bold prediction that there are stocks that could be bigger than Apple by 2030.,Motley Fool,20250403T101500,"[{'topic': 'Retail & Wholesale', 'relevance_score': '0.333333'}, {'topic': 'Financial Markets', 'relevance_score': '0.266143'}, {'topic': 'Manufacturing', 'relevance_score': '0.333333'}, {'topic': 'Earnings', 'relevance_score': '0.999995'}, {'topic': 'Technology', 'relevance_score': '0.333333'}]",Somewhat-Bullish,0.186599,NVDA
2 Top AI Stocks Down 28% or More to Buy and Hold for 10 Years,Leading artificial intelligence ( AI ) companies are seeing growing demand that points to a lucrative opportunity. Investors who keep a long-term perspective and take advantage of market dips to buy shares of competitively positioned companies at discounts will be in the best position to profit ...,Motley Fool,20250403T093000,"[{'topic': 'Financial Markets', 'relevance_score': '0.161647'}, {'topic': 'Manufacturing', 'relevance_score': '0.5'}, {'topic': 'Earnings', 'relevance_score': '0.990893'}, {'topic': 'Technology', 'relevance_score': '0.5'}]",Bullish,0.428597,NVDA
"Google In Talks To Rent Nvidia's Blackwell Chips From CoreWeave: Report - CoreWeave  ( NASDAQ:CRWV ) , Broadcom  ( NASDAQ:AVGO ) ","Alphabet Inc.'s GOOG GOOGL Google is looking to increase its AI and computing resources to support its growing range of applications. With Nvidia Corp.'s NVDA latest generation Blackwell GPUs seeing massive order backlogs and wait times as high as 12 months, the company is resorting to other ...",Benzinga,20250403T092937,"[{'topic': 'Financial Markets', 'relevance_score': '0.161647'}, {'topic': 'Manufacturing', 'relevance_score': '0.5'}, {'topic': 'Earnings', 'relevance_score': '0.360215'}, {'topic': 'Technology', 'relevance_score': '0.5'}]",Neutral,0.133814,NVDA
Bull of the Day: Nova  ( NVMI ) ,Key player in the production of high-quality chips for the AI revolution is ramping ...,Zacks Commentary,20250403T092000,"[{'topic': 'Life Sciences', 'relevance_score': '0.333333'}, {'topic': 'Financial Markets', 'relevance_score': '0.214378'}, {'topic': 'Manufacturing', 'relevance_score': '0.333333'}, {'topic': 'Earnings', 'relevance_score': '0.858979'}, {'topic': 'Technology', 'relevance_score': '0.333333'}]",Somewhat-Bullish,0.24813,NVDA
Prediction: IonQ Could Surge by 200% in the Next 3 Years,"The planets are aligning for this ticker, but they won't remain lined up forever.",Motley Fool,20250403T085500,"[{'topic': 'Financial Markets', 'relevance_score': '0.796627'}, {'topic': 'Manufacturing', 'relevance_score': '0.333333'}, {'topic': 'Real Estate & Construction', 'relevance_score': '0.333333'}, {'topic': 'Technology', 'relevance_score': '0.333333'}]",Somewhat-Bullish,0.233655,NVDA
1 No-Brainer Artificial Intelligence  ( AI )  ETF to Buy With $40 During the S&P 500 Sell-Off,"The S&P 500 ( SNPINDEX: ^GSPC ) is still in a bull market, which stretches back to October 2022. In fact, it's coming off back-to-back annual gains of more than 25% in 2023 and 2024, a feat it has only achieved one other time since 1957.",Motley Fool,20250403T084700,"[{'topic': 'Financial Markets', 'relevance_score': '0.999687'}, {'topic': 'Manufacturing', 'relevance_score': '0.333333'}, {'topic': 'Technology', 'relevance_score': '0.333333'}, {'topic': 'Finance', 'relevance_score': '0.333333'}]",Somewhat-Bullish,0.23766,NVDA
