title,summary,source,time_published,topics,overall_sentiment_label,overall_sentiment_score,ticker
"US Stocks Likely To Open Lower As Volatility Persists Before Bank Earnings: 'Fed Is Likely To Cut Rates Again On June 18th,' Says Expert - Apple  ( NASDAQ:AAPL ) , Bank of New York Mellon  ( NYSE:BK ) ","U.S. stock futures were volatile on Friday after losing steam on Thursday. Futures of major benchmark indices were lower in premarket. Data from the Bureau of Labor Statistics on Thursday showed the annual inflation rate falling to a six-month low of 2.4% in March, down from 2.8% in February and ...",Benzinga,20250411T094527,"[{'topic': 'Technology', 'relevance_score': '0.25'}, {'topic': 'Finance', 'relevance_score': '0.25'}, {'topic': 'Economy - Monetary', 'relevance_score': '0.983605'}, {'topic': 'Retail & Wholesale', 'relevance_score': '0.25'}, {'topic': 'Financial Markets', 'relevance_score': '0.998682'}, {'topic': 'Manufacturing', 'relevance_score': '0.25'}, {'topic': 'Earnings', 'relevance_score': '0.99999'}, {'topic': 'Economy - Macro', 'relevance_score': '0.158519'}]",Neutral,-0.021731,NVDA
"US Stock Futures Recover After Early Dip, Poised To Open Higher Amid Volatility: 'Fed Is Likely To Cut Rates Again On June 18th,' Says Expert  ( UPDATED )  - Apple  ( NASDAQ:AAPL ) , Bank of New York Mellon  ( NYSE:BK ) ","Editor's Note: This story has been updated to include the latest U.S. stock futures data. U.S. stock futures edged higher Friday morning, rebounding after a weak Thursday session that saw markets lose momentum. Major benchmark index futures traded in positive territory during premarket hours ...",Benzinga,20250411T094509,"[{'topic': 'Technology', 'relevance_score': '0.25'}, {'topic': 'Finance', 'relevance_score': '0.25'}, {'topic': 'Economy - Monetary', 'relevance_score': '0.983605'}, {'topic': 'Retail & Wholesale', 'relevance_score': '0.25'}, {'topic': 'Financial Markets', 'relevance_score': '0.999822'}, {'topic': 'Manufacturing', 'relevance_score': '0.25'}, {'topic': 'Earnings', 'relevance_score': '0.99999'}, {'topic': 'Economy - Macro', 'relevance_score': '0.158519'}]",Neutral,-0.012077,NVDA
Where Will Nvidia Be in 5 Years?,"Predicting where a company might be in five years isn't an exact science, to say the least. Doing so amid tariff uncertainty and a potential economic slowdown exacerbates the difficulty.But if you're considering buying the semiconductor giant Nvidia ( NASDAQ: NVDA ) , it's important to work ...",Motley Fool,20250411T094300,"[{'topic': 'Technology', 'relevance_score': '0.5'}, {'topic': 'Financial Markets', 'relevance_score': '0.161647'}, {'topic': 'Manufacturing', 'relevance_score': '0.5'}]",Neutral,0.072069,NVDA
Zacks Investment Ideas feature highlights: Nvidia and Apple,Nvidia and Apple have been highlighted in this Investment Ideas article.,Zacks Commentary,20250411T092300,"[{'topic': 'Technology', 'relevance_score': '0.5'}, {'topic': 'Financial Markets', 'relevance_score': '0.999696'}, {'topic': 'Manufacturing', 'relevance_score': '0.5'}]",Somewhat-Bullish,0.169518,NVDA
3 Ways to Keep Your Portfolio Safe During Tariff Volatility,Tariff volatility continues to rattle the stock market with the major indexes swinging several percentage points in recent sessions.The S&P 500 ( SNPINDEX: ^GSPC ) and Nasdaq Composite ( NASDAQINDEX: ^IXIC ) both fell into bear market territory ( a drawdown of at least 20% from a recent high ) ...,Motley Fool,20250411T083000,"[{'topic': 'Financial Markets', 'relevance_score': '1.0'}, {'topic': 'Manufacturing', 'relevance_score': '0.5'}, {'topic': 'Earnings', 'relevance_score': '0.158519'}, {'topic': 'Technology', 'relevance_score': '0.5'}]",Neutral,0.077404,NVDA
My 2 Favorite Stocks to Buy Right Now,"With the market recently down 10% over a two-day period, it has opened up some buying opportunties. At the same time, investors might want to be a little cautious given the uncertainty over the effects that the Trump administration's on-again, off-again tariffs might have on the global ...",Motley Fool,20250411T082000,"[{'topic': 'Retail & Wholesale', 'relevance_score': '0.5'}, {'topic': 'Financial Markets', 'relevance_score': '0.214378'}, {'topic': 'Manufacturing', 'relevance_score': '0.5'}, {'topic': 'Earnings', 'relevance_score': '0.360215'}]",Somewhat-Bullish,0.258643,NVDA
Where Will Intel Stock Be in 3 Years?,"The chipmaking giant has a new CEO, but it still faces existential challenges.",Motley Fool,20250411T081400,"[{'topic': 'Financial Markets', 'relevance_score': '0.266143'}, {'topic': 'Manufacturing', 'relevance_score': '0.5'}, {'topic': 'Earnings', 'relevance_score': '0.77141'}, {'topic': 'Technology', 'relevance_score': '0.5'}]",Neutral,0.094035,NVDA
Should You Really Buy Stocks During Market Turmoil? History Offers an Answer That May Surprise You.,"The stock market's movements have kept some investors glued to their computer screens in recent days as indexes have swung from losses to gains. The Nasdaq Composite ( NASDAQINDEX: ^IXIC ) even crashed and entered a bear market, then began to rebound.What was the reason for these rapid shifts in ...",Motley Fool,20250411T081200,"[{'topic': 'Financial Markets', 'relevance_score': '0.77141'}, {'topic': 'Manufacturing', 'relevance_score': '0.5'}, {'topic': 'Earnings', 'relevance_score': '0.451494'}, {'topic': 'Finance', 'relevance_score': '0.5'}]",Neutral,-0.061317,NVDA
"The Best Growth ETF to Invest $1,000 in Right Now","There are several good ones to choose from, but current circumstances make one fund in particular stand out.",Motley Fool,20250411T081000,"[{'topic': 'Financial Markets', 'relevance_score': '1.0'}, {'topic': 'Manufacturing', 'relevance_score': '0.5'}, {'topic': 'Earnings', 'relevance_score': '0.310843'}, {'topic': 'Technology', 'relevance_score': '0.5'}]",Somewhat-Bullish,0.263675,NVDA
2 AI Stocks to Buy in the Wake of the Market Sell-Off,"The stock market is off to a rough start to 2025. It's never fun to see the value of your portfolio dwindle, and there's never any certainty about when a period of market volatility will end. But the upside is that market pullbacks present a window of opportunity to invest in growing companies at ...",Motley Fool,20250411T080800,"[{'topic': 'Financial Markets', 'relevance_score': '0.955357'}, {'topic': 'Manufacturing', 'relevance_score': '0.5'}, {'topic': 'Earnings', 'relevance_score': '0.995015'}, {'topic': 'Technology', 'relevance_score': '0.5'}]",Somewhat-Bullish,0.255194,NVDA
"'There'll be A Transition Cost And Transition Problems,' Admits Trump Amid Tariff Woes, While Bessent Hints At Negotiation Deals - Apple  ( NASDAQ:AAPL ) , Advanced Micro Devices  ( NASDAQ:AMD ) ","President Donald Trump has warned of ""transition problems"" as the global tariff war rages on, causing markets to falter. What Happened: Trump admitted the possibility of difficulties during a cabinet meeting.",Benzinga,20250411T071500,"[{'topic': 'Economy - Monetary', 'relevance_score': '0.158519'}, {'topic': 'Financial Markets', 'relevance_score': '0.972756'}, {'topic': 'Manufacturing', 'relevance_score': '0.5'}, {'topic': 'Technology', 'relevance_score': '0.5'}]",Neutral,-0.052277,NVDA
"Dow Tumbles Over 1,000 Points As Nvidia, Apple And Tesla Decline: Greed Index Remains In 'Extreme Fear' Zone - Apple  ( NASDAQ:AAPL ) , JPMorgan Chase  ( NYSE:JPM ) ","The CNN Money Fear and Greed index showed an increase in the overall fear level, while the index remained in the ""Extreme Fear"" zone on Thursday.",Benzinga,20250411T070752,"[{'topic': 'Economy - Monetary', 'relevance_score': '0.310843'}, {'topic': 'Financial Markets', 'relevance_score': '0.161647'}, {'topic': 'Manufacturing', 'relevance_score': '0.333333'}, {'topic': 'Earnings', 'relevance_score': '0.158519'}, {'topic': 'Technology', 'relevance_score': '0.333333'}, {'topic': 'Finance', 'relevance_score': '0.333333'}]",Somewhat-Bearish,-0.326878,NVDA
"Stock Market Correction: 2 Brilliant AI Stocks Down 45% and 48% to Buy Before They Soar, According to Wall Street","The S&P 500 ( SNPINDEX: ^GSPC ) tumbled as much as 19% from its high during the recent stock market rout. The benchmark index rebounded more than 9% on April 9 when President Donald Trump announced a 90-day delay on the reciprocal tariffs he unveiled a week earlier, but it dropped sharply again ...",Motley Fool,20250411T070500,"[{'topic': 'Financial Markets', 'relevance_score': '0.955357'}, {'topic': 'Manufacturing', 'relevance_score': '0.5'}, {'topic': 'Earnings', 'relevance_score': '0.997874'}, {'topic': 'Technology', 'relevance_score': '0.5'}]",Somewhat-Bullish,0.255797,NVDA
Nvidia CEO Jensen Huang Admits He Was Wrong About Quantum Computing. Are Quantum Stocks Buys Right Now?,"Nvidia CEO Jensen Huang made headlines in January, sowing skepticism toward the emerging field of quantum computing. His comments, which suggested the technology was still 15 to 20 years away from being commercially useful, were seen as a major disappointment to industry prospects, triggering a ...",Motley Fool,20250411T070000,"[{'topic': 'Financial Markets', 'relevance_score': '0.839681'}, {'topic': 'Manufacturing', 'relevance_score': '0.333333'}, {'topic': 'Earnings', 'relevance_score': '0.108179'}, {'topic': 'Real Estate & Construction', 'relevance_score': '0.333333'}, {'topic': 'Technology', 'relevance_score': '0.333333'}]",Somewhat-Bullish,0.276757,NVDA
Why AMD Stock Is Plummeting Today,Advanced Micro Devices ( NASDAQ: AMD ) stock saw a day of big sell-offs Thursday. The semiconductor company's share price wound up down 8.4% in a day of trading that saw the S&P 500 fall 3.5% and the Nasdaq Composite fall 4.4%.The stock market followed Wednesday's surge on tariff news with ...,Motley Fool,20250410T210022,"[{'topic': 'Financial Markets', 'relevance_score': '0.87644'}, {'topic': 'Manufacturing', 'relevance_score': '1.0'}]",Neutral,0.031058,NVDA
"Hardware, Tech Stocks Fall As Markets Pull Back From Tariff-Driven Rally: What's Going On? - Dell Technologies  ( NYSE:DELL ) ",Hardware and tech stocks are falling as markets retreat from Wednesday's tariff-driven rally. Investors are growing cautious amid renewed uncertainty over U.S.-China trade tensions. Pelosi's latest AI pick skyrocketed 169% in just one month.,Benzinga,20250410T202154,"[{'topic': 'Retail & Wholesale', 'relevance_score': '0.333333'}, {'topic': 'Financial Markets', 'relevance_score': '0.214378'}, {'topic': 'Manufacturing', 'relevance_score': '0.333333'}, {'topic': 'Technology', 'relevance_score': '0.333333'}]",Neutral,0.009781,NVDA
Retail investors are running head first into this topsy-turvy market,"While the stock market whipsawed over recent days, average Joe traders saw an opportunity to buy the dip.",CNBC,20250410T195729,"[{'topic': 'Economy - Monetary', 'relevance_score': '0.158519'}, {'topic': 'Economy - Fiscal', 'relevance_score': '0.158519'}, {'topic': 'Financial Markets', 'relevance_score': '1.0'}, {'topic': 'Manufacturing', 'relevance_score': '0.5'}, {'topic': 'Finance', 'relevance_score': '0.5'}]",Neutral,0.002404,NVDA
"Can Palantir Outperform NVIDIA, and Should You Buy the Stock?",Both NVIDIA and Palantir are strong players in AI. Which stock has more growth potential and is the better investment? Let's see.,Zacks Commentary,20250410T190000,"[{'topic': 'Financial Markets', 'relevance_score': '0.980922'}, {'topic': 'Manufacturing', 'relevance_score': '0.5'}, {'topic': 'Earnings', 'relevance_score': '0.875462'}, {'topic': 'Technology', 'relevance_score': '0.5'}]",Somewhat-Bullish,0.252336,NVDA
Wall Street's Wild Ride: What Tuesday's Rally Means for Investors,"While many beaten-down stocks registered large bounces yesterday, the immediate path ahead is murky for investors, at best. Stock Strategist Andrew Rocco explains.",Zacks Commentary,20250410T184400,"[{'topic': 'Economy - Monetary', 'relevance_score': '0.838487'}, {'topic': 'Financial Markets', 'relevance_score': '0.77141'}, {'topic': 'Manufacturing', 'relevance_score': '0.5'}, {'topic': 'Technology', 'relevance_score': '0.5'}]",Neutral,-0.036662,NVDA
"Why Nvidia, Palantir, Broadcom, and Other Semiconductor and AI Stocks Rallied This Week",A double dose of good news gave investors hope for the future.,Motley Fool,20250410T184310,"[{'topic': 'Economy - Monetary', 'relevance_score': '0.928139'}, {'topic': 'Manufacturing', 'relevance_score': '0.5'}, {'topic': 'Earnings', 'relevance_score': '0.310843'}, {'topic': 'Technology', 'relevance_score': '0.5'}]",Neutral,0.029427,NVDA
Nvidia Is Sinking Today. Is It Time to Buy the Artificial Intelligence  ( AI )  Stock?,"After explosive gains in yesterday's session, Nvidia ( NASDAQ: NVDA ) stock is seeing big sell-offs in Thursday's session. The artificial intelligence ( AI ) hardware leader's share price was down 7.5% as of 1 p.m. ET. At the same point in today's trading, the S&P 500 was down 4.5%, and the ...",Motley Fool,20250410T174557,"[{'topic': 'Financial Markets', 'relevance_score': '0.962106'}, {'topic': 'Manufacturing', 'relevance_score': '1.0'}]",Neutral,0.145324,NVDA
"Palantir Stock Appreciates 22% Year to Date: Buy, Hold, or Sell?","Given PLTR's continuous rise in stock price, it's essential to evaluate its current standing and determine whether this presents a buying opportunity.",Zacks Commentary,20250410T174100,"[{'topic': 'Financial Markets', 'relevance_score': '0.980922'}, {'topic': 'Manufacturing', 'relevance_score': '0.5'}, {'topic': 'Earnings', 'relevance_score': '0.310843'}, {'topic': 'Technology', 'relevance_score': '0.5'}]",Somewhat-Bullish,0.219791,NVDA
AMD's EPYC Powers GOOGL & ORCL Solutions: Should You Hold the Stock?,Advanced Micro Devices is benefiting from an expanding usage of its fifth-generation EPYC processors.,Zacks Commentary,20250410T164900,"[{'topic': 'Earnings', 'relevance_score': '0.495866'}, {'topic': 'Technology', 'relevance_score': '0.5'}, {'topic': 'Manufacturing', 'relevance_score': '0.5'}]",Somewhat-Bullish,0.156029,NVDA
Semiconductors Leading Nasdaq's Bounce-Back: ETFs in Focus,Semiconductor stocks led the Nasdaq recovery on April 9.,Zacks Commentary,20250410T164300,"[{'topic': 'Financial Markets', 'relevance_score': '0.999162'}, {'topic': 'Manufacturing', 'relevance_score': '0.333333'}, {'topic': 'Technology', 'relevance_score': '0.333333'}, {'topic': 'Finance', 'relevance_score': '0.333333'}]",Somewhat-Bullish,0.192603,NVDA
The Real Reason Behind Trump's Tariff Reversals - SPDR S&P 500  ( ARCA:SPY ) ,"To gain an edge, this is what you need to know today. Please click here for an enlarged chart of SPDR S&P 500 ETF Trust SPY which represents the benchmark stock market index S&P 500 ( SPX ) . 75 countries wanting to negotiate Opinion of business leaders",Benzinga,20250410T162412,"[{'topic': 'Economy - Monetary', 'relevance_score': '0.451494'}, {'topic': 'Financial Markets', 'relevance_score': '0.999997'}, {'topic': 'Manufacturing', 'relevance_score': '0.333333'}, {'topic': 'Technology', 'relevance_score': '0.333333'}, {'topic': 'Finance', 'relevance_score': '0.333333'}]",Somewhat-Bullish,0.186848,NVDA
"Runway AI Secures $300M From Nvidia And Fidelity To Revolutionize Film With Gen-4 Model And Studio Deals Raising Its Valuation To $3B - NVIDIA  ( NASDAQ:NVDA ) , Amazon.com  ( NASDAQ:AMZN ) ","Runway AI, a generative video startup based in New York, has just secured more than $300 million in funding. General Atlantic led the round with support from key-name backers such as Nvidia NVDA, Fidelity Management & Research Company, Baillie Gifford, and SoftBank Vision Fund 2, according to ...",Benzinga,20250410T154639,"[{'topic': 'IPO', 'relevance_score': '0.158519'}, {'topic': 'Financial Markets', 'relevance_score': '0.161647'}, {'topic': 'Manufacturing', 'relevance_score': '1.0'}]",Bullish,0.41672,NVDA
"Rule Breaker Investing: Essays From Yesterday, Vol. 7","It's time once again to dust off Motley Fool co-founder David Gardner's old writings and pull some lessons forward into the light of today. In this podcast we discuss buying stocks that you already own, annual predictions, risk ratings, and keeping a record of your investment decisions.",Motley Fool,20250410T154500,"[{'topic': 'Life Sciences', 'relevance_score': '0.2'}, {'topic': 'Technology', 'relevance_score': '0.2'}, {'topic': 'Finance', 'relevance_score': '0.2'}, {'topic': 'Retail & Wholesale', 'relevance_score': '0.2'}, {'topic': 'Financial Markets', 'relevance_score': '1.0'}, {'topic': 'Manufacturing', 'relevance_score': '0.2'}, {'topic': 'Earnings', 'relevance_score': '0.451494'}]",Neutral,0.112684,NVDA
"Bitcoin Falls To $78K As Market Jitters; Trump Halts Tariffs After Bond Yield Spike; US-China Tensions Spark Visa Cancellations, Strain Academic Ties - Top Headlines While the US Slept","Bearish Sentiment Hits 7-Week High, Mimicking 35-Year Old Record Which Marked The Bottom Of The October 1990 Bear Market US Stocks Likely To Open Lower Ahead Of March Inflation Release: Expert Highlights 'Fairly Weak Returns' After 5%+ Gains In S&P 500",Benzinga,20250410T152015,"[{'topic': 'Technology', 'relevance_score': '0.25'}, {'topic': 'Finance', 'relevance_score': '0.25'}, {'topic': 'Economy - Monetary', 'relevance_score': '0.158519'}, {'topic': 'Retail & Wholesale', 'relevance_score': '0.25'}, {'topic': 'Financial Markets', 'relevance_score': '0.989041'}, {'topic': 'Manufacturing', 'relevance_score': '0.25'}, {'topic': 'Earnings', 'relevance_score': '0.614606'}]",Neutral,-0.120634,NVDA
Exploring The Competitive Space: NVIDIA Versus Industry Peers In Semiconductors & Semiconductor Equipment - NVIDIA  ( NASDAQ:NVDA ) ,"In today's rapidly changing and highly competitive business world, it is imperative for investors and industry observers to carefully assess companies before making investment choices.",Benzinga,20250410T150014,"[{'topic': 'Earnings', 'relevance_score': '0.891286'}, {'topic': 'Financial Markets', 'relevance_score': '0.658903'}, {'topic': 'Manufacturing', 'relevance_score': '1.0'}]",Somewhat-Bullish,0.262843,NVDA
Derivative-Based ETFs at the Heart of the Historic Market Run,Derivative-based ETFs are the biggest beneficiaries of the historic stock market rally.,Zacks Commentary,20250410T150000,"[{'topic': 'Technology', 'relevance_score': '0.25'}, {'topic': 'Finance', 'relevance_score': '0.25'}, {'topic': 'Blockchain', 'relevance_score': '0.158519'}, {'topic': 'Economy - Fiscal', 'relevance_score': '0.158519'}, {'topic': 'Retail & Wholesale', 'relevance_score': '0.25'}, {'topic': 'Financial Markets', 'relevance_score': '1.0'}, {'topic': 'Manufacturing', 'relevance_score': '0.25'}]",Neutral,0.138487,NVDA
Intel  ( INTC )  Moves 18.8% Higher: Will This Strength Last?,Intel (INTC) saw its shares surge in the last session with trading volume being higher than average. The latest trend in earnings estimate revisions may not translate into further price increase in the near term.,Zacks Commentary,20250410T145700,"[{'topic': 'Earnings', 'relevance_score': '0.983783'}, {'topic': 'Financial Markets', 'relevance_score': '0.316726'}, {'topic': 'Manufacturing', 'relevance_score': '1.0'}]",Somewhat-Bullish,0.278524,NVDA
Why Shares of Nvidia Are Sinking Today,"After a face-melting rally yesterday that saw shares of Nvidia ( NASDAQ: NVDA ) surge over 15%, shares once again found the red today, trading about 5% lower as of 10:22 a.m. ET. Analysts at Morgan Stanley issued a new research report on the company this morning, while the broader market gave ...",Motley Fool,20250410T144523,"[{'topic': 'Economy - Monetary', 'relevance_score': '0.310843'}, {'topic': 'Financial Markets', 'relevance_score': '0.161647'}, {'topic': 'Manufacturing', 'relevance_score': '0.5'}, {'topic': 'Earnings', 'relevance_score': '0.158519'}, {'topic': 'Finance', 'relevance_score': '0.5'}]",Neutral,0.053527,NVDA
5 Leveraged ETFs That Skyrocketed on 90-Day Tariff Pause,We highlight five leveraged ETFs that soared on Wall Street???s comeback after the announcement of a 90-day tariff pause.,Zacks Commentary,20250410T140000,"[{'topic': 'Economy - Fiscal', 'relevance_score': '0.158519'}, {'topic': 'Retail & Wholesale', 'relevance_score': '0.25'}, {'topic': 'Financial Markets', 'relevance_score': '0.980716'}, {'topic': 'Manufacturing', 'relevance_score': '0.25'}, {'topic': 'Energy & Transportation', 'relevance_score': '0.25'}, {'topic': 'Technology', 'relevance_score': '0.25'}]",Somewhat-Bullish,0.246353,NVDA
how-to-trade-SPY-as-inflation-cools,"Good Morning Traders! In today's Market Clubhouse Morning Memo, we will discuss SPY, QQQ, AAPL, MSFT, NVDA, GOOGL, META, and TSLA. Our proprietary formula, exclusive to Market Clubhouse, dictates these price levels. This dynamic equation takes into account price, volume, and options flow.",Benzinga,20250410T135901,"[{'topic': 'Economy - Monetary', 'relevance_score': '0.310843'}, {'topic': 'Financial Markets', 'relevance_score': '0.803643'}, {'topic': 'Manufacturing', 'relevance_score': '0.5'}, {'topic': 'Technology', 'relevance_score': '0.5'}]",Somewhat-Bullish,0.213893,NVDA
Why AMD Stock Rallied Harder Than Nvidia After New Tariff Announcement,Advanced Micro Devices' stock rallied over 20% on Wednesday.,Motley Fool,20250410T135636,"[{'topic': 'Manufacturing', 'relevance_score': '1.0'}]",Neutral,0.119699,NVDA
"This COVID Growth Stock, Down 88% From Its Peak, May Be A Hidden Gem Amid Trump's Tariffs",Trump's tariffs have the capital markets in shambles.,Motley Fool,20250410T135300,"[{'topic': 'Economy - Monetary', 'relevance_score': '0.158519'}, {'topic': 'Financial Markets', 'relevance_score': '0.995077'}, {'topic': 'Manufacturing', 'relevance_score': '0.5'}, {'topic': 'Earnings', 'relevance_score': '0.77141'}, {'topic': 'Technology', 'relevance_score': '0.5'}]",Neutral,0.086219,NVDA
Trump's Tariff Pause Triggers Epic Rally: How to Play Mag 7 Now,"As markets celebrate Trump's 90-day pause on reciprocal tariffs, are Tesla, Amazon, NVIDIA, Alphabet, Amazon, Apple and Meta Platforms stocks worth buying now?",Zacks Commentary,20250410T134600,"[{'topic': 'Retail & Wholesale', 'relevance_score': '0.25'}, {'topic': 'Financial Markets', 'relevance_score': '0.999987'}, {'topic': 'Manufacturing', 'relevance_score': '0.25'}, {'topic': 'Earnings', 'relevance_score': '0.413559'}, {'topic': 'Technology', 'relevance_score': '0.25'}, {'topic': 'Finance', 'relevance_score': '0.25'}]",Neutral,0.056272,NVDA
"Stock Market News for Apr 10, 2025","U.S. stocks ended sharply higher on Wednesday, with all three major indexes recording one of their best days ever, after President Trump announced a 90-day pause on tariffs on most countries, bringing relief to markets that had come under extreme pressure over the past few sessions.",Zacks Commentary,20250410T132400,"[{'topic': 'Economy - Monetary', 'relevance_score': '0.576289'}, {'topic': 'Technology', 'relevance_score': '0.5'}, {'topic': 'Manufacturing', 'relevance_score': '0.5'}]",Neutral,0.113894,NVDA
Top Big Data Stocks to Power Up Your Portfolio Right Away,"The Big Data industry is expected to grow significantly in the future. As a result, companies like NVDA, MCO and QCOM are likely to benefit.",Zacks Commentary,20250410T131000,"[{'topic': 'Technology', 'relevance_score': '0.5'}, {'topic': 'Financial Markets', 'relevance_score': '0.214378'}, {'topic': 'Manufacturing', 'relevance_score': '0.5'}]",Bullish,0.35314,NVDA
Why Nvidia Stock Could Be Tech's Biggest Bargain in 2025,"Amid the rubble of President Donald Trump's escalating trade war, Nvidia ( NASDAQ: NVDA ) , the semiconductor powerhouse fueling the artificial intelligence ( AI ) revolution, has watched its share price crumble 28% since the start of 2025.With the company's shares now trading at just 16.3 times ...",Motley Fool,20250410T130000,"[{'topic': 'Financial Markets', 'relevance_score': '0.161647'}, {'topic': 'Manufacturing', 'relevance_score': '0.5'}, {'topic': 'Earnings', 'relevance_score': '0.451494'}, {'topic': 'Technology', 'relevance_score': '0.5'}]",Somewhat-Bullish,0.190367,NVDA
"Notice to Long-Term Shareholders of Driven Bands Holdings, Inc.  ( NASDAQ: DRVN ) ; ModivCare, Inc.  ( NASDAQ: MODV ) ; Monolithic Power Systems, Inc.  ( NASDAQ: MPWR ) ; and Virtu Financial Inc.  ( NASDAQ: VIRT ) , Grabar Law Office Investigates Claims on Your Behalf - ModivCare  ( NASDAQ:MODV ) , Driven Brands Hldgs  ( NASDAQ:DRVN ) ","PHILADELPHIA, April 10, 2025 ( GLOBE NEWSWIRE ) -- A securities fraud class action complaint against Driven Brands Holdings, Inc. DRVN has survived defendants, attempts to dismiss the complaint. Grabar Law Office is now investigating claims on behalf of long-term Driven Brands shareholders.",Benzinga,20250410T125731,"[{'topic': 'Financial Markets', 'relevance_score': '0.266143'}, {'topic': 'Manufacturing', 'relevance_score': '0.333333'}, {'topic': 'Energy & Transportation', 'relevance_score': '0.333333'}, {'topic': 'Finance', 'relevance_score': '0.333333'}]",Neutral,0.083866,NVDA
Semtech  ( SMTC )  CEO Acknowledges CopperEdge Delays Amid Investor Lawsuit - Hagens Berman,Semtech (SMTC) CEO Acknowledges CopperEdge Delays Amid Investor Lawsuit - Hagens Berman ...,Business Insider,20250410T123300,"[{'topic': 'Earnings', 'relevance_score': '0.495866'}, {'topic': 'Financial Markets', 'relevance_score': '0.108179'}, {'topic': 'Manufacturing', 'relevance_score': '1.0'}]",Neutral,-0.024329,NVDA
Nvidia  ( NVDA )  Moves 18.7% Higher: Will This Strength Last?,Nvidia (NVDA) witnessed a jump in share price last session on above-average trading volume. The latest trend in earnings estimate revisions for the stock suggests that there could be more strength down the road.,Zacks Commentary,20250410T123000,"[{'topic': 'Earnings', 'relevance_score': '0.972476'}, {'topic': 'Financial Markets', 'relevance_score': '0.316726'}, {'topic': 'Manufacturing', 'relevance_score': '1.0'}]",Somewhat-Bullish,0.231454,NVDA
