title,summary,source,time_published,topics,overall_sentiment_label,overall_sentiment_score,ticker
"Trump Tariff Strategy Creates 'Self-Inflicted Market Debacle': Analyst - Apple  ( NASDAQ:AAPL ) , Advanced Micro Devices  ( NASDAQ:AMD ) ","China to impose 34% tariff on all U.S. imports starting April 10 in direct response to U.S. 54% duties. U.S. companies like Apple, Nvidia, and GM face 4-5 year delays and high costs if shifting production stateside. With stocks plunging, steady income is key.",Benzinga,20250408T181633,"[{'topic': 'Technology', 'relevance_score': '0.5'}, {'topic': 'Financial Markets', 'relevance_score': '0.108179'}, {'topic': 'Manufacturing', 'relevance_score': '0.5'}]",Neutral,0.067616,NVDA
Why Nvidia Stock Is Skyrocketing Today,Shares of Nvidia ( NASDAQ: NVDA ) are surging on Tuesday. The company's stock gained 3% as of 12:50 p.m. ET but it was up as much as 8.4% earlier in the day. The significant rebound comes as the S&P 500 gained 1.4% and the Nasdaq Composite jumped 1.2%.News of tariff negotiations sparked optimism ...,Motley Fool,20250408T172806,"[{'topic': 'Manufacturing', 'relevance_score': '1.0'}]",Neutral,0.110259,NVDA
Why Nvidia Stock Is Jumping Today,"Nvidia ( NASDAQ: NVDA ) stock is gaining ground in Tuesday's trading amid rebound momentum for the broader market. The artificial intelligence ( AI ) leader's share price was up 2.7% as of 1 p.m. ET. Meanwhile, the S&P 500 ( SNPINDEX: ^GSPC ) and Nasdaq Composite ( NASDAQINDEX: ^IXIC ) were up 1% ...",Motley Fool,20250408T172415,"[{'topic': 'Financial Markets', 'relevance_score': '0.977154'}, {'topic': 'Manufacturing', 'relevance_score': '1.0'}]",Somewhat-Bullish,0.329061,NVDA
3 Stocks That Cathie Wood Is Buying During the Stock Market Sell-Off,The aggressive growth investor kicked off the new trading week with a few notable purchases.,Motley Fool,20250408T155500,"[{'topic': 'Financial Markets', 'relevance_score': '0.99793'}, {'topic': 'Manufacturing', 'relevance_score': '0.5'}, {'topic': 'Earnings', 'relevance_score': '0.961735'}, {'topic': 'Technology', 'relevance_score': '0.5'}]",Somewhat-Bullish,0.201821,NVDA
Top 3D Printing Stocks to Build Your Portfolios for Solid Returns,"The future of 3D Printing is supported by its edge over traditional manufacturing and rising adoption. NVDA, GE, CRS and PRLB will likely ride on this trend.",Zacks Commentary,20250408T154100,"[{'topic': 'Technology', 'relevance_score': '0.5'}, {'topic': 'Manufacturing', 'relevance_score': '0.5'}]",Somewhat-Bullish,0.279307,NVDA
The Nasdaq Is Officially in a Bear Market. Here's Why History Says Investors Shouldn't Panic.,"The Nasdaq Composite ( NASDAQINDEX: ^IXIC ) is officially in a bear market. While it had been floating around in correction territory for a few weeks, it fell more than 20% below its all-time high after President Donald Trump announced his new tariff plan on April 2.",Motley Fool,20250408T151200,"[{'topic': 'Technology', 'relevance_score': '0.5'}, {'topic': 'Financial Markets', 'relevance_score': '1.0'}, {'topic': 'Manufacturing', 'relevance_score': '0.5'}]",Neutral,0.036035,NVDA
Exploring The Competitive Space: NVIDIA Versus Industry Peers In Semiconductors & Semiconductor Equipment - NVIDIA  ( NASDAQ:NVDA ) ,"In the dynamic and cutthroat world of business, conducting thorough company analysis is essential for investors and industry experts. In this article, we will undertake a comprehensive industry comparison, evaluating NVIDIA NVDA and its primary competitors in the Semiconductors & Semiconductor ...",Benzinga,20250408T150100,"[{'topic': 'Earnings', 'relevance_score': '0.938793'}, {'topic': 'Financial Markets', 'relevance_score': '0.658903'}, {'topic': 'Manufacturing', 'relevance_score': '1.0'}]",Somewhat-Bullish,0.215819,NVDA
Industry Innovator Susan Foley Joins S4 Capital's Monks,"Tech pioneer and AI champion joins Monks to further integrate AI into content supply chain and creative process with Monks.Flow, recently named top AI product at Business Intelligence Awards",Benzinga,20250408T150000,"[{'topic': 'Earnings', 'relevance_score': '0.650727'}, {'topic': 'Technology', 'relevance_score': '0.5'}, {'topic': 'Manufacturing', 'relevance_score': '0.5'}]",Bullish,0.413643,NVDA
"Marvell Technology, Nvidia, Tesla, Apple And Other Big Stocks Moving Higher On Tuesday - Apple  ( NASDAQ:AAPL ) , Applied Optoelectronics  ( NASDAQ:AAOI ) ","U.S. stocks were higher, with the Dow Jones index surging over 1,300 points on Tuesday. Shares of Marvell Technology, Inc. MRVL rose sharply during Tuesday's session after Infineon Technologies agreed to acquire its Automotive Ethernet Business for $2.5 billion in cash.",Benzinga,20250408T143705,"[{'topic': 'Life Sciences', 'relevance_score': '0.166667'}, {'topic': 'Energy & Transportation', 'relevance_score': '0.166667'}, {'topic': 'Technology', 'relevance_score': '0.166667'}, {'topic': 'Finance', 'relevance_score': '0.166667'}, {'topic': 'Retail & Wholesale', 'relevance_score': '0.166667'}, {'topic': 'Financial Markets', 'relevance_score': '0.161647'}, {'topic': 'Manufacturing', 'relevance_score': '0.166667'}, {'topic': 'Earnings', 'relevance_score': '0.108179'}]",Somewhat-Bullish,0.313595,NVDA
Wall Street Looks To Rebound As Futures Rise After $9 Trillion Tariff Selloff; Bitcoin Outperforms Big Tech; Apple Demand Surges Amid Iphone Price Hike Fears - Top Headlines While the U.S. Slept,"Bear Markets Hit Harder And Last Longer During Recessions, Says Market Strategist: Here's A Historical Look At Bear Market Severity And Duration Wall Street Eyes Recovery As S&P 500, Nasdaq Futures Rise After Trump's Tariff-Driven Selloff Wipes Out $9 Trillion In Six Weeks",Benzinga,20250408T143330,"[{'topic': 'Life Sciences', 'relevance_score': '0.166667'}, {'topic': 'Technology', 'relevance_score': '0.166667'}, {'topic': 'Finance', 'relevance_score': '0.166667'}, {'topic': 'Blockchain', 'relevance_score': '0.158519'}, {'topic': 'IPO', 'relevance_score': '0.158519'}, {'topic': 'Retail & Wholesale', 'relevance_score': '0.166667'}, {'topic': 'Financial Markets', 'relevance_score': '0.980716'}, {'topic': 'Manufacturing', 'relevance_score': '0.166667'}, {'topic': 'Real Estate & Construction', 'relevance_score': '0.166667'}]",Neutral,-0.078731,NVDA
"SPY, IVV, VOO Battle for Top ETF Crown Amid S&P 500 Swings","SPY, IVV and VOO are battling for the position of the world???s top ETF amid wild swings in the S&P 500.",Zacks Commentary,20250408T143000,"[{'topic': 'Financial Markets', 'relevance_score': '0.999981'}, {'topic': 'Manufacturing', 'relevance_score': '0.333333'}, {'topic': 'Earnings', 'relevance_score': '0.158519'}, {'topic': 'Technology', 'relevance_score': '0.333333'}, {'topic': 'Finance', 'relevance_score': '0.333333'}]",Neutral,0.143408,NVDA
"Nvidia And Google Bet Big On Quantum AI With $150M Investment In SandboxAQ, Raising Series E Round To $450 Million - Alphabet  ( NASDAQ:GOOGL ) , NVIDIA  ( NASDAQ:NVDA ) ","Quantum computing may still feel like science fiction to most, but for a handful of major players, the future is unfolding much faster than expected. Nvidia NVDA and Alphabet GOOGL GOOG ) ) are the latest to double down on that future, pouring a $150 million investment into SandboxAQ, a startup ...",Benzinga,20250408T140044,"[{'topic': 'IPO', 'relevance_score': '0.310843'}, {'topic': 'Retail & Wholesale', 'relevance_score': '0.333333'}, {'topic': 'Financial Markets', 'relevance_score': '0.214378'}, {'topic': 'Manufacturing', 'relevance_score': '0.333333'}, {'topic': 'Mergers & Acquisitions', 'relevance_score': '0.158519'}, {'topic': 'Technology', 'relevance_score': '0.333333'}]",Somewhat-Bullish,0.219344,NVDA
How To Trade The Market Amid Tariff News - SPDR S&P 500  ( ARCA:SPY ) ,"Good Morning Traders! In today's Market Clubhouse Morning Memo, we will discuss SPY, QQQ, AAPL, MSFT, NVDA, GOOGL, META, and TSLA. Our proprietary formula, exclusive to Market Clubhouse, dictates these price levels. This dynamic equation takes into account price, volume, and options flow.",Benzinga,20250408T140038,"[{'topic': 'Technology', 'relevance_score': '0.5'}, {'topic': 'Financial Markets', 'relevance_score': '0.413559'}, {'topic': 'Manufacturing', 'relevance_score': '0.5'}]",Somewhat-Bullish,0.173238,NVDA
"Prediction: After Losing Over $1 Trillion in Market Cap This Year, Nvidia Stock Will Rebound in Epic Fashion. Here's Why.",Nvidia is one of the worst-performing stocks among megacap tech so far this year.,Motley Fool,20250408T140000,"[{'topic': 'Financial Markets', 'relevance_score': '0.365926'}, {'topic': 'Manufacturing', 'relevance_score': '0.5'}, {'topic': 'Earnings', 'relevance_score': '0.614606'}, {'topic': 'Technology', 'relevance_score': '0.5'}]",Neutral,0.133429,NVDA
"Company News for Apr 8, 2025",Companies in The News Are: ...,Zacks Commentary,20250408T131700,"[{'topic': 'Energy & Transportation', 'relevance_score': '0.5'}, {'topic': 'Manufacturing', 'relevance_score': '0.5'}]",Somewhat-Bearish,-0.154462,NVDA
"HUMBL, Inc. Announces Joint Venture Agreement with MultiCortex to Expand its Artificial Intelligence  ( AI )  Distribution","San Diego, CA, April 08, 2025 ( GLOBE NEWSWIRE ) -- HUMBL, Inc. ( OTC: HMBL ) is pleased to announce a joint venture agreement with MultiCortex, LLC, a U.S. and Brazilian-based company specializing in artificial intelligence ( AI ) and high-performance computing.",GlobeNewswire,20250408T131500,"[{'topic': 'IPO', 'relevance_score': '0.158519'}, {'topic': 'Financial Markets', 'relevance_score': '0.650727'}, {'topic': 'Manufacturing', 'relevance_score': '0.5'}, {'topic': 'Technology', 'relevance_score': '0.5'}]",Somewhat-Bullish,0.225723,NVDA
Is Nvidia Stock Severely Affected By President Trump's Tariffs?,Nvidia ( NASDAQ: NVDA ) has been one of the hottest stocks in the market since 2023 but has cooled alongside all of the other growth stocks during the latest sell-off. Nvidia has been a top stock because of its involvement in the artificial intelligence ( AI ) race since its products power much ...,Motley Fool,20250408T131500,"[{'topic': 'Earnings', 'relevance_score': '0.360215'}, {'topic': 'Financial Markets', 'relevance_score': '0.459462'}, {'topic': 'Manufacturing', 'relevance_score': '1.0'}]",Somewhat-Bullish,0.157974,NVDA
"EXCLUSIVE: Nvidia May Be The Face Of AI But The Valuation Story Is Getting Complicated, Says Expert - NVIDIA  ( NASDAQ:NVDA ) ",Nvidia faces valuation headwinds as it drops below all major moving averages with RSI nearing oversold. Capex worries and tariff risks raise doubts about sustainability of Nvidia's AI-fueled growth story. Feel unsure about the market's next move?,Benzinga,20250408T130756,"[{'topic': 'Financial Markets', 'relevance_score': '0.365926'}, {'topic': 'Manufacturing', 'relevance_score': '1.0'}]",Neutral,0.051489,NVDA
3 Tech ETFs on Sale Now,"U.S. ech stocks slumped in Q1 2025 as lofty valuations, cheaper Chinese AI, a less-dovish Fed, and trade tensions brewed a perfect storm.",Zacks Commentary,20250408T123900,"[{'topic': 'Retail & Wholesale', 'relevance_score': '0.25'}, {'topic': 'Financial Markets', 'relevance_score': '0.999816'}, {'topic': 'Manufacturing', 'relevance_score': '0.25'}, {'topic': 'Earnings', 'relevance_score': '0.360215'}, {'topic': 'Technology', 'relevance_score': '0.25'}, {'topic': 'Finance', 'relevance_score': '0.25'}]",Neutral,-0.024248,NVDA
How Nvidia and Other Semiconductor Stocks Are Affected by Recent Tariff Announcements,Semiconductor stock investors are trying to understand the implications of tariffs.,Motley Fool,20250408T104500,"[{'topic': 'Financial Markets', 'relevance_score': '0.161647'}, {'topic': 'Manufacturing', 'relevance_score': '1.0'}]",Neutral,0.09214,NVDA
Where Will Super Micro Computer Stock Be in 1 Year?,"We're a quarter through 2025, and the generative artificial intelligence ( AI ) hype cycle may feel long in the tooth, but it is far from over. Companies continue to pour billions into the industry to avoid falling behind in a technology that could transform the global economy.This scramble for ...",Motley Fool,20250408T104500,"[{'topic': 'Earnings', 'relevance_score': '0.158519'}, {'topic': 'Technology', 'relevance_score': '0.5'}, {'topic': 'Manufacturing', 'relevance_score': '0.5'}]",Neutral,0.089628,NVDA
"Despite Tariff Turmoil, Bitcoin Outperforms 'Magnificent 7' Stocks In 2025 - Records Smaller Losses Than Nvidia, Tesla, Apple - Apple  ( NASDAQ:AAPL ) ","Stocks and cryptocurrencies have been punched hard amid fears of economic fallout from President Donald Trump's sweeping tariff measures. Even so, Bitcoin, the world's largest cryptocurrency by market capitalization, has fared better than some of Wall Street's tech behemoths.",Benzinga,20250408T103704,"[{'topic': 'Retail & Wholesale', 'relevance_score': '0.333333'}, {'topic': 'Financial Markets', 'relevance_score': '0.684621'}, {'topic': 'Manufacturing', 'relevance_score': '0.333333'}, {'topic': 'Technology', 'relevance_score': '0.333333'}, {'topic': 'Blockchain', 'relevance_score': '0.576289'}]",Neutral,0.146492,NVDA
4 Stocks to Buy During the Tariff-Fueled Market Downturn,Nvidia and these three other tech giants are at the top of my buy list.,Motley Fool,20250408T103000,"[{'topic': 'Technology', 'relevance_score': '0.5'}, {'topic': 'Financial Markets', 'relevance_score': '0.495866'}, {'topic': 'Manufacturing', 'relevance_score': '0.5'}]",Somewhat-Bearish,-0.17608,NVDA
Should You Invest in the Invesco Dorsey Wright Technology Momentum ETF  ( PTF ) ?,Sector ETF report for ...,Zacks Commentary,20250408T102008,"[{'topic': 'Financial Markets', 'relevance_score': '1.0'}, {'topic': 'Manufacturing', 'relevance_score': '0.333333'}, {'topic': 'Technology', 'relevance_score': '0.333333'}, {'topic': 'Finance', 'relevance_score': '0.333333'}]",Somewhat-Bullish,0.188589,NVDA
Should You Invest in the iShares U.S. Technology ETF  ( IYW ) ?,Sector ETF report for ...,Zacks Commentary,20250408T102008,"[{'topic': 'Technology', 'relevance_score': '0.5'}, {'topic': 'Financial Markets', 'relevance_score': '1.0'}, {'topic': 'Manufacturing', 'relevance_score': '0.5'}]",Neutral,0.147676,NVDA
Should Invesco NASDAQ 100 ETF  ( QQQM )  Be on Your Investing Radar?,Style Box ETF report for ...,Zacks Commentary,20250408T102007,"[{'topic': 'Financial Markets', 'relevance_score': '1.0'}, {'topic': 'Manufacturing', 'relevance_score': '0.333333'}, {'topic': 'Earnings', 'relevance_score': '0.310843'}, {'topic': 'Technology', 'relevance_score': '0.333333'}, {'topic': 'Finance', 'relevance_score': '0.333333'}]",Somewhat-Bullish,0.264427,NVDA
Is Franklin U.S. Large Cap Multifactor Index ETF  ( FLQL )  a Strong ETF Right Now?,Smart Beta ETF report for ...,Zacks Commentary,20250408T102007,"[{'topic': 'Technology', 'relevance_score': '0.5'}, {'topic': 'Financial Markets', 'relevance_score': '1.0'}, {'topic': 'Manufacturing', 'relevance_score': '0.5'}]",Somewhat-Bullish,0.182437,NVDA
"The Zacks Analyst Blog Highlights Fidelity NASDAQ Composite Index ETF, ThredUp, 908 Devices, Logility Supply Chain, Palomar and EZCORP","Fidelity NASDAQ Composite Index ETF, ThredUp, 908 Devices, Logility Supply Chain, Palomar and EZCORP are included in this Analyst Blog.",Zacks Commentary,20250408T095800,"[{'topic': 'Life Sciences', 'relevance_score': '0.25'}, {'topic': 'Retail & Wholesale', 'relevance_score': '0.25'}, {'topic': 'Financial Markets', 'relevance_score': '0.858979'}, {'topic': 'Manufacturing', 'relevance_score': '0.25'}, {'topic': 'Finance', 'relevance_score': '0.25'}]",Neutral,0.01709,NVDA
Stock Market Crash: Here Are 5 Stocks Down 27% or More I'd Buy Right Now,To say that the stock market has been volatile lately doesn't do the situation justice. The S&P 500 ( SNPINDEX: ^GSPC ) and several other major market indexes recently fell by more than 10% over a two-day period in response to President Trump's surprisingly high tariff rates.,Motley Fool,20250408T094100,"[{'topic': 'Retail & Wholesale', 'relevance_score': '0.25'}, {'topic': 'Financial Markets', 'relevance_score': '0.99793'}, {'topic': 'Manufacturing', 'relevance_score': '0.25'}, {'topic': 'Earnings', 'relevance_score': '0.875462'}, {'topic': 'Technology', 'relevance_score': '0.25'}, {'topic': 'Finance', 'relevance_score': '0.25'}]",Somewhat-Bullish,0.177429,NVDA
Is the Vanguard Value ETF the Best Ultra-Low-Cost Fund for Generating Passive Income?,"Collecting passive income from stocks is a simple and effective way to participate in the market without having the return based solely on stock prices going up.Exchange-traded funds ( ETFs ) that invest in dividend stocks provide the added benefit of diversification, making them solid options ...",Motley Fool,20250408T094000,"[{'topic': 'Life Sciences', 'relevance_score': '0.166667'}, {'topic': 'Energy & Transportation', 'relevance_score': '0.166667'}, {'topic': 'Technology', 'relevance_score': '0.166667'}, {'topic': 'Finance', 'relevance_score': '0.166667'}, {'topic': 'Retail & Wholesale', 'relevance_score': '0.166667'}, {'topic': 'Financial Markets', 'relevance_score': '1.0'}, {'topic': 'Manufacturing', 'relevance_score': '0.166667'}, {'topic': 'Earnings', 'relevance_score': '0.451494'}]",Somewhat-Bullish,0.281377,NVDA
Why Nvidia Is a Stock to Buy Hand Over Fist in the Tariff-Fueled Market Downturn,Nvidia has numerous growth opportunities driven by huge investments in artificial intelligence.,Motley Fool,20250408T093000,"[{'topic': 'Financial Markets', 'relevance_score': '0.108179'}, {'topic': 'Manufacturing', 'relevance_score': '1.0'}]",Bullish,0.423107,NVDA
"Wall Street Eyes Recovery As S&P 500, Nasdaq Futures Rise After Trump's Tariff-Driven Selloff Wipes Out $9 Trillion In Six Weeks - Apple  ( NASDAQ:AAPL ) , Amazon.com  ( NASDAQ:AMZN ) ",U.S. stock futures rose on Tuesday following a volatile day of trading on Monday that led the indices to close on a mixed note. Futures of major benchmark indices were higher in premarket.,Benzinga,20250408T092532,"[{'topic': 'Life Sciences', 'relevance_score': '0.2'}, {'topic': 'Technology', 'relevance_score': '0.2'}, {'topic': 'Finance', 'relevance_score': '0.2'}, {'topic': 'Economy - Monetary', 'relevance_score': '0.310843'}, {'topic': 'Retail & Wholesale', 'relevance_score': '0.2'}, {'topic': 'Financial Markets', 'relevance_score': '0.999999'}, {'topic': 'Manufacturing', 'relevance_score': '0.2'}, {'topic': 'Earnings', 'relevance_score': '0.990786'}, {'topic': 'Economy - Macro', 'relevance_score': '0.158519'}]",Neutral,0.033896,NVDA
AMD Stock Investors Got Amazing News on Nvidia,Advanced Micro Devices is increasing its competition against Nvidia.,Motley Fool,20250408T091500,"[{'topic': 'Manufacturing', 'relevance_score': '1.0'}]",Neutral,0.110523,NVDA
3 Hypergrowth Tech Stocks to Buy in 2025,"Nvidia, Palantir, and Reddit should survive the tariff-driven chaos.",Motley Fool,20250408T091400,"[{'topic': 'Financial Markets', 'relevance_score': '0.962106'}, {'topic': 'Manufacturing', 'relevance_score': '0.5'}, {'topic': 'Earnings', 'relevance_score': '0.999996'}, {'topic': 'Technology', 'relevance_score': '0.5'}]",Somewhat-Bullish,0.236508,NVDA
"Nasdaq Sell-Off: 2 Solid Artificial Intelligence  ( AI )  Stocks to Buy Hand Over Fist Before They Soar 70% to 85%, According to Wall Street",Technology stocks have taken a big beating in recent months as the Trump administration's policies have led investors to press the panic button amid concerns that the tariff-fueled global trade war could hurt the U.S. economy and may even send it into a recession.Investors have become ...,Motley Fool,20250408T090500,"[{'topic': 'Earnings', 'relevance_score': '0.997874'}, {'topic': 'Financial Markets', 'relevance_score': '0.87644'}, {'topic': 'Manufacturing', 'relevance_score': '1.0'}]",Somewhat-Bullish,0.256335,NVDA
2 AI Stocks That Are Screaming Buys in April,"April has gotten off to about as bad a start as a month can have in the stock market. The S&P 500 plunged more than 10% in a two-day span following President Donald Trump's announcement of global tariffs, and the Nasdaq Composite has now entered a bear market, down more than 20% in less than two ...",Motley Fool,20250408T085000,"[{'topic': 'IPO', 'relevance_score': '0.310843'}, {'topic': 'Financial Markets', 'relevance_score': '0.999365'}, {'topic': 'Manufacturing', 'relevance_score': '0.5'}, {'topic': 'Earnings', 'relevance_score': '0.858979'}, {'topic': 'Technology', 'relevance_score': '0.5'}]",Neutral,0.124918,NVDA
Tech Stocks Take the Tariff Tumble. Time to Buy the Dip on Nvidia?,"Stocks across industries have plummeted in recent days on concerns that President Donald Trump's tariffs on imports will eat into their profits. The U.S. just launched a plan to impose duties on most imports from around the world, with tariff levels differing from country to country.However, the ...",Motley Fool,20250408T083500,"[{'topic': 'Financial Markets', 'relevance_score': '0.918141'}, {'topic': 'Manufacturing', 'relevance_score': '0.5'}, {'topic': 'Earnings', 'relevance_score': '0.818451'}, {'topic': 'Technology', 'relevance_score': '0.5'}]",Neutral,0.109212,NVDA
This Might Be the Ultimate Artificial Intelligence  ( AI )  ETF to Buy as Tariffs Take Hold,"The S&P 500 ( SNPINDEX: ^GSPC ) has plunged by as much as 20% since hitting a record high just two months ago. President Donald Trump enacted sweeping tariffs on all of America's trading partners last week, and many countries responded with plans for retaliatory tariffs of their own, which is ...",Motley Fool,20250408T082100,"[{'topic': 'Financial Markets', 'relevance_score': '0.999687'}, {'topic': 'Manufacturing', 'relevance_score': '0.5'}, {'topic': 'Earnings', 'relevance_score': '0.108179'}, {'topic': 'Technology', 'relevance_score': '0.5'}]",Neutral,0.082273,NVDA
"Have $8,000? These 3 Stocks Could Be Bargain Buys for 2025 and Beyond.","ASML, TSMC, and Supermicro could be worth buying as the market swoons.",Motley Fool,20250408T081000,"[{'topic': 'Economy - Monetary', 'relevance_score': '0.158519'}, {'topic': 'Financial Markets', 'relevance_score': '0.990999'}, {'topic': 'Manufacturing', 'relevance_score': '0.5'}, {'topic': 'Earnings', 'relevance_score': '0.990893'}, {'topic': 'Technology', 'relevance_score': '0.5'}]",Neutral,0.129155,NVDA
"Jim Cramer Says Market Rebound Feels 'Strange' After Nine Nights Of Losses: 'Things Aren't Better' As Stock Futures Surge Over 1% - NVIDIA  ( NASDAQ:NVDA ) , Palantir Technologies  ( NASDAQ:PLTR ) ","Jim Cramer expressed skepticism about Monday's market rebound, calling it ""strange"" following nine consecutive down days in futures trading. What Happened: ""We don't want to see the futures up this much. So strange. We have come in down every night for 9 nights. Now the futures are up huge.",Benzinga,20250408T050249,"[{'topic': 'Economy - Monetary', 'relevance_score': '0.158519'}, {'topic': 'Financial Markets', 'relevance_score': '0.214378'}, {'topic': 'Manufacturing', 'relevance_score': '0.5'}, {'topic': 'Technology', 'relevance_score': '0.5'}]",Somewhat-Bearish,-0.21106,NVDA
Why Nvidia Stock Jumped in a Wildly Volatile Day for the Market,"Nvidia ( NASDAQ: NVDA ) stock posted gains in Monday's wild day of trading. The company's share price closed out the day up 3.5% and had been up as much as 7.9% earlier in the session. On the other hand, the stock had also been down as much as 8.2% in the day's trading.The stock market saw ...",Motley Fool,20250407T224626,"[{'topic': 'Economy - Monetary', 'relevance_score': '0.158519'}, {'topic': 'Financial Markets', 'relevance_score': '0.962106'}, {'topic': 'Manufacturing', 'relevance_score': '1.0'}]",Neutral,-0.07186,NVDA
Why Lam Research Stock Crushed the Market Today,"Chip fabrication equipment maker Lam Research ( NASDAQ: LRCX ) experienced a bit of a rally in its stock on Monday. A big researcher flagged the company as a fine bargain in the semiconductor universe, and investors took the recommendation to heart.",Motley Fool,20250407T222800,"[{'topic': 'Financial Markets', 'relevance_score': '0.161647'}, {'topic': 'Manufacturing', 'relevance_score': '0.333333'}, {'topic': 'Technology', 'relevance_score': '0.333333'}, {'topic': 'Finance', 'relevance_score': '0.333333'}]",Somewhat-Bullish,0.151477,NVDA
Bitcoin Strengthens Against 'Magnificent 7' Stocks as Wall Street Quakes,"The leading cryptocurrency has been holding near its Election Day price, while the world's most valuable tech stocks have wavered.",Decrypt.co,20250407T210710,"[{'topic': 'Financial Markets', 'relevance_score': '0.839681'}, {'topic': 'Manufacturing', 'relevance_score': '0.5'}, {'topic': 'Technology', 'relevance_score': '0.5'}, {'topic': 'Blockchain', 'relevance_score': '0.158519'}]",Neutral,0.137318,NVDA
"Monolithic Power Systems, Inc. Investors: Please contact the Portnoy Law Firm to recover your losses. April 7, 2025 Deadline to file Lead Plaintiff Motion. - Monolithic Power Systems  ( NASDAQ:MPWR ) ",Investors can contact the law firm at no cost to learn more about recovering their losses,Benzinga,20250407T195104,"[{'topic': 'Financial Markets', 'relevance_score': '0.214378'}, {'topic': 'Manufacturing', 'relevance_score': '1.0'}]",Neutral,-0.00729,NVDA
"Technology, Communications Services Stocks Are Outpacing Broader Markets Monday: What's Going On? - SPDR Select Sector Fund - Technology  ( ARCA:XLK ) ","Broader markets continue to face selling pressure after President Donald Trump announced sweeping tariffs last week. Technology and communications services stocks are outpacing the broader market Monday amid increased volatility related to ""fake news.""",Benzinga,20250407T190638,"[{'topic': 'Technology', 'relevance_score': '0.5'}, {'topic': 'Financial Markets', 'relevance_score': '0.87644'}, {'topic': 'Manufacturing', 'relevance_score': '0.5'}]",Neutral,-0.134216,NVDA
