title,summary,source,time_published,topics,overall_sentiment_label,overall_sentiment_score,ticker
"Wall Street Eyes Recovery As S&P 500, Nasdaq Futures Rise After Trump's Tariff-Driven Selloff Wipes Out $9 Trillion In Six Weeks - Apple  ( NASDAQ:AAPL ) , Amazon.com  ( NASDAQ:AMZN ) ",U.S. stock futures rose on Tuesday following a volatile day of trading on Monday that led the indices to close on a mixed note. Futures of major benchmark indices were higher in premarket.,Benzinga,20250408T092532,"[{'topic': 'Life Sciences', 'relevance_score': '0.2'}, {'topic': 'Technology', 'relevance_score': '0.2'}, {'topic': 'Finance', 'relevance_score': '0.2'}, {'topic': 'Economy - Monetary', 'relevance_score': '0.310843'}, {'topic': 'Retail & Wholesale', 'relevance_score': '0.2'}, {'topic': 'Financial Markets', 'relevance_score': '0.999999'}, {'topic': 'Manufacturing', 'relevance_score': '0.2'}, {'topic': 'Earnings', 'relevance_score': '0.990786'}, {'topic': 'Economy - Macro', 'relevance_score': '0.158519'}]",Neutral,0.033896,TSLA
"Tesla's Deliveries Plummet: Should You Buy, Hold, or Sell Now?","On April 2, Tesla ( NASDAQ: TSLA ) released its quarterly vehicle delivery report for the first quarter of 2025. Global electric vehicle ( EV ) deliveries dropped 13% year over year to 336,681, falling more than 53,000 short of the analyst expectations of 390,000 vehicle deliveries ( based on ...",Motley Fool,20250408T075500,"[{'topic': 'Earnings', 'relevance_score': '0.87644'}, {'topic': 'Financial Markets', 'relevance_score': '0.623304'}, {'topic': 'Manufacturing', 'relevance_score': '1.0'}]",Neutral,0.021865,TSLA
"Elon Musk Made Unsucessful Appeals To Trump To Reverse New Tariffs As Tesla Likely To Take A Hit: Report - BlackRock  ( NYSE:BLK ) , Lucid Group  ( NASDAQ:LCID ) ","Elon Musk, CEO of Tesla Inc. TSLA, reportedly made direct appeals to President Donald Trump over the weekend to reverse sweeping new tariffs.",Benzinga,20250408T075439,"[{'topic': 'Real Estate & Construction', 'relevance_score': '0.5'}, {'topic': 'Financial Markets', 'relevance_score': '0.796627'}, {'topic': 'Manufacturing', 'relevance_score': '0.5'}]",Neutral,0.068325,TSLA
"Dow Falls For 3rd Session Amid Trump's Tariff Threats As Apple, Tesla Decline: Greed Index Remains In 'Extreme Fear' Zone - Cal-Maine Foods  ( NASDAQ:CALM ) , Apple  ( NASDAQ:AAPL ) ","The CNN Money Fear and Greed index showed some easing in the overall fear level, while the index remained in the ""Extreme Fear"" zone on Monday. U.S. stocks settled mixed on Monday, with the Dow Jones index falling for the third straight session. Tesla Inc. TSLA shares fell around 2.6% on Monday, ...",Benzinga,20250408T070842,"[{'topic': 'Life Sciences', 'relevance_score': '0.25'}, {'topic': 'Retail & Wholesale', 'relevance_score': '0.25'}, {'topic': 'Financial Markets', 'relevance_score': '0.161647'}, {'topic': 'Manufacturing', 'relevance_score': '0.25'}, {'topic': 'Earnings', 'relevance_score': '0.158519'}, {'topic': 'Technology', 'relevance_score': '0.25'}]",Neutral,-0.100446,TSLA
"Elon Musk's Brother Kimbal Musk Calls Trump 'Most High Tax American President In Generations,' Warns Tariffs Are A 'Permanent Tax' On US Consumers - Tesla  ( NASDAQ:TSLA ) ","Tesla Inc. TSLA board member Kimbal Musk criticized President Donald Trump's tariff policies Monday, calling him ""the most high tax American President in generations"" through his implementation of what Musk described as a ""structural, permanent tax on the American consumer.""",Benzinga,20250408T015314,"[{'topic': 'Financial Markets', 'relevance_score': '0.108179'}, {'topic': 'Manufacturing', 'relevance_score': '1.0'}]",Somewhat-Bullish,0.162959,TSLA
Instagram's Mike Krieger Reveals A Surprising Key To Startup Success-'Not Every Step Needs To Make Logical Sense',"The idea that youth holds the key to innovation isn't new, but Instagram co-founder and Anthropic Chief Product Officer Mike Krieger is making a case for why entrepreneurs in their 20s might have a unique edge.",Benzinga,20250408T010046,"[{'topic': 'IPO', 'relevance_score': '0.158519'}, {'topic': 'Retail & Wholesale', 'relevance_score': '0.333333'}, {'topic': 'Financial Markets', 'relevance_score': '0.108179'}, {'topic': 'Manufacturing', 'relevance_score': '0.333333'}, {'topic': 'Technology', 'relevance_score': '0.333333'}]",Somewhat-Bullish,0.263554,TSLA
"Airbnb Co-Founder And DOGE Employee Joe Gebbia Says, 'Government Can Have An Apple Store-Like Experience' That's 'Beautifully Designed' - Morgan Stanley  ( NYSE:MS ) , Airbnb  ( NASDAQ:ABNB ) ","Joe Gebbia, billionaire co-founder of Airbnb ABNB and current Tesla TSLA board member, is back in the spotlight for joining the Trump administration's Department of Government Efficiency.",Benzinga,20250408T000041,"[{'topic': 'IPO', 'relevance_score': '0.310843'}, {'topic': 'Retail & Wholesale', 'relevance_score': '0.25'}, {'topic': 'Financial Markets', 'relevance_score': '0.161647'}, {'topic': 'Manufacturing', 'relevance_score': '0.25'}, {'topic': 'Technology', 'relevance_score': '0.25'}, {'topic': 'Finance', 'relevance_score': '0.25'}]",Somewhat-Bullish,0.2314,TSLA
"Former Kraken execs acquire real state firm Janover, disclose SOL treasury plans","A team of former Kraken executives has taken control of Janover, with Joseph Onorati, former chief strategy officer at Kraken, stepping in as chairman and CEO, following the group's purchase of over 700,000 common shares and all Series A preferred stock.Parker White, former director of ...",Cointelegraph,20250407T222000,"[{'topic': 'Life Sciences', 'relevance_score': '0.333333'}, {'topic': 'Financial Markets', 'relevance_score': '0.995015'}, {'topic': 'Manufacturing', 'relevance_score': '0.333333'}, {'topic': 'Finance', 'relevance_score': '0.333333'}, {'topic': 'Blockchain', 'relevance_score': '0.158519'}]",Neutral,0.124606,TSLA
Bitcoin Strengthens Against 'Magnificent 7' Stocks as Wall Street Quakes,"The leading cryptocurrency has been holding near its Election Day price, while the world's most valuable tech stocks have wavered.",Decrypt.co,20250407T210710,"[{'topic': 'Financial Markets', 'relevance_score': '0.839681'}, {'topic': 'Manufacturing', 'relevance_score': '0.5'}, {'topic': 'Technology', 'relevance_score': '0.5'}, {'topic': 'Blockchain', 'relevance_score': '0.158519'}]",Neutral,0.137318,TSLA
Spotlight on Tesla: Analyzing the Surge in Options Activity - Tesla  ( NASDAQ:TSLA ) ,"Investors with a lot of money to spend have taken a bullish stance on Tesla TSLA. We noticed this today when the trades showed up on publicly available options history that we track here at Benzinga. Whether these are institutions or just wealthy individuals, we don't know.",Benzinga,20250407T201152,"[{'topic': 'Earnings', 'relevance_score': '0.158519'}, {'topic': 'Financial Markets', 'relevance_score': '0.413559'}, {'topic': 'Manufacturing', 'relevance_score': '1.0'}]",Somewhat-Bullish,0.169506,TSLA
"VTRS BREAKING NEWS: Viatris Inc. Stock Plummets 15% Triggering Securities Class Action - Investors are Notified to Contact BFA Law by June 3, 2025  ( NASDAQ:VTRS )  - Viatris  ( NASDAQ:VTRS ) ","NEW YORK, April 07, 2025 ( GLOBE NEWSWIRE ) -- Leading securities law firm Bleichmar Fonti & Auld LLP announces that a lawsuit has been filed against Viatris Inc. VTRS and certain of the Company's senior executives for potential violations of the federal securities laws.",Benzinga,20250407T200604,"[{'topic': 'Life Sciences', 'relevance_score': '0.5'}, {'topic': 'Financial Markets', 'relevance_score': '0.796627'}, {'topic': 'Manufacturing', 'relevance_score': '0.5'}, {'topic': 'Earnings', 'relevance_score': '0.360215'}]",Neutral,0.098559,TSLA
Nasdaq in Bear Market: Buy the Dip in ETFs?,"The Nasdaq entered a bear market last week, mainly due to trade tensions. Should you buy related ETFs on valuation corrections?",Zacks Commentary,20250407T170000,"[{'topic': 'Financial Markets', 'relevance_score': '0.995921'}, {'topic': 'Manufacturing', 'relevance_score': '0.333333'}, {'topic': 'Earnings', 'relevance_score': '0.310843'}, {'topic': 'Technology', 'relevance_score': '0.333333'}, {'topic': 'Finance', 'relevance_score': '0.333333'}]",Neutral,-0.034132,TSLA
"Apple Takes the Biggest Hit of the ""Magnificent Seven"" in Response to Trump Tariffs","Tariffs will be the focus, but Apple's issues predate the shocking tariff announcement on April 2.",Motley Fool,20250407T164500,"[{'topic': 'Financial Markets', 'relevance_score': '0.929393'}, {'topic': 'Manufacturing', 'relevance_score': '0.333333'}, {'topic': 'Earnings', 'relevance_score': '0.576289'}, {'topic': 'Technology', 'relevance_score': '0.333333'}, {'topic': 'Finance', 'relevance_score': '0.333333'}]",Neutral,0.029542,TSLA
Why Tesla Stock Sank 11.5% in March,Tesla stock is now down over 40% in 2025. Is it time to buy?,Motley Fool,20250407T164135,"[{'topic': 'Financial Markets', 'relevance_score': '0.316726'}, {'topic': 'Manufacturing', 'relevance_score': '1.0'}]",Somewhat-Bearish,-0.208795,TSLA
Tesla Has Over $200 Million Worth Of Cybertrucks In Inventory-And That's Raising Questions About Demand  ( Again )  - Tesla  ( NASDAQ:TSLA ) ,"Tesla TSLA is sitting on nearly 2,400 unsold Cybertrucks across the U.S., according to new data from Tesla-Info. That's about $200 million worth of inventory for a vehicle CEO Elon Musk once said had ""over 1 million"" reservations. But more than a year after deliveries began, the Cybertruck has ...",Benzinga,20250407T163018,"[{'topic': 'IPO', 'relevance_score': '0.158519'}, {'topic': 'Retail & Wholesale', 'relevance_score': '0.5'}, {'topic': 'Financial Markets', 'relevance_score': '0.266143'}, {'topic': 'Manufacturing', 'relevance_score': '0.5'}]",Neutral,0.043436,TSLA
Does Sirius XM's Broadcasting Strategy Signal a Buy for the Stock?,"SIRI expands its content portfolio in broadcasting across different interest areas, presenting a compelling investment opportunity for the stock.",Zacks Commentary,20250407T161000,"[{'topic': 'Retail & Wholesale', 'relevance_score': '0.333333'}, {'topic': 'Financial Markets', 'relevance_score': '0.108179'}, {'topic': 'Manufacturing', 'relevance_score': '0.333333'}, {'topic': 'Earnings', 'relevance_score': '0.614606'}, {'topic': 'Technology', 'relevance_score': '0.333333'}]",Somewhat-Bullish,0.212498,TSLA
Tesla's Supercharger Business to Power Up its Long-Term Story,"TSLA's Supercharger network is growing fast, now spanning 65k+ stalls. With NACS adoption and wider access, it's cementing Tesla's position in EV charging.",Zacks Commentary,20250407T160000,"[{'topic': 'Earnings', 'relevance_score': '0.360215'}, {'topic': 'Manufacturing', 'relevance_score': '1.0'}]",Somewhat-Bullish,0.257345,TSLA
Fed Cutting Rates To Counter Tariffs May Not Be A Good Idea - Microsoft  ( NASDAQ:MSFT ) ,"To gain an edge, this is what you need to know today. Please click here for a chart of S&P 500 ETF ( SPY ) which represents the benchmark stock market index S&P 500 ( SPX ) . President Trump had a very positive call with the Secretary of the Communist Party of Vietnam.",Benzinga,20250407T155342,"[{'topic': 'Economy - Monetary', 'relevance_score': '0.158519'}, {'topic': 'Financial Markets', 'relevance_score': '0.999966'}, {'topic': 'Manufacturing', 'relevance_score': '0.333333'}, {'topic': 'Technology', 'relevance_score': '0.333333'}, {'topic': 'Finance', 'relevance_score': '0.333333'}]",Somewhat-Bullish,0.207944,TSLA
3 Domestic Auto Stocks to Watch Amid Growing Economic Uncertainty,"Domestic auto players like TSLA, GM and BLBD are expected to withstand the industry headwinds better.",Zacks Commentary,20250407T150100,"[{'topic': 'Economy - Monetary', 'relevance_score': '0.158519'}, {'topic': 'Economy - Fiscal', 'relevance_score': '0.158519'}, {'topic': 'Financial Markets', 'relevance_score': '0.962106'}, {'topic': 'Manufacturing', 'relevance_score': '1.0'}, {'topic': 'Earnings', 'relevance_score': '0.99986'}]",Somewhat-Bullish,0.190654,TSLA
Longtime Bull Dan Ives Just Slashed His Price Target on Tesla -- Shares Are Falling,"Shares of Tesla ( NASDAQ: TSLA ) traded close to 6% lower as of 10:31 a.m. ET today, but had traded as much as 10.5% down before broader market volatility set in, causing volatile swings in shares. Longtime bull Dan Ives, an analyst at Wedbush, slashed his price target on the electric carmaker by ...",Motley Fool,20250407T144142,"[{'topic': 'Earnings', 'relevance_score': '0.158519'}, {'topic': 'Manufacturing', 'relevance_score': '1.0'}]",Neutral,-0.026831,TSLA
Nio Power In Deal Talks With Tesla Battery Supplier CATL - NIO  ( NYSE:NIO ) ,"CATL eyes controlling stake in Nio Power, which runs 3,000+ battery swap stations and serves EV giants like Nio and Tesla. CATL ramps up battery swap push despite profit hit, investing $342M in Nio Power's fast-growing EV unit. Feel unsure about the market's next move?",Benzinga,20250407T143812,"[{'topic': 'Technology', 'relevance_score': '0.5'}, {'topic': 'Financial Markets', 'relevance_score': '0.962106'}, {'topic': 'Manufacturing', 'relevance_score': '0.5'}]",Somewhat-Bullish,0.170568,TSLA
"LiveOne  ( Nasdaq: LVO )  Announces Preliminary Fiscal 2025 Results, Including Revenues of $112M+","LOS ANGELES, April 07, 2025 ( GLOBE NEWSWIRE ) -- LiveOne ( Nasdaq: LVO ) , an award-winning, creator-first, music, entertainment, and technology platform, announced today preliminary financial results for its fiscal year ended March 31, 2025 ( ""Fiscal 2025"" ) and updates to certain of its other ...",GlobeNewswire,20250407T141700,"[{'topic': 'Retail & Wholesale', 'relevance_score': '0.333333'}, {'topic': 'Financial Markets', 'relevance_score': '0.905476'}, {'topic': 'Manufacturing', 'relevance_score': '0.333333'}, {'topic': 'Earnings', 'relevance_score': '0.999999'}, {'topic': 'Mergers & Acquisitions', 'relevance_score': '0.108179'}, {'topic': 'Technology', 'relevance_score': '0.333333'}]",Somewhat-Bullish,0.175424,TSLA
"US Futures Plunge On Tariff Fallout, Stir 'Great Depression-Style' Fears; Bitcoin, Ethereum, XRP, And Dogecoin Nosedive, Wiping Out $1.42 Billion In Liquidations; Tesla's Cybertruck Faces Brutal Backlash-Experts Call It Costly Misstep - Top Headlines While the U.S. Slept","US Stock Futures Drop Following Massive Tariff-Induced Selloff: Experts Warn Of A Brewing 'Great Depression-Like' Pattern Dow Nosedives Over 2,200 Points As Apple, Tesla, Nvidia Plummet: Investor Sentiment Dips Further, Greed Index Remains In 'Extreme Fear' Zone",Benzinga,20250407T140736,"[{'topic': 'Energy & Transportation', 'relevance_score': '0.25'}, {'topic': 'Technology', 'relevance_score': '0.25'}, {'topic': 'Finance', 'relevance_score': '0.25'}, {'topic': 'Blockchain', 'relevance_score': '0.158519'}, {'topic': 'Economy - Monetary', 'relevance_score': '0.158519'}, {'topic': 'Financial Markets', 'relevance_score': '0.998962'}, {'topic': 'Manufacturing', 'relevance_score': '0.25'}, {'topic': 'Mergers & Acquisitions', 'relevance_score': '0.158519'}]",Somewhat-Bearish,-0.153927,TSLA
"""Liberation Day"" Tariffs Trigger Market Turmoil: What's Next?","Signs of panic and extreme fear are emerging following the ""Liberation Day"" tariff turmoil.",Zacks Commentary,20250407T135100,"[{'topic': 'Financial Markets', 'relevance_score': '0.744043'}, {'topic': 'Manufacturing', 'relevance_score': '1.0'}]",Neutral,-0.094452,TSLA
"Tech stocks fall for third session, Tesla sinks 10% as Trump stands by tariffs",The Magnificent Seven stocks collectively shed more than $1.8 trillion in market value during a two-day market selloff.,CNBC,20250407T134541,"[{'topic': 'Technology', 'relevance_score': '0.5'}, {'topic': 'Financial Markets', 'relevance_score': '0.614606'}, {'topic': 'Manufacturing', 'relevance_score': '0.5'}]",Somewhat-Bearish,-0.221975,TSLA
How'd They Get $20 Million On A $200K Salary?' Asks Musk As He Reveals Congress's 'Strangely Wealthy' Members Are Next In DOGE's Crosshairs - Tesla  ( NASDAQ:TSLA ) ,Elon Musk is taking aim at Capitol Hill. The billionaire CEO of Tesla TSLA and SpaceX says the Department of Government Efficiency he leads is now turning its focus to members of Congress who have built massive fortunes while drawing relatively modest public salaries.,Benzinga,20250407T134517,"[{'topic': 'IPO', 'relevance_score': '0.158519'}, {'topic': 'Financial Markets', 'relevance_score': '0.995077'}, {'topic': 'Manufacturing', 'relevance_score': '1.0'}]",Neutral,0.130309,TSLA
NVO & LLY Shares Down on Exclusion of Obesity Drugs From Medicare,"CMS keeps out LLY and NVO's obesity drugs from Medicare coverage. Medicare, at present, does not cover obesity drugs if they are solely prescribed for weight loss.",Zacks Commentary,20250407T131400,"[{'topic': 'Life Sciences', 'relevance_score': '0.5'}, {'topic': 'Financial Markets', 'relevance_score': '0.108179'}, {'topic': 'Manufacturing', 'relevance_score': '0.5'}]",Neutral,0.029148,TSLA
"How To Trade The Market As Global Trade Tensions Escalate - Meta Platforms  ( NASDAQ:META ) , SPDR S&P 500  ( ARCA:SPY ) ","Good Morning Traders! In today's Market Clubhouse Morning Memo, we will discuss SPY, QQQ, AAPL, MSFT, NVDA, GOOGL, META, and TSLA. Our proprietary formula, exclusive to Market Clubhouse, dictates these price levels. This dynamic equation takes into account price, volume, and options flow.",Benzinga,20250407T131220,"[{'topic': 'Technology', 'relevance_score': '0.5'}, {'topic': 'Financial Markets', 'relevance_score': '0.413559'}, {'topic': 'Manufacturing', 'relevance_score': '0.5'}]",Neutral,0.124976,TSLA
Itron and Norgesnett to Launch Grid Edge Project in Nordic Region,"ITRI and Norgesnett will unveil the Nordics' first grid edge computing project, using smart meters and DI to boost energy efficiency and sustainability.",Zacks Commentary,20250407T130400,"[{'topic': 'Life Sciences', 'relevance_score': '0.25'}, {'topic': 'Manufacturing', 'relevance_score': '0.25'}, {'topic': 'Earnings', 'relevance_score': '0.947132'}, {'topic': 'Energy & Transportation', 'relevance_score': '0.25'}, {'topic': 'Technology', 'relevance_score': '0.25'}]",Bullish,0.446906,TSLA
Jim Cramer's top 10 things to watch in the stock market Monday,U.S. stocks are set for another brutal open today after last week's tariff-driven carnage.,CNBC,20250407T130109,"[{'topic': 'Economy - Monetary', 'relevance_score': '0.576289'}, {'topic': 'Financial Markets', 'relevance_score': '0.94762'}, {'topic': 'Manufacturing', 'relevance_score': '0.5'}, {'topic': 'Earnings', 'relevance_score': '0.682689'}, {'topic': 'Finance', 'relevance_score': '0.5'}]",Neutral,0.017118,TSLA
BYD's Blazing Rally Continues: Should You Still Buy at These Levels?,"With its new ""Super e-Platform."" BYDDY is taking a huge leap forward in battery technology and charging speed.",Zacks Commentary,20250407T123600,"[{'topic': 'Earnings', 'relevance_score': '0.614606'}, {'topic': 'Financial Markets', 'relevance_score': '0.413559'}, {'topic': 'Manufacturing', 'relevance_score': '1.0'}]",Somewhat-Bullish,0.257058,TSLA
Hanover Insurance and MillerKnoll have been highlighted as Zacks Bull and Bear of the Day,"Chicago, IL - April 7, 2025 - Zacks Equity Research shares The Hanover Insurance Group, Inc. ( THG Quick QuoteTHG - ) as the Bull of the Day and MillerKnoll, Inc. ( MLKN Quick QuoteMLKN - ) as the Bear of the Day.",Zacks Commentary,20250407T123600,"[{'topic': 'Financial Markets', 'relevance_score': '0.999365'}, {'topic': 'Manufacturing', 'relevance_score': '0.333333'}, {'topic': 'Earnings', 'relevance_score': '0.999855'}, {'topic': 'Real Estate & Construction', 'relevance_score': '0.333333'}, {'topic': 'Finance', 'relevance_score': '0.333333'}]",Neutral,0.11019,TSLA
"Broadcom, Analog Devices Could Slide ~10%, Analyst Warns, But A Bottom Could Be Near - KLA  ( NASDAQ:KLAC ) , Broadcom  ( NASDAQ:AVGO ) , Analog Devices  ( NASDAQ:ADI ) , Synopsys  ( NASDAQ:SNPS ) ","Analyst sees up to 10% more downside for chip stocks amid demand risk from rising product prices. Analyst favors Broadcom, Analog Devices, KLA, Synopsys for resilience as EPS cuts set stage for rebound. Feel unsure about the market's next move?",Benzinga,20250407T123342,"[{'topic': 'Life Sciences', 'relevance_score': '0.333333'}, {'topic': 'Financial Markets', 'relevance_score': '0.108179'}, {'topic': 'Manufacturing', 'relevance_score': '0.333333'}, {'topic': 'Earnings', 'relevance_score': '0.614606'}, {'topic': 'Technology', 'relevance_score': '0.333333'}]",Neutral,-0.046536,TSLA
When Will the Ultra-Low-Cost Vanguard Growth ETF Return to Its Previous Highs?,"Over the past decade-plus, growth stocks have been largely responsible for leading the major U.S. stock market indexes to new heights. Growth-driven exchange-traded funds ( ETFs ) -- like the Vanguard Growth ETF ( NYSEMKT: VUG ) -- have significantly outperformed the S&P 500.",Motley Fool,20250407T123000,"[{'topic': 'Financial Markets', 'relevance_score': '0.999989'}, {'topic': 'Manufacturing', 'relevance_score': '0.5'}, {'topic': 'Earnings', 'relevance_score': '0.614606'}, {'topic': 'Technology', 'relevance_score': '0.5'}]",Somewhat-Bullish,0.233395,TSLA
"TTD CLASS ACTION DEADLINE: Trade Desk, Inc. Securities Class Action Could Allow Investors to Recover Losses; Contact BFA Law by April 21  ( NASDAQ:TTD )  - Trade Desk  ( NASDAQ:TTD ) ","NEW YORK, April 07, 2025 ( GLOBE NEWSWIRE ) -- Leading securities law firm Bleichmar Fonti & Auld LLP announces that a lawsuit has been filed against The Trade Desk, Inc. TTD and certain of the Company's senior executives for potential violations of the federal securities laws.",Benzinga,20250407T121600,"[{'topic': 'Financial Markets', 'relevance_score': '0.918141'}, {'topic': 'Manufacturing', 'relevance_score': '0.5'}, {'topic': 'Earnings', 'relevance_score': '0.839681'}, {'topic': 'Technology', 'relevance_score': '0.5'}]",Somewhat-Bullish,0.154437,TSLA
"ALDX SECURITIES REPORT: Aldeyra Therapeutics, Inc. Securities Investigation Could Allow Investors to Recover Losses; Contact BFA Law  ( NASDAQ:ALDX )  - Aldeyra Therapeutics  ( NASDAQ:ALDX ) ","NEW YORK, April 07, 2025 ( GLOBE NEWSWIRE ) -- Leading securities law firm Bleichmar Fonti & Auld LLP announces an investigation into Aldeyra Therapeutics, Inc. ALDX for potential violations of the federal securities laws.",Benzinga,20250407T121600,"[{'topic': 'Life Sciences', 'relevance_score': '0.5'}, {'topic': 'Financial Markets', 'relevance_score': '0.214378'}, {'topic': 'Manufacturing', 'relevance_score': '0.5'}]",Neutral,0.120101,TSLA
"TBBK CLASS ACTION DEADLINE: The Bancorp, Inc. Securities Class Action Could Allow Investors to Recover Losses; Contact BFA Law by May 16  ( NASDAQ:TBBK )  - Bancorp  ( NASDAQ:TBBK ) ","NEW YORK, April 07, 2025 ( GLOBE NEWSWIRE ) -- Leading securities law firm Bleichmar Fonti & Auld LLP announces that a lawsuit has been filed against The Bancorp, Inc. TBBK and certain of the Company's senior executives for potential violations of the federal securities laws.",Benzinga,20250407T121600,"[{'topic': 'Financial Markets', 'relevance_score': '0.980922'}, {'topic': 'Manufacturing', 'relevance_score': '0.5'}, {'topic': 'Earnings', 'relevance_score': '0.310843'}, {'topic': 'Finance', 'relevance_score': '0.5'}]",Neutral,0.063319,TSLA
"Tesla, Apple, Nvidia And Other Big Stocks Moving Lower In Monday's Pre-Market Session - American Rebel Holdings  ( NASDAQ:AREB ) , Apple  ( NASDAQ:AAPL ) ","U.S. stock futures were lower this morning, with the Dow futures falling more than 700 points on Monday. Shares of Tesla, Inc. TSLA fell sharply in today's pre-market trading.",Benzinga,20250407T121531,"[{'topic': 'Financial Markets', 'relevance_score': '0.779048'}, {'topic': 'Manufacturing', 'relevance_score': '0.333333'}, {'topic': 'Technology', 'relevance_score': '0.333333'}, {'topic': 'Finance', 'relevance_score': '0.333333'}]",Neutral,-0.085144,TSLA
RC CLASS ACTION DEADLINE: Ready Capital Securities Class Action Could Allow Investors to Recover Losses; Contact BFA Law by May 5  ( NYSE:RC )  - Ready Capital  ( NYSE:RC ) ,"NEW YORK, April 07, 2025 ( GLOBE NEWSWIRE ) -- Leading securities law firm Bleichmar Fonti & Auld LLP announces that a lawsuit has been filed against Ready Capital Corporation RC and certain of the Company's senior executives for potential violations of the federal securities laws.",Benzinga,20250407T121100,"[{'topic': 'Real Estate & Construction', 'relevance_score': '0.5'}, {'topic': 'Financial Markets', 'relevance_score': '0.918141'}, {'topic': 'Manufacturing', 'relevance_score': '0.5'}]",Somewhat-Bullish,0.177041,TSLA
"FLNC CLASS ACTION DEADLINE: Fluence Energy, Inc. Securities Class Action Could Allow Investors to Recover Losses; Contact BFA Law by May 12  ( NASDAQ:FLNC )  - Fluence Energy  ( NASDAQ:FLNC ) ","NEW YORK, April 07, 2025 ( GLOBE NEWSWIRE ) -- Leading securities law firm Bleichmar Fonti & Auld LLP announces that a lawsuit has been filed against Fluence Energy, Inc. FLNC and certain of the Company's senior executives for potential violations of the federal securities laws.",Benzinga,20250407T121100,"[{'topic': 'Financial Markets', 'relevance_score': '0.905476'}, {'topic': 'Manufacturing', 'relevance_score': '0.5'}, {'topic': 'Earnings', 'relevance_score': '0.986564'}, {'topic': 'Technology', 'relevance_score': '0.5'}]",Neutral,0.087595,TSLA
5 Top-Ranked Stocks of Nasdaq ETF Beating the Bear Market,"The tech-focused Nasdaq officially entered bear market territory on Friday, falling over 20% from its December peak.",Zacks Commentary,20250407T120000,"[{'topic': 'Life Sciences', 'relevance_score': '0.2'}, {'topic': 'Retail & Wholesale', 'relevance_score': '0.2'}, {'topic': 'Financial Markets', 'relevance_score': '0.684621'}, {'topic': 'Manufacturing', 'relevance_score': '0.2'}, {'topic': 'Technology', 'relevance_score': '0.2'}, {'topic': 'Finance', 'relevance_score': '0.2'}]",Neutral,-0.02195,TSLA
