title,summary,source,time_published,topics,overall_sentiment_label,overall_sentiment_score,ticker
"TTD STOCK FRAUD: Did Trade Desk, Inc. Commit Securities Fraud? Investors are Notified to Contact BFA Law by the April 21 Court Deadline  ( NASDAQ:TTD )  - Trade Desk  ( NASDAQ:TTD ) ","NEW YORK, April 11, 2025 ( GLOBE NEWSWIRE ) -- Leading securities law firm Bleichmar Fonti & Auld LLP announces that a lawsuit has been filed against The Trade Desk, Inc. TTD and certain of the Company's senior executives for potential violations of the federal securities laws.",Benzinga,20250411T114300,"[{'topic': 'Financial Markets', 'relevance_score': '0.918141'}, {'topic': 'Manufacturing', 'relevance_score': '0.5'}, {'topic': 'Earnings', 'relevance_score': '0.839681'}, {'topic': 'Technology', 'relevance_score': '0.5'}]",Somewhat-Bullish,0.154437,TSLA
TMDX STOCK FRAUD: Did TransMedics Group Commit Securities Fraud? Investors are Notified to Contact BFA Law by the April 15 Court Deadline  ( NASDAQ:TMDX )  - TransMedics Group  ( NASDAQ:TMDX ) ,"NEW YORK, April 11, 2025 ( GLOBE NEWSWIRE ) -- Leading securities law firm Bleichmar Fonti & Auld LLP announces that a lawsuit has been filed against TransMedics Group, Inc. TMDX and certain of the Company's senior executives for potential violations of the federal securities laws.",Benzinga,20250411T114300,"[{'topic': 'Life Sciences', 'relevance_score': '0.5'}, {'topic': 'Financial Markets', 'relevance_score': '0.87644'}, {'topic': 'Manufacturing', 'relevance_score': '0.5'}]",Neutral,0.113596,TSLA
VTRS STOCK FRAUD: Did Viatris Inc. Commit Securities Fraud? Investors are Notified to Contact BFA Law by the June 3 Court Deadline  ( NASDAQ:VTRS )  - Viatris  ( NASDAQ:VTRS ) ,"NEW YORK, April 11, 2025 ( GLOBE NEWSWIRE ) -- Leading securities law firm Bleichmar Fonti & Auld LLP announces that a lawsuit has been filed against Viatris Inc. VTRS and certain of the Company's senior executives for potential violations of the federal securities laws.",Benzinga,20250411T114200,"[{'topic': 'Life Sciences', 'relevance_score': '0.5'}, {'topic': 'Financial Markets', 'relevance_score': '0.796627'}, {'topic': 'Manufacturing', 'relevance_score': '0.5'}, {'topic': 'Earnings', 'relevance_score': '0.360215'}]",Neutral,0.098559,TSLA
"TBBK STOCK FRAUD: Did The Bancorp, Inc. Commit Securities Fraud? Investors are Notified to Contact BFA Law by the May 16 Court Deadline  ( NASDAQ:TBBK )  - Bancorp  ( NASDAQ:TBBK ) ","NEW YORK, April 11, 2025 ( GLOBE NEWSWIRE ) -- Leading securities law firm Bleichmar Fonti & Auld LLP announces that a lawsuit has been filed against The Bancorp, Inc. TBBK and certain of the Company's senior executives for potential violations of the federal securities laws.",Benzinga,20250411T114200,"[{'topic': 'Financial Markets', 'relevance_score': '0.980922'}, {'topic': 'Manufacturing', 'relevance_score': '0.5'}, {'topic': 'Earnings', 'relevance_score': '0.310843'}, {'topic': 'Finance', 'relevance_score': '0.5'}]",Neutral,0.063319,TSLA
"Lucid Wins Nikola Bankruptcy Auction, Buys Nikola Facilities for $30 Million To Boost US EV Production - Lucid Group  ( NASDAQ:LCID ) ","Lucid to acquire Nikola's Arizona sites for $30M, adding 884K sq. ft. and hiring 300+ ex-Nikola staff in EV expansion push. Deal boosts Lucid's manufacturing scale with top-tier equipment, aligning with Arizona growth plans amid industry shakeout. Feel unsure about the market's next move?",Benzinga,20250411T104036,"[{'topic': 'IPO', 'relevance_score': '0.158519'}, {'topic': 'Financial Markets', 'relevance_score': '0.684621'}, {'topic': 'Manufacturing', 'relevance_score': '0.333333'}, {'topic': 'Real Estate & Construction', 'relevance_score': '0.333333'}, {'topic': 'Technology', 'relevance_score': '0.333333'}]",Neutral,-0.05343,TSLA
"Got $1,000? 2 No-Brainer Warren Buffett Stocks to Buy Right Now.",Warren Buffett is one of the most successful investors of all time. His Berkshire Hathaway portfolio is a valuable snapshot of the equities he believes are destined for long-term success. His vote of confidence is more important than ever in an increasingly uncertain global economy.,Motley Fool,20250411T103000,"[{'topic': 'Retail & Wholesale', 'relevance_score': '0.333333'}, {'topic': 'Financial Markets', 'relevance_score': '0.87644'}, {'topic': 'Manufacturing', 'relevance_score': '0.333333'}, {'topic': 'Earnings', 'relevance_score': '0.360215'}, {'topic': 'Finance', 'relevance_score': '0.333333'}]",Somewhat-Bullish,0.236171,TSLA
"President Donald Trump Delivers Huge News for Investors! What It Means for Nvidia, Tesla, and Apple.","The U.S. President paused the newly announced tariffs for 90 days, sending stock markets higher in response.*Stock prices used were the afternoon prices of April 8, 2025. The video was published on April 10, 2025.Continue reading ...",Motley Fool,20250411T102900,"[{'topic': 'Technology', 'relevance_score': '0.5'}, {'topic': 'Manufacturing', 'relevance_score': '0.5'}]",Bearish,-0.363039,TSLA
"Europe, China Eye EV Price Pact To Avert Trump Tariff Escalation After Tesla CEO Elon Musk Pushes For Zero EU Tariffs Amid Declining Sales - Ford Motor  ( NYSE:F ) , BYD  ( OTC:BYDDY ) ","The European Union and China have agreed to explore setting minimum prices for Chinese-made electric vehicles as an alternative to tariffs imposed last year, a European Commission spokesperson said Thursday.",Benzinga,20250411T095125,"[{'topic': 'Financial Markets', 'relevance_score': '0.108179'}, {'topic': 'Manufacturing', 'relevance_score': '1.0'}]",Somewhat-Bullish,0.186239,TSLA
"US Stocks Likely To Open Lower As Volatility Persists Before Bank Earnings: 'Fed Is Likely To Cut Rates Again On June 18th,' Says Expert - Apple  ( NASDAQ:AAPL ) , Bank of New York Mellon  ( NYSE:BK ) ","U.S. stock futures were volatile on Friday after losing steam on Thursday. Futures of major benchmark indices were lower in premarket. Data from the Bureau of Labor Statistics on Thursday showed the annual inflation rate falling to a six-month low of 2.4% in March, down from 2.8% in February and ...",Benzinga,20250411T094527,"[{'topic': 'Technology', 'relevance_score': '0.25'}, {'topic': 'Finance', 'relevance_score': '0.25'}, {'topic': 'Economy - Monetary', 'relevance_score': '0.983605'}, {'topic': 'Retail & Wholesale', 'relevance_score': '0.25'}, {'topic': 'Financial Markets', 'relevance_score': '0.998682'}, {'topic': 'Manufacturing', 'relevance_score': '0.25'}, {'topic': 'Earnings', 'relevance_score': '0.99999'}, {'topic': 'Economy - Macro', 'relevance_score': '0.158519'}]",Neutral,-0.021731,TSLA
"US Stock Futures Recover After Early Dip, Poised To Open Higher Amid Volatility: 'Fed Is Likely To Cut Rates Again On June 18th,' Says Expert  ( UPDATED )  - Apple  ( NASDAQ:AAPL ) , Bank of New York Mellon  ( NYSE:BK ) ","Editor's Note: This story has been updated to include the latest U.S. stock futures data. U.S. stock futures edged higher Friday morning, rebounding after a weak Thursday session that saw markets lose momentum. Major benchmark index futures traded in positive territory during premarket hours ...",Benzinga,20250411T094509,"[{'topic': 'Technology', 'relevance_score': '0.25'}, {'topic': 'Finance', 'relevance_score': '0.25'}, {'topic': 'Economy - Monetary', 'relevance_score': '0.983605'}, {'topic': 'Retail & Wholesale', 'relevance_score': '0.25'}, {'topic': 'Financial Markets', 'relevance_score': '0.999822'}, {'topic': 'Manufacturing', 'relevance_score': '0.25'}, {'topic': 'Earnings', 'relevance_score': '0.99999'}, {'topic': 'Economy - Macro', 'relevance_score': '0.158519'}]",Neutral,-0.012077,TSLA
Opinion | Chinese brands are impressing the world - but can they inspire it?,"While Chinese companies excel in quality, pricing and design, some have yet to embed themselves in the emotional lives of global consumers.",South China Morning Post,20250411T083007,"[{'topic': 'Manufacturing', 'relevance_score': '1.0'}]",Somewhat-Bullish,0.298657,TSLA
"EV Sales Rise 10.6% Year-Over-Year In Q1 2025: Tesla Declines But Remains US Market Leader - Ford Motor  ( NYSE:F ) , Forward Industries  ( NASDAQ:FORD ) ",The sales figures for Q1 2025 for EVs showcase a growth in U.S. EV sales for several manufacturers and paint a strong picture for the domestic EV sector.,Benzinga,20250411T080013,"[{'topic': 'Financial Markets', 'relevance_score': '0.161647'}, {'topic': 'Manufacturing', 'relevance_score': '1.0'}]",Somewhat-Bullish,0.161395,TSLA
"Dow Tumbles Over 1,000 Points As Nvidia, Apple And Tesla Decline: Greed Index Remains In 'Extreme Fear' Zone - Apple  ( NASDAQ:AAPL ) , JPMorgan Chase  ( NYSE:JPM ) ","The CNN Money Fear and Greed index showed an increase in the overall fear level, while the index remained in the ""Extreme Fear"" zone on Thursday.",Benzinga,20250411T070752,"[{'topic': 'Economy - Monetary', 'relevance_score': '0.310843'}, {'topic': 'Financial Markets', 'relevance_score': '0.161647'}, {'topic': 'Manufacturing', 'relevance_score': '0.333333'}, {'topic': 'Earnings', 'relevance_score': '0.158519'}, {'topic': 'Technology', 'relevance_score': '0.333333'}, {'topic': 'Finance', 'relevance_score': '0.333333'}]",Somewhat-Bearish,-0.326878,TSLA
Tesla Unveils New Cybertruck Long Range Trim With A 362-Mile Range And Reduced Features Tesla Unveils Cheaper Cybertruck RWD LR Trim With A 350-Mile Range - Tesla  ( NASDAQ:TSLA ) ,"Tesla Inc. TSLA has unveiled a new trim for its Cybertruck. The new trim is RWD ( rear-wheel drive ) and offers a range of over 362 miles on a single charge. What happened: Tesla has officially revealed its price with the Cybertruck Long Range RWD retailing in the U.S. for $69,990 and $62,490 ...",Benzinga,20250411T064032,"[{'topic': 'Financial Markets', 'relevance_score': '0.266143'}, {'topic': 'Manufacturing', 'relevance_score': '1.0'}, {'topic': 'Earnings', 'relevance_score': '0.360215'}, {'topic': 'Economy - Macro', 'relevance_score': '0.158519'}]",Somewhat-Bullish,0.170931,TSLA
Danish shoppers boycott U.S. products as Greenland - and trade - tensions escalate,"Incensed by President Donald Trump's posturing over Greenland and sweeping trade tariffs, Danish shoppers are turning their backs on American products.",CNBC,20250411T050825,"[{'topic': 'Technology', 'relevance_score': '0.333333'}, {'topic': 'Retail & Wholesale', 'relevance_score': '0.333333'}, {'topic': 'Manufacturing', 'relevance_score': '0.333333'}]",Neutral,-0.028661,TSLA
"BABA, JPM, KMX, JNVR, TSLA: Top 5 Trending Stocks Today - Alibaba Gr Hldgs  ( NYSE:BABA ) ","After a remarkable rally on Wednesday, Wall Street experienced a sharp decline on Thursday. Investors were cautious as they assessed the implications of President Donald Trump's 90-day tariff pause amidst ongoing economic uncertainties.",Benzinga,20250411T013833,"[{'topic': 'Economy - Monetary', 'relevance_score': '0.158519'}, {'topic': 'Retail & Wholesale', 'relevance_score': '0.5'}, {'topic': 'Financial Markets', 'relevance_score': '0.413559'}, {'topic': 'Manufacturing', 'relevance_score': '0.5'}, {'topic': 'Earnings', 'relevance_score': '0.495866'}]",Neutral,0.024196,TSLA
"Amazon and McDonald's Lead XLY Pullback As Consumer Stocks Dip After Tariff-Driven Rally - SPDR Select Sector Fund - Consumer Discretionary  ( ARCA:XLY ) , Home Depot  ( NYSE:HD ) , Amazon.com  ( NASDAQ:AMZN ) , McDonald's  ( NYSE:MCD ) ","XLY slipped Thursday as investors took profits following Wednesday's tariff-driven consumer stock rally. Cooling inflation supported sentiment, but Amazon, Tesla, and others retreated after sharp previous gains. Pelosi's latest AI pick skyrocketed 169% in just one month.",Benzinga,20250410T193257,"[{'topic': 'Economy - Monetary', 'relevance_score': '0.890401'}, {'topic': 'Retail & Wholesale', 'relevance_score': '0.5'}, {'topic': 'Financial Markets', 'relevance_score': '0.87644'}, {'topic': 'Manufacturing', 'relevance_score': '0.5'}]",Neutral,0.097915,TSLA
"EASTER BUNNY RETURNS WITH SIX-STORY CELEBRATION OF SPRING AT 900 NORTH MICHIGAN SHOPS, FEATURING FASHION, FOOD & FUN! THROUGH APRIL 19, 2025","Chicago, April 10, 2025 ( GLOBE NEWSWIRE ) -- Spring is in full swing again at 900 North Michigan Shops, with the return of The Bunny himself! The whimsical character will be on hand through Saturday, April 19th to pose for keepsake photos with kids of all ages.",Benzinga,20250410T192249,"[{'topic': 'Technology', 'relevance_score': '0.5'}, {'topic': 'Manufacturing', 'relevance_score': '0.5'}]",Somewhat-Bullish,0.302795,TSLA
"900 NORTH MICHIGAN SHOPS REVEALS THEME OF THIS YEAR'S IMMERSIVE EXHIBIT OF FRESH, FLORAL COUTURE: FLEURS DE VILLES DOWNTON ABBEY MAY 21ST - MAY 25TH","Chicago, April 10, 2025 ( GLOBE NEWSWIRE ) -- Fleurs de Villes, the globally renowned immersive floral show that has captivated audiences throughout the United States, Canada, Australia, and the UK, returns to 900 North Michigan Shops from May 21 - 25 with an all new show Fleurs De Villes ...",Benzinga,20250410T185946,"[{'topic': 'Technology', 'relevance_score': '0.5'}, {'topic': 'Manufacturing', 'relevance_score': '0.5'}]",Bullish,0.43121,TSLA
Wall Street's Wild Ride: What Tuesday's Rally Means for Investors,"While many beaten-down stocks registered large bounces yesterday, the immediate path ahead is murky for investors, at best. Stock Strategist Andrew Rocco explains.",Zacks Commentary,20250410T184400,"[{'topic': 'Economy - Monetary', 'relevance_score': '0.838487'}, {'topic': 'Financial Markets', 'relevance_score': '0.77141'}, {'topic': 'Manufacturing', 'relevance_score': '0.5'}, {'topic': 'Technology', 'relevance_score': '0.5'}]",Neutral,-0.036662,TSLA
"Goldman Sachs Hits The Brakes: Auto Tariffs & Slumping Demand May Shake Up Ford, Tesla, Rivian, Lear & Visteon - Ford Motor  ( NYSE:F ) , General Motors  ( NYSE:GM ) ","Goldman Sachs warns U.S. car prices may rise $2K-$4K in 6-12 months as tariffs raise manufacturing and import costs. Ford, Lear and Visteon downgraded amid rising global competition, tariff risks and weakening consumer demand. Feel unsure about the market's next move?",Benzinga,20250410T175940,"[{'topic': 'Financial Markets', 'relevance_score': '0.459462'}, {'topic': 'Manufacturing', 'relevance_score': '0.5'}, {'topic': 'Earnings', 'relevance_score': '0.158519'}, {'topic': 'Finance', 'relevance_score': '0.5'}]",Neutral,-0.053157,TSLA
Tesla Is Plummeting Again -- Is It Time to Buy the Stock?,"On the heels of huge gains yesterday, Tesla ( NASDAQ: TSLA ) stock is seeing big sell-offs in Thursday's trading. The electric-vehicle ( EV ) company's share price was down 9.9% as of 1:15 p.m. ET amid the backdrop of a 5.3% decline for the S&P 500 ( SNPINDEX: ^GSPC ) and a 6.1% decline for the ...",Motley Fool,20250410T175100,"[{'topic': 'Earnings', 'relevance_score': '0.451494'}, {'topic': 'Financial Markets', 'relevance_score': '0.459462'}, {'topic': 'Manufacturing', 'relevance_score': '1.0'}]",Neutral,0.055245,TSLA
The Real Reason Behind Trump's Tariff Reversals - SPDR S&P 500  ( ARCA:SPY ) ,"To gain an edge, this is what you need to know today. Please click here for an enlarged chart of SPDR S&P 500 ETF Trust SPY which represents the benchmark stock market index S&P 500 ( SPX ) . 75 countries wanting to negotiate Opinion of business leaders",Benzinga,20250410T162412,"[{'topic': 'Economy - Monetary', 'relevance_score': '0.451494'}, {'topic': 'Financial Markets', 'relevance_score': '0.999997'}, {'topic': 'Manufacturing', 'relevance_score': '0.333333'}, {'topic': 'Technology', 'relevance_score': '0.333333'}, {'topic': 'Finance', 'relevance_score': '0.333333'}]",Somewhat-Bullish,0.186848,TSLA
Why Tesla Stock Is Plummeting Today,"Shares of Tesla ( NASDAQ: TSLA ) are falling on Thursday. The electric vehicle maker's stock lost 9.5% as of 11:50 a.m. ET after gaining double digits yesterday. The slip comes as the S&P 500 and Nasdaq Composite lost 4.2% and 5.3%, respectively.UBS lowered its price target for Tesla stock citing ...",Motley Fool,20250410T160419,"[{'topic': 'Earnings', 'relevance_score': '0.576289'}, {'topic': 'Financial Markets', 'relevance_score': '0.214378'}, {'topic': 'Manufacturing', 'relevance_score': '1.0'}]",Neutral,-0.143721,TSLA
"Bitcoin Falls To $78K As Market Jitters; Trump Halts Tariffs After Bond Yield Spike; US-China Tensions Spark Visa Cancellations, Strain Academic Ties - Top Headlines While the US Slept","Bearish Sentiment Hits 7-Week High, Mimicking 35-Year Old Record Which Marked The Bottom Of The October 1990 Bear Market US Stocks Likely To Open Lower Ahead Of March Inflation Release: Expert Highlights 'Fairly Weak Returns' After 5%+ Gains In S&P 500",Benzinga,20250410T152015,"[{'topic': 'Technology', 'relevance_score': '0.25'}, {'topic': 'Finance', 'relevance_score': '0.25'}, {'topic': 'Economy - Monetary', 'relevance_score': '0.158519'}, {'topic': 'Retail & Wholesale', 'relevance_score': '0.25'}, {'topic': 'Financial Markets', 'relevance_score': '0.989041'}, {'topic': 'Manufacturing', 'relevance_score': '0.25'}, {'topic': 'Earnings', 'relevance_score': '0.614606'}]",Neutral,-0.120634,TSLA
Derivative-Based ETFs at the Heart of the Historic Market Run,Derivative-based ETFs are the biggest beneficiaries of the historic stock market rally.,Zacks Commentary,20250410T150000,"[{'topic': 'Technology', 'relevance_score': '0.25'}, {'topic': 'Finance', 'relevance_score': '0.25'}, {'topic': 'Blockchain', 'relevance_score': '0.158519'}, {'topic': 'Economy - Fiscal', 'relevance_score': '0.158519'}, {'topic': 'Retail & Wholesale', 'relevance_score': '0.25'}, {'topic': 'Financial Markets', 'relevance_score': '1.0'}, {'topic': 'Manufacturing', 'relevance_score': '0.25'}]",Neutral,0.138487,TSLA
5 Leveraged ETFs That Skyrocketed on 90-Day Tariff Pause,We highlight five leveraged ETFs that soared on Wall Street???s comeback after the announcement of a 90-day tariff pause.,Zacks Commentary,20250410T140000,"[{'topic': 'Economy - Fiscal', 'relevance_score': '0.158519'}, {'topic': 'Retail & Wholesale', 'relevance_score': '0.25'}, {'topic': 'Financial Markets', 'relevance_score': '0.980716'}, {'topic': 'Manufacturing', 'relevance_score': '0.25'}, {'topic': 'Energy & Transportation', 'relevance_score': '0.25'}, {'topic': 'Technology', 'relevance_score': '0.25'}]",Somewhat-Bullish,0.246353,TSLA
how-to-trade-SPY-as-inflation-cools,"Good Morning Traders! In today's Market Clubhouse Morning Memo, we will discuss SPY, QQQ, AAPL, MSFT, NVDA, GOOGL, META, and TSLA. Our proprietary formula, exclusive to Market Clubhouse, dictates these price levels. This dynamic equation takes into account price, volume, and options flow.",Benzinga,20250410T135901,"[{'topic': 'Economy - Monetary', 'relevance_score': '0.310843'}, {'topic': 'Financial Markets', 'relevance_score': '0.803643'}, {'topic': 'Manufacturing', 'relevance_score': '0.5'}, {'topic': 'Technology', 'relevance_score': '0.5'}]",Somewhat-Bullish,0.213893,TSLA
"This COVID Growth Stock, Down 88% From Its Peak, May Be A Hidden Gem Amid Trump's Tariffs",Trump's tariffs have the capital markets in shambles.,Motley Fool,20250410T135300,"[{'topic': 'Economy - Monetary', 'relevance_score': '0.158519'}, {'topic': 'Financial Markets', 'relevance_score': '0.995077'}, {'topic': 'Manufacturing', 'relevance_score': '0.5'}, {'topic': 'Earnings', 'relevance_score': '0.77141'}, {'topic': 'Technology', 'relevance_score': '0.5'}]",Neutral,0.086219,TSLA
Cointelegraph Bitcoin & Ethereum Blockchain News,"Why are people protesting against Elon Musk? Elon Musk, once celebrated as a tech visionary behind Tesla and SpaceX, has faced growing backlash due to his political ties, controversial corporate decisions and provocative public statements.Born in 1971 in Pretoria, South Africa, Elon Musk ...",Cointelegraph,20250410T135000,"[{'topic': 'Retail & Wholesale', 'relevance_score': '0.5'}, {'topic': 'Financial Markets', 'relevance_score': '0.360215'}, {'topic': 'Manufacturing', 'relevance_score': '0.5'}, {'topic': 'Mergers & Acquisitions', 'relevance_score': '0.108179'}]",Neutral,-0.079094,TSLA
Trump's Tariff Pause Triggers Epic Rally: How to Play Mag 7 Now,"As markets celebrate Trump's 90-day pause on reciprocal tariffs, are Tesla, Amazon, NVIDIA, Alphabet, Amazon, Apple and Meta Platforms stocks worth buying now?",Zacks Commentary,20250410T134600,"[{'topic': 'Retail & Wholesale', 'relevance_score': '0.25'}, {'topic': 'Financial Markets', 'relevance_score': '0.999987'}, {'topic': 'Manufacturing', 'relevance_score': '0.25'}, {'topic': 'Earnings', 'relevance_score': '0.413559'}, {'topic': 'Technology', 'relevance_score': '0.25'}, {'topic': 'Finance', 'relevance_score': '0.25'}]",Neutral,0.056272,TSLA
"'Most People Don't Have The Balls To Do It,' Says Mark Cuban, Praising Musk For Going 'All In' With His Own Money For His Startups - Tesla  ( NASDAQ:TSLA ) ","Billionaire investor Mark Cuban had high praise for Elon Musk last week, calling him possibly the greatest builder in modern manufacturing, while also challenging Musk's stance on tariffs. In a post on X, Cuban addressed Musk directly, writing: ""Hey @elonmusk, you may be the greatest ...",Benzinga,20250410T134523,"[{'topic': 'Economy - Monetary', 'relevance_score': '0.310843'}, {'topic': 'IPO', 'relevance_score': '0.158519'}, {'topic': 'Financial Markets', 'relevance_score': '0.214378'}, {'topic': 'Manufacturing', 'relevance_score': '1.0'}]",Somewhat-Bullish,0.306489,TSLA
"Stock Market News for Apr 10, 2025","U.S. stocks ended sharply higher on Wednesday, with all three major indexes recording one of their best days ever, after President Trump announced a 90-day pause on tariffs on most countries, bringing relief to markets that had come under extreme pressure over the past few sessions.",Zacks Commentary,20250410T132400,"[{'topic': 'Economy - Monetary', 'relevance_score': '0.576289'}, {'topic': 'Technology', 'relevance_score': '0.5'}, {'topic': 'Manufacturing', 'relevance_score': '0.5'}]",Neutral,0.113894,TSLA
"Amtech Systems, Tesla And Other Big Stocks Moving Lower In Thursday's Pre-Market Session - Amtech Systems  ( NASDAQ:ASYS ) , Antelope Ent Hldgs  ( NASDAQ:AEHL ) ","U.S. stock futures were lower this morning, with the Dow futures falling around 1% on Thursday. Shares of Amtech Systems Inc ASYS fell sharply in today's pre-market trading after the company cut its revenue forecast for the second quarter.",Benzinga,20250410T121832,"[{'topic': 'Financial Markets', 'relevance_score': '0.752319'}, {'topic': 'Manufacturing', 'relevance_score': '0.25'}, {'topic': 'Earnings', 'relevance_score': '0.108179'}, {'topic': 'Energy & Transportation', 'relevance_score': '0.25'}, {'topic': 'Real Estate & Construction', 'relevance_score': '0.25'}, {'topic': 'Technology', 'relevance_score': '0.25'}]",Neutral,-0.039152,TSLA
Prediction: Alphabet Will Spin Off Waymo Within 5 Years,"One of the most intriguing growth opportunities for Alphabet ( NASDAQ: GOOG ) ( NASDAQ: GOOGL ) these days is in robotaxis, via its Waymo business. It has the potential to revolutionize the taxi industry. Last year, it averaged 150,000 trips per week, and that number is going to climb even higher ...",Motley Fool,20250410T120000,"[{'topic': 'Financial Markets', 'relevance_score': '0.858979'}, {'topic': 'Manufacturing', 'relevance_score': '0.5'}, {'topic': 'Earnings', 'relevance_score': '0.158519'}, {'topic': 'Technology', 'relevance_score': '0.5'}]",Somewhat-Bullish,0.232909,TSLA
"Starlink's Challenges Threatens The High Valuation Of Elon Musk's SpaceX: Report - Tesla  ( NASDAQ:TSLA ) , Amazon.com  ( NASDAQ:AMZN ) ","Elon Musk's SpaceX has seen remarkable success with its satellite network, Starlink, but some experts question whether its current valuation is sustainable. What Happened: Starlink, a satellite network launched by SpaceX to sell broadband internet access, has achieved impressive growth since its ...",Benzinga,20250410T115218,"[{'topic': 'Financial Markets', 'relevance_score': '0.161647'}, {'topic': 'Manufacturing', 'relevance_score': '1.0'}]",Somewhat-Bullish,0.22336,TSLA
RC CLASS REMINDER: Ready Capital Investors are Reminded to Contact BFA Law about the Pending Class Action by the May 5 Court Deadline,"New York, New York-- ( Newsfile Corp. - April 10, 2025 ) - Leading securities law firm Bleichmar Fonti & Auld LLP announces that a lawsuit has been filed against Ready Capital Corporation ( NYSE: RC ) and certain of the Company's senior executives for potential violations of the federal ...",Business Insider,20250410T114600,"[{'topic': 'Real Estate & Construction', 'relevance_score': '0.5'}, {'topic': 'Financial Markets', 'relevance_score': '0.905476'}, {'topic': 'Manufacturing', 'relevance_score': '0.5'}]",Neutral,0.12932,TSLA
"TTD CLASS REMINDER: Trade Desk, Inc. Investors are Reminded to Contact BFA Law about the Pending Class Action by the April 21 Court Deadline","New York, New York-- ( Newsfile Corp. - April 10, 2025 ) - Leading securities law firm Bleichmar Fonti & Auld LLP announces that a lawsuit has been filed against The Trade Desk, Inc. ( NASDAQ: TTD ) and certain of the Company's senior executives for potential violations of the federal securities ...",Business Insider,20250410T114600,"[{'topic': 'Financial Markets', 'relevance_score': '0.905476'}, {'topic': 'Manufacturing', 'relevance_score': '0.5'}, {'topic': 'Earnings', 'relevance_score': '0.839681'}, {'topic': 'Technology', 'relevance_score': '0.5'}]",Neutral,0.13385,TSLA
