title,summary,source,time_published,topics,overall_sentiment_label,overall_sentiment_score,ticker
Zacks Investment Ideas feature highlights: Tesla,Tesla are part of the Zacks Investment Ideas article.,Zacks Commentary,20250403T140200,"[{'topic': 'Economy - Monetary', 'relevance_score': '0.158519'}, {'topic': 'Financial Markets', 'relevance_score': '0.996023'}, {'topic': 'Manufacturing', 'relevance_score': '1.0'}, {'topic': 'Earnings', 'relevance_score': '0.614606'}]",Neutral,0.062731,TSLA
Musk's DOGE Exit Rumors & Weak Q1 Deliveries: How to Play Tesla Now,"Musk is not leaving DOGE just yet, and TSLA's EV business is struggling. AV progress is now key to Tesla's comeback story.",Zacks Commentary,20250403T135100,"[{'topic': 'Financial Markets', 'relevance_score': '0.161647'}, {'topic': 'Manufacturing', 'relevance_score': '1.0'}]",Neutral,0.145971,TSLA
"Today's Trade Strategy For SPY, AAPL, MSFT, NVDA, GOOGL, META, TSLA","Good Morning Traders! In today's Market Clubhouse Morning Memo, we will discuss SPY, QQQ, AAPL, MSFT, NVDA, GOOGL, META, and TSLA. Our proprietary formula, exclusive to Market Clubhouse, dictates these price levels. This dynamic equation takes into account price, volume, and options flow.",Benzinga,20250403T134411,"[{'topic': 'Economy - Monetary', 'relevance_score': '0.310843'}, {'topic': 'Financial Markets', 'relevance_score': '0.413559'}, {'topic': 'Manufacturing', 'relevance_score': '0.5'}, {'topic': 'Technology', 'relevance_score': '0.5'}]",Neutral,0.129237,TSLA
"The Silver Lining In The Liberation Day Tariff Announcement - NVIDIA  ( NASDAQ:NVDA ) , RH  ( NYSE:RH ) ","The big Liberation Day Surprise was the size of the reciprocal tariffs announced by President Trump. While most assumed America's reciprocal tariffs would be based on the actual tariffs other countries levy on American products, the Trump Administration included ""currency manipulation and trade ...",Benzinga,20250403T133642,"[{'topic': 'Retail & Wholesale', 'relevance_score': '0.5'}, {'topic': 'Financial Markets', 'relevance_score': '0.929393'}, {'topic': 'Manufacturing', 'relevance_score': '0.5'}, {'topic': 'Earnings', 'relevance_score': '0.158519'}]",Neutral,0.101792,TSLA
Bruker Introduces Breakthrough d-DNP Polarizer: Stock to Gain?,BRKR announces first successful customer installation of novel d-DNP Polarizer at UCSF.,Zacks Commentary,20250403T132100,"[{'topic': 'Life Sciences', 'relevance_score': '0.333333'}, {'topic': 'Retail & Wholesale', 'relevance_score': '0.333333'}, {'topic': 'Financial Markets', 'relevance_score': '0.266143'}, {'topic': 'Manufacturing', 'relevance_score': '0.333333'}, {'topic': 'Earnings', 'relevance_score': '0.9973'}]",Somewhat-Bullish,0.210232,TSLA
Pony AI Teams Up With Luxembourg Transit Giant to Launch Level 4 Autonomous Vehicle Trials - Pony AI  ( NASDAQ:PONY ) ,"Pony.ai gets green light to begin Level 4 Robotaxi testing in Luxembourg with local transit partner Emile Weber Pony.ai expands EU footprint as it pilots autonomous vehicles in Luxembourg, joins elite club with China and U.S. permits The 'Trade of the Day' is now live.",Benzinga,20250403T130049,"[{'topic': 'Financial Markets', 'relevance_score': '0.214378'}, {'topic': 'Manufacturing', 'relevance_score': '0.5'}, {'topic': 'Earnings', 'relevance_score': '0.684621'}, {'topic': 'Technology', 'relevance_score': '0.5'}]",Somewhat-Bullish,0.246238,TSLA
ATKR FRAUD ALERT: Atkore Inc. 20% Stock Drop Triggers Class Action Lawsuit for Fraud - Investors are Notified to Contact BFA Law before April 23  ( NYSE:ATKR )  - Atkore  ( NYSE:ATKR ) ,"NEW YORK, April 03, 2025 ( GLOBE NEWSWIRE ) -- Leading securities law firm Bleichmar Fonti & Auld LLP announces that a lawsuit has been filed against Atkore Inc. ATKR and certain of the Company's senior executives for potential violations of the federal securities laws.",Benzinga,20250403T124700,"[{'topic': 'Earnings', 'relevance_score': '0.158519'}, {'topic': 'Financial Markets', 'relevance_score': '0.796627'}, {'topic': 'Manufacturing', 'relevance_score': '1.0'}]",Neutral,0.143112,TSLA
RC FRAUD ALERT: Ready Capital 27% Stock Drop Triggers Class Action Lawsuit for Fraud - Investors are Notified to Contact BFA Law before May 5  ( NYSE:RC )  - Ready Capital  ( NYSE:RC ) ,"NEW YORK, April 03, 2025 ( GLOBE NEWSWIRE ) -- Leading securities law firm Bleichmar Fonti & Auld LLP announces that a lawsuit has been filed against Ready Capital Corporation RC and certain of the Company's senior executives for potential violations of the federal securities laws.",Benzinga,20250403T124600,"[{'topic': 'Real Estate & Construction', 'relevance_score': '0.5'}, {'topic': 'Financial Markets', 'relevance_score': '0.918141'}, {'topic': 'Manufacturing', 'relevance_score': '0.5'}]",Somewhat-Bullish,0.177041,TSLA
"FLNC FRAUD ALERT: Fluence Energy, Inc. 46% Stock Drop Triggers Class Action Lawsuit for Fraud - Investors are Notified to Contact BFA Law before May 12  ( NASDAQ:FLNC )  - Fluence Energy  ( NASDAQ:FLNC ) ","NEW YORK, April 03, 2025 ( GLOBE NEWSWIRE ) -- Leading securities law firm Bleichmar Fonti & Auld LLP announces that a lawsuit has been filed against Fluence Energy, Inc. FLNC and certain of the Company's senior executives for potential violations of the federal securities laws.",Benzinga,20250403T124600,"[{'topic': 'Financial Markets', 'relevance_score': '0.905476'}, {'topic': 'Manufacturing', 'relevance_score': '0.5'}, {'topic': 'Earnings', 'relevance_score': '0.986564'}, {'topic': 'Technology', 'relevance_score': '0.5'}]",Neutral,0.087595,TSLA
TMDX FRAUD ALERT: TransMedics Group 30% Stock Drop Triggers Class Action Lawsuit for Fraud - Investors are Notified to Contact BFA Law before April 15  ( NASDAQ:TMDX )  - TransMedics Group  ( NASDAQ:TMDX ) ,"NEW YORK, April 03, 2025 ( GLOBE NEWSWIRE ) -- Leading securities law firm Bleichmar Fonti & Auld LLP announces that a lawsuit has been filed against TransMedics Group, Inc. TMDX and certain of the Company's senior executives for potential violations of the federal securities laws.",Benzinga,20250403T124600,"[{'topic': 'Life Sciences', 'relevance_score': '0.5'}, {'topic': 'Financial Markets', 'relevance_score': '0.87644'}, {'topic': 'Manufacturing', 'relevance_score': '0.5'}]",Neutral,0.113596,TSLA
"TBBK FRAUD ALERT: The Bancorp, Inc. 28% Stock Drop Triggers Class Action Lawsuit for Fraud - Investors are Notified to Contact BFA Law before May 16  ( NASDAQ:TBBK )  - Bancorp  ( NASDAQ:TBBK ) ","NEW YORK, April 03, 2025 ( GLOBE NEWSWIRE ) -- Leading securities law firm Bleichmar Fonti & Auld LLP announces that a lawsuit has been filed against The Bancorp, Inc. TBBK and certain of the Company's senior executives for potential violations of the federal securities laws.",Benzinga,20250403T124600,"[{'topic': 'Financial Markets', 'relevance_score': '0.980922'}, {'topic': 'Manufacturing', 'relevance_score': '0.5'}, {'topic': 'Earnings', 'relevance_score': '0.310843'}, {'topic': 'Finance', 'relevance_score': '0.5'}]",Neutral,0.063319,TSLA
Tesla Rival Lucid Raises $1 Billion Via Convertible Debt To Refinance 2026 Notes And Boost Financial Flexibility - Lucid Group  ( NASDAQ:LCID ) ,"Lucid prices $1B convertible senior notes offering at 5%, plans buyback of earlier debt due in 2026. Lucid sees 50% of recent orders from former Tesla owners amid rising frustration with Elon Musk. 2/2",Benzinga,20250403T123256,"[{'topic': 'Financial Markets', 'relevance_score': '0.99676'}, {'topic': 'Manufacturing', 'relevance_score': '0.25'}, {'topic': 'Real Estate & Construction', 'relevance_score': '0.25'}, {'topic': 'Technology', 'relevance_score': '0.25'}, {'topic': 'Finance', 'relevance_score': '0.25'}]",Somewhat-Bullish,0.188032,TSLA
"RH Posts Downbeat Earnings, Joins Apple, Tesla, Nvidia And Other Big Stocks Moving Lower In Thursday's Pre-Market Session - Apple  ( NASDAQ:AAPL ) , AdvanSix  ( NYSE:ASIX ) ","U.S. stock futures were lower this morning, with the Dow futures falling more than 1,000 points on Thursday. Shares of RH RH fell sharply in today's pre-market trading after the company reported weaker-than-expected fourth-quarter financial results.",Benzinga,20250403T122440,"[{'topic': 'Life Sciences', 'relevance_score': '0.2'}, {'topic': 'Technology', 'relevance_score': '0.2'}, {'topic': 'Finance', 'relevance_score': '0.2'}, {'topic': 'IPO', 'relevance_score': '0.158519'}, {'topic': 'Retail & Wholesale', 'relevance_score': '0.2'}, {'topic': 'Financial Markets', 'relevance_score': '0.82617'}, {'topic': 'Manufacturing', 'relevance_score': '0.2'}, {'topic': 'Earnings', 'relevance_score': '0.744043'}]",Neutral,-0.08803,TSLA
Tesla  ( TSLA )  Moves 5.3% Higher: Will This Strength Last?,Tesla (TSLA) saw its shares surge in the last session with trading volume being higher than average. The latest trend in earnings estimate revisions may not translate into further price increase in the near term.,Zacks Commentary,20250403T120100,"[{'topic': 'Earnings', 'relevance_score': '0.976913'}, {'topic': 'Financial Markets', 'relevance_score': '0.316726'}, {'topic': 'Manufacturing', 'relevance_score': '1.0'}]",Somewhat-Bullish,0.175422,TSLA
Rivian Q1 Deliveries Decline Y/Y Amid Weaker Demand for EV,"RIVN's deliveries drop to 8,640 vehicles from 13,588 in the same period last year due to sluggish demand for EV.",Zacks Commentary,20250403T110900,"[{'topic': 'Economy - Monetary', 'relevance_score': '0.158519'}, {'topic': 'Manufacturing', 'relevance_score': '0.5'}, {'topic': 'Earnings', 'relevance_score': '0.77141'}, {'topic': 'Technology', 'relevance_score': '0.5'}]",Neutral,0.043311,TSLA
"If You'd Invested $10,000 in Tesla Stock 10 Years Ago, Here's How Much You'd Have Today","Let's end the suspense. If you'd invested $10,000 in Tesla 10 years ago, you would have an incredible $215,600 at recent prices, an annualized growth rate of nearly 36%.Tesla ( NASDAQ: TSLA ) is the second-best-performing ""Magnificent Seven"" stock over the last decade, behind only Nvidia, and its ...",Motley Fool,20250403T102200,"[{'topic': 'Earnings', 'relevance_score': '0.158519'}, {'topic': 'Financial Markets', 'relevance_score': '0.684621'}, {'topic': 'Manufacturing', 'relevance_score': '1.0'}]",Neutral,0.102298,TSLA
"Elon Musk, White House Deny Reports Of Tesla CEO's Early Exit From Trump Team - Tesla  ( NASDAQ:TSLA ) ",Tesla Inc. TSLA CEO Elon Musk has denied rumors of his premature departure from the Donald Trump administration. This comes despite his recent unpopularity influencing a state supreme court race.,Benzinga,20250403T102115,"[{'topic': 'Technology', 'relevance_score': '0.5'}, {'topic': 'Financial Markets', 'relevance_score': '0.161647'}, {'topic': 'Manufacturing', 'relevance_score': '0.5'}]",Neutral,0.034064,TSLA
"US Stock Likely To Open Lower Following Trump's Tariffs: 'Worse Than The Worst Case Scenario,' Says Analyst - Acuity  ( NYSE:AYI ) , Conagra Brands  ( NYSE:CAG ) ",U.S. stock futures plummeted on Thursday after advancing on Wednesday. Futures of major benchmark indices were down over 2-3% in premarket trading.,Benzinga,20250403T100816,"[{'topic': 'Energy & Transportation', 'relevance_score': '0.25'}, {'topic': 'Finance', 'relevance_score': '0.25'}, {'topic': 'Economy - Monetary', 'relevance_score': '0.158519'}, {'topic': 'Retail & Wholesale', 'relevance_score': '0.25'}, {'topic': 'Financial Markets', 'relevance_score': '0.99393'}, {'topic': 'Manufacturing', 'relevance_score': '0.25'}, {'topic': 'Earnings', 'relevance_score': '0.996718'}, {'topic': 'Economy - Macro', 'relevance_score': '0.158519'}]",Neutral,-0.034144,TSLA
"Dow Jumps Over 200 Points As Tesla Surges Over 5%: Investor Sentiment Improves, But Greed Index Remains In 'Extreme Fear' Zone - Acuity  ( NYSE:AYI ) , Conagra Brands  ( NYSE:CAG ) ","The CNN Money Fear and Greed index showed some improvement in the overall market sentiment, while the index remained in the ""Extreme Fear"" zone on Wednesday. U.S. stocks settled higher on Wednesday, with the Dow Jones index gaining more than 200 points during the session ahead of the announcement ...",Benzinga,20250403T081441,"[{'topic': 'Financial Markets', 'relevance_score': '0.214378'}, {'topic': 'Manufacturing', 'relevance_score': '0.5'}, {'topic': 'Earnings', 'relevance_score': '0.158519'}, {'topic': 'Energy & Transportation', 'relevance_score': '0.5'}]",Neutral,-0.019543,TSLA
Warren Buffett Owns an EV Stock That Is Starting to Eat Tesla's Lunch,"While many investors hold great respect for Warren Buffett, they may also view him as more of a traditional investor. But the Oracle of Omaha is not afraid to buy trendy technology and artificial intelligence stocks if he thinks they meet his well-known criteria of being wonderful companies at ...",Motley Fool,20250403T081400,"[{'topic': 'Earnings', 'relevance_score': '0.650727'}, {'topic': 'Finance', 'relevance_score': '0.5'}, {'topic': 'Manufacturing', 'relevance_score': '0.5'}]",Somewhat-Bullish,0.171924,TSLA
"Nvidia Has Ceded Its Spot as the No. 1 Holding on Robinhood to a Company Expected to Skyrocket 900%, According to a Prominent Money Manager",Retail investors' most widely held stock on Robinhood is a company known for its groundbreaking innovation in a number of industries.,Motley Fool,20250403T074100,"[{'topic': 'Earnings', 'relevance_score': '0.360215'}, {'topic': 'Financial Markets', 'relevance_score': '1.0'}, {'topic': 'Manufacturing', 'relevance_score': '1.0'}]",Somewhat-Bullish,0.216205,TSLA
China EVs: Tesla's first-quarter deliveries slump 22% to a 3-year low,"Output from the Shanghai Gigafactory dropped to 172,754 units in the first three months of the year from 220,876 a year earlier.",South China Morning Post,20250403T070834,"[{'topic': 'Manufacturing', 'relevance_score': '1.0'}]",Neutral,-0.028904,TSLA
"Tesla Brand Won't Suffer From Elon Musk's 'Antics,' Says Analyst Despite Delivery Miss, 8% Stock Drop In After-Hours Trading - Lucid Group  ( NASDAQ:LCID ) , NIO  ( NYSE:NIO ) ",New Street Research analyst Pierre Ferragu defended his position on Wednesday that negative publicity surrounding CEO Elon Musk won't harm Tesla Inc. TSLA in the medium term.,Benzinga,20250403T054423,"[{'topic': 'Real Estate & Construction', 'relevance_score': '0.5'}, {'topic': 'Financial Markets', 'relevance_score': '0.996023'}, {'topic': 'Manufacturing', 'relevance_score': '0.5'}]",Neutral,-0.019657,TSLA
Elon Musk's Neuralink seeks patients globally to try its brain chips,Elon Musk's computer-chip brain implant company Neuralink is seeking patients all around the world to trial its device that allows one's thoughts to control a computer.Neuralink is looking for people with quadriplegia - those who are not able to use their arms or legs - to sign up for a clinical ...,Cointelegraph,20250403T025340,"[{'topic': 'Manufacturing', 'relevance_score': '1.0'}]",Somewhat-Bullish,0.164522,TSLA
"Nvidia, AMD, Apple, Meta, Tesla: Why These 5 Stocks Are Trending On Trump's Liberation Day - Apple  ( NASDAQ:AAPL ) , Advanced Micro Devices  ( NASDAQ:AMD ) ","Markets faced a turbulent day as President Donald Trump unveiled new tariffs on ""Liberation Day,"" sparking a sharp selloff. The S&P 500 futures dropped 2.7% to 5,557.75, while Nasdaq futures fell 3.3% to 19,905.75.",Benzinga,20250403T023337,"[{'topic': 'Technology', 'relevance_score': '0.5'}, {'topic': 'Financial Markets', 'relevance_score': '0.999976'}, {'topic': 'Manufacturing', 'relevance_score': '0.5'}]",Neutral,0.10395,TSLA
"Self-driving Cars Market worth 76,217 thousand units in 2035, Globally, at a CAGR of 6.8%, says MarketsandMarkets","Delray Beach, FL, April 02, 2025 ( GLOBE NEWSWIRE ) -- Self-Driving Cars Market is projected to reach from 37,090 thousand units in 2024 to 76,217 thousand units in 2035, at a CAGR of 6.8%, as per the recent study by MarketsandMarkets.",Benzinga,20250403T013000,"[{'topic': 'Financial Markets', 'relevance_score': '0.161647'}, {'topic': 'Manufacturing', 'relevance_score': '1.0'}]",Somewhat-Bullish,0.334434,TSLA
Panicking Over Trump's Tariffs? 2 Warren Buffett Pearls of Wisdom to Remember,Here are Buffett's words on investing through a crisis.,Motley Fool,20250403T004900,"[{'topic': 'Financial Markets', 'relevance_score': '0.999355'}, {'topic': 'Manufacturing', 'relevance_score': '0.333333'}, {'topic': 'Technology', 'relevance_score': '0.333333'}, {'topic': 'Finance', 'relevance_score': '0.333333'}]",Neutral,0.148382,TSLA
Looking Ahead to the Q1 Earnings Season,"Total 2025 Q1 earnings for the S&P 500 index are expected to be up +5.9% from the same period last year on +3.9% higher revenues, continuing the recent growth pace nicely. Next week, we'll hear from the big banks.",Zacks Commentary,20250403T000400,"[{'topic': 'Retail & Wholesale', 'relevance_score': '0.333333'}, {'topic': 'Manufacturing', 'relevance_score': '0.333333'}, {'topic': 'Earnings', 'relevance_score': '1.0'}, {'topic': 'Technology', 'relevance_score': '0.333333'}]",Somewhat-Bullish,0.205084,TSLA
Looking Ahead to the Q1 Earnings Season,"Total 2025 Q1 earnings for the S&P 500 index are expected to be up +5.9% from the same period last year on +3.9% higher revenues, continuing the recent growth pace nicely. Next week, we'll hear from the big banks.",Zacks Commentary,20250403T000200,"[{'topic': 'Retail & Wholesale', 'relevance_score': '0.333333'}, {'topic': 'Manufacturing', 'relevance_score': '0.333333'}, {'topic': 'Earnings', 'relevance_score': '1.0'}, {'topic': 'Technology', 'relevance_score': '0.333333'}]",Somewhat-Bullish,0.205084,TSLA
Treasury Secretary Bessent says market woes are more about tech stock sell-off than Trump's tariffs,"""The Nasdaq peaked on DeepSeek day so that's a Mag 7 problem, not a MAGA problem,"" Bessent said.",CNBC,20250402T224213,"[{'topic': 'Economy - Monetary', 'relevance_score': '0.158519'}, {'topic': 'Financial Markets', 'relevance_score': '0.839681'}, {'topic': 'Manufacturing', 'relevance_score': '0.5'}, {'topic': 'Technology', 'relevance_score': '0.5'}]",Neutral,0.007271,TSLA
Tesla Q1 Deliveries Miss: 6 Reasons the Stock has Bottomed Anyway,"Despite missing Q1 delivery expectations, several factors suggest that the worst may be priced into Tesla's stock. Stock Strategist Andrew Rocco explains.",Zacks Commentary,20250402T210000,"[{'topic': 'Finance', 'relevance_score': '0.5'}, {'topic': 'Financial Markets', 'relevance_score': '0.858979'}, {'topic': 'Manufacturing', 'relevance_score': '0.5'}]",Neutral,0.036387,TSLA
Why Shares of Tesla Bobbed and Weaved Today: Is the Stock Back on Track?,"Shares of the electric carmaker Tesla ( NASDAQ: TSLA ) started this morning in the red only to reverse course and work their way firmly into positive territory, with shares trading 5% higher as of 2:15 p.m. ET today. There was a lot of news about Tesla, including first-quarter deliveries and ...",Motley Fool,20250402T190916,"[{'topic': 'Earnings', 'relevance_score': '0.310843'}, {'topic': 'Financial Markets', 'relevance_score': '0.266143'}, {'topic': 'Manufacturing', 'relevance_score': '1.0'}]",Neutral,-0.048053,TSLA
Tesla Shares Plunge as Musk's Political Ties Stir Controversy - Tesla  ( NASDAQ:TSLA ) ,"Tesla stock has slid nearly 30% amid concerns over Musk's political involvement. The EV maker's deliveries fell to 336,681 from 386,810 in the same period last year. The 'Trade of the Day' is now live. Get a high-probability setup with clear entry and exit points right here. Tesla, Inc.",Benzinga,20250402T190035,"[{'topic': 'Financial Markets', 'relevance_score': '0.459462'}, {'topic': 'Manufacturing', 'relevance_score': '1.0'}]",Neutral,0.052937,TSLA
Tesla's Deliveries Are Down Sharply. Is it Time to Worry?,Protests and boycotts have driven many EV buyers to look elsewhere. Has Tesla's growth story stalled?,Motley Fool,20250402T185400,"[{'topic': 'Financial Markets', 'relevance_score': '0.108179'}, {'topic': 'Manufacturing', 'relevance_score': '1.0'}]",Neutral,-0.102724,TSLA
"Trump administration puts 25% tariff on all canned beer imports, empty aluminum cans","Canned beer imports will be subject to a 25% tariff, putting pressure on Constellation Brands' bottom line.",CNBC,20250402T184637,"[{'topic': 'Financial Markets', 'relevance_score': '0.161647'}, {'topic': 'Manufacturing', 'relevance_score': '1.0'}]",Somewhat-Bullish,0.169795,TSLA
"Musk Needs To 'Navigate Brand Crisis Or Else,"" Warns Analyst, Tesla 'Delivery Number Was A Disaster For The Bulls' - Tesla  ( NASDAQ:TSLA ) ",A Tesla analyst is sending warnings that Elon Musk may have hurt the brand and needs to move on from his White House role. The analyst sees Tesla at a fork in the road with Musk likely needing to make some tough choices. The 'Trade of the Day' is now live.,Benzinga,20250402T174757,"[{'topic': 'Financial Markets', 'relevance_score': '0.214378'}, {'topic': 'Manufacturing', 'relevance_score': '1.0'}]",Neutral,-0.141966,TSLA
Trump told Cabinet that Elon Musk will leave administration in coming months,"President Trump told reporters this week that DOGE chief Elon Musk has done an ""amazing"" job, but noted that the Tesla CEO has ""got a big company to run."" ...",CNBC,20250402T172846,"[{'topic': 'Real Estate & Construction', 'relevance_score': '0.5'}, {'topic': 'Manufacturing', 'relevance_score': '0.5'}]",Neutral,0.115602,TSLA
Why Tesla Stock Is Soaring Today,"Shares of Tesla ( NASDAQ: TSLA ) are rebounding on Wednesday. The electric vehicle maker's stock gained 5.1% as of 12:22 p.m. ET after falling as much as 6.4% earlier in the day. The recovery comes as the S&P 500 and Nasdaq Composite gained 0.5% and 0.9%, respectively.A report suggesting CEO Elon ...",Motley Fool,20250402T171839,"[{'topic': 'Financial Markets', 'relevance_score': '0.214378'}, {'topic': 'Manufacturing', 'relevance_score': '1.0'}]",Neutral,0.02652,TSLA
Is Elon Musk Leaving DOGE Role? Trump Tells Cabinet Move Could Happen Soon: Report - Tesla  ( NASDAQ:TSLA ) ,Elon Musk's time leading the White House administration in looking for fraud and cutting government spending could be coming to an end. Tesla stock jumped on a report that Musk's role with the White House could be minimized. The 'Trade of the Day' is now live.,Benzinga,20250402T171341,"[{'topic': 'Earnings', 'relevance_score': '0.158519'}, {'topic': 'Financial Markets', 'relevance_score': '0.365926'}, {'topic': 'Manufacturing', 'relevance_score': '1.0'}]",Somewhat-Bullish,0.171483,TSLA
"Gold Outshines Tech Stocks And Bitcoin, As Bulls And Bears Battle Ahead Of Trump Tariff Announcement","Please click here for an enlarged chart comparing Invesco QQQ Trust Series 1 ( QQQ ) , SPDR S&P 500 ETF Trust ( SPY ) which represents the benchmark stock market index S&P 500 ( SPX ) , iShares Bitcoin Trust ETF ( IBIT ) , and SPDR Gold Trust ( GLD ) .",Benzinga,20250402T161544,"[{'topic': 'Economy - Monetary', 'relevance_score': '0.158519'}, {'topic': 'Financial Markets', 'relevance_score': '1.0'}, {'topic': 'Manufacturing', 'relevance_score': '0.333333'}, {'topic': 'Technology', 'relevance_score': '0.333333'}, {'topic': 'Finance', 'relevance_score': '0.333333'}]",Somewhat-Bullish,0.223262,TSLA
"Bitcoin, Stocks Surge After Report That DOGE Boss Elon Musk Will Leave Trump Orbit",Is DOGE head Elon Musk about to step away from his supporting role alongside President Trump? Traders are responding positively to a report.,Decrypt.co,20250402T160824,"[{'topic': 'Blockchain', 'relevance_score': '0.158519'}, {'topic': 'Financial Markets', 'relevance_score': '0.77141'}, {'topic': 'Manufacturing', 'relevance_score': '1.0'}]",Neutral,0.126261,TSLA
Tesla shares rise on unconfirmed report Elon Musk could be leaving DOGE post soon,Tesla shares rose after Politico reported that CEO Elon Musk could leave his post at the so-called Department of Government Efficiency.,CNBC,20250402T155943,"[{'topic': 'Financial Markets', 'relevance_score': '0.266143'}, {'topic': 'Manufacturing', 'relevance_score': '1.0'}]",Neutral,-0.012172,TSLA
Tesla First-Quarter Deliveries Fall Short; Trump Tariffs in Focus,Tesla's Q1 delivery figure represented a 13% decline from a year ago.,Zacks Commentary,20250402T153900,"[{'topic': 'Economy - Monetary', 'relevance_score': '0.158519'}, {'topic': 'Financial Markets', 'relevance_score': '0.990999'}, {'topic': 'Manufacturing', 'relevance_score': '1.0'}, {'topic': 'Earnings', 'relevance_score': '0.614606'}]",Neutral,0.043502,TSLA
Bitcoin Awaits Trump Tariff Move As Optimism Grows; Tesla Slips In March While Rivals Gain; Novo Nordisk Investor Earns $9B From Soaring Weight Loss Drug Sales - Top Headlines While The U.S. Slept,"Peter Schiff Calls Bitcoin 'Digital Risk' Amid Tariff Fears: 'If It Were Truly Digital Gold' Circle's Revenue Grows, But IPO Filing Shows Falling Profitability Why Are Dogecoin, Shiba Inu Down Over 15% In The Past Week? Bitcoin Braces For Trump Tariff Announcement: 'Short-Term Optimism' Has ...",Benzinga,20250402T150711,"[{'topic': 'Life Sciences', 'relevance_score': '0.333333'}, {'topic': 'Technology', 'relevance_score': '0.333333'}, {'topic': 'Blockchain', 'relevance_score': '0.158519'}, {'topic': 'IPO', 'relevance_score': '0.451494'}, {'topic': 'Financial Markets', 'relevance_score': '0.999967'}, {'topic': 'Manufacturing', 'relevance_score': '0.333333'}, {'topic': 'Earnings', 'relevance_score': '0.538269'}]",Neutral,0.07355,TSLA
Musk's government-efficiency blockchain: What could go wrong and what could go right?,"Opinion by: James Strudwick, executive director, Starknet FoundationThe outlook surrounding the use of new technologies has shifted in Washington. Tesla CEO and presidential adviser Elon Musk's proposition to incorporate blockchain technology into the US Treasury has placed blockchain and its use ...",Cointelegraph,20250402T150000,"[{'topic': 'Blockchain', 'relevance_score': '0.998626'}, {'topic': 'Manufacturing', 'relevance_score': '1.0'}]",Neutral,0.115137,TSLA
